"Inequality: What has happened, why care, and what can be done","Inequality within most developed countries is higher today than it was 30 years ago. Growth in emerging economies has reduced inequality between nations, but the benefits have been unevenly spread within those economies. This column analyses what has happened…",2020-06-17
How to make Joe Biden’s administration the most progressive in history,"On March 17, Jon Favreau, a former Obama administration official well known for co-hosting the popular Pod Save America podcast, tweeted: “Joe Biden will run on the most progressive platform…",2020-06-17
Inslee: Draconian cuts in state service if no help from Congress,"""Draconian"" cuts coming in state services if Congress does not pass another aid package, Washington Gov. Jay  Inslee warns.  He is furloughing state workers, has canceled pay hike for 5,66 employees, and vetoed $450 million in spending last month.",2020-06-17
"Under pressure: Big risks, few answers on reopening schools","Governors promise to put kids back in class in a matter of weeks, but school officials are largely stuck navigating the messy details.",2020-06-17
New Opportunities for Hosted IP Telephony and UCaaS in the CALA Region as Remote Working Increases Amid COVID-19 Lockdowns,"DUBLIN, June 17, 2020 /PRNewswire/ -- The ""Hosted IP Telephony and UCaaS Market in Latin America and the Caribbean, 2020"" report has been added to ResearchAndMarkets.com's offering. The Latin America and Caribbean (CALA) UCaaS market exhibited a strong, doubl…",2020-06-17
World Sickle Cell Day 2020: Novartis Takes Further Steps to Make Sickle Cell Disease a Healthcare Priority in Europe,"BASEL, Switzerland--(BUSINESS WIRE)--STRICTLY FOR EUROPEAN MEDICAL AND PHARMACEUTICAL TRADE MEDIA ONLY Many patients with SCD only live into their 40s and endure unpredictable pain crises which disrupt their lives physically, socially and emotionally.1 It is …",2020-06-17
She Built a Shady Guru’s YouTube Army. Now She’s His Fiercest Critic — But Who Will Believe Her?,"It was May 2015, and the Hotel Surya in Varanasi, India, was hosting “Inner Awakening,” the flagship spiritual training program of Paramahamsa Nithyananda. To his followers, he is a god incarnate, “His Divine Holiness Bhagavan Sri Nithyananda Paramashivam,” t…",2020-06-17
"House, Senate jockey for leverage in police reform debate",Lawmakers are jockeying for leverage on police reform legislation as they face intense pressure to act in the wake of George Floyd's death in Minneapolis.Both House Democrats and Senate Republicans took steps forwa...,2020-06-17
"House, Senate jockeys for leverage in police reform debate",Lawmakers are jockeying for leverage on police reform legislation as they face intense pressure to act in the wake of George Floyd's death in Minneapolis.Both House Democrats and Senate Republicans took steps forwa...,2020-06-17
"Hillicon Valley: Senate Republicans, DOJ target Section 230 | Facial recognition under the spotlight | Zoom launches E2E encrypted beta","Welcome to Hillicon Valley, The Hill's newsletter detailing all you need to know about the tech and cyber news from Capitol Hill to Silicon Valley. If you don't already, be sure to sign up for our newsletter with this ...",2020-06-17
SEC Chairman Jay Clayton says Americans need financial literacy now more than ever,"As market trading soars in spite of coronavirus and stock deals like the planned one from bankrupt Hertz attract notice, SEC Chair Jay Clayton says the need for financial literacy is greater than ever.",2020-06-17
"Centene Recommends Stockholders Reject ""Mini-Tender"" Offer by TRC Capital Investment Corporation","ST. LOUIS, June 17, 2020 /PRNewswire/ -- Centene Corporation (NYSE: CNC) today announced that it has been notified of an unsolicited ""mini-tender"" offer by TRC Capital Investment Corporation (""TRC Capital"") to purchase up to 2,000,000 shares of Centene's comm…",2020-06-17
"Centene Recommends Stockholders Reject ""Mini-Tender"" Offer by TRC Capital Investment Corporation","Centene Corporation (NYSE: CNC) today announced that it has been notified of an unsolicited ""mini-tender"" offer by TRC Capital Investment Corporation (""TRC Capital"") to purchase up to 2,000,000 shares of Centene's common stock at an offer price of $59.00 net …",2020-06-17
"No, Trump can’t defy the laws of gravity",Underestimating Biden is at least as foolish as overrating Trump.,2020-06-17
"New social norms, disruption to routines: Trying times for autistic community as Malaysia enters COVID-19 recovery phase","KUALA LUMPUR: These days, mornings start at 7am for Mohd Adli Yahya, 56, and his son, Luqman Shariff Mohd Adli, 21. 

The two of them then head to the supermarket at 8am to purchase ingredients such as chicken, onions and spices for their ayam percik catering…",2020-06-17
"San Diego schools reopening with in-person, online, hybrid options",San Diego schools are reopening with three different learning options parents can choose for their kids during the coronavirus pandemic.,2020-06-17
"Coronavirus: Government risks 'failing a generation' if schools not reopened soon, doctors warn","'It is our most vulnerable children, such as those from disadvantaged families or those with additional needs, who may suffer most', paediatrician warns",2020-06-17
COVID and Conspiracy Theories: Excerpt from ‘Together Apart’,"It is to get rid of non-productive Chinese in the Chinese community, who are non-productive and in the words of George Bernard Shaw should be eliminated so they don’t have to be fed. Secondly, it i",2020-06-17
Commentary: Welcome to the post-coronavirus United States of despair,"Those entering the US labour market in 2020 will have a lower earnings path throughout their working lives, say two observers.",2020-06-17
EWA: A Contentious Aussie-China Relationship Will Be A Headwind,"EWA has been under-performing the S&P 500, and Australia's benchmark index has also been lagging its regional peers. The fund's June dividend saw a sharp year-o",2020-06-17
3 Growth Tech Stocks to Buy Now Despite Coronavirus Reopening Nerves,Let's dive into three growth-focused tech stocks that are poised to expand during the coronavirus economic downturn and well after...,2020-06-17
"JANET STREET-PORTER: Exhausted, bumbling Boris's winging it is a disaster for Britain","JANET STREET-PORTER: A well mannered polite young footballer has shamed a leader old enough to be his dad. And right now, I know who I'd rather have running Britain.",2020-06-17
About 150 Businesses Damaged In Unrest To Receive Surprise Relief Checks - CBS Minnesota,"Urban Ventures typically focuses on education and parental support, but with COVID-19 and a Lake Street location, they've shifted to feeding thousands of people through donations.",2020-06-17
It's impossible to know how many Arizona restaurants have positive COVID cases. Here's why,"Metro Phoenix restaurants continue to close due to COVID-19 cases, but unenforced guidelines are working, the Arizona Restaurant Association says.",2020-06-17
Ohio Minority Business Panel focuses on listening to needs of Valley leaders - WKBN.com,"To create a discussion on how to help businesses get back on their feet or even start from scratch, Ohio’s secretary of state met virtually with Valley leaders.",2020-06-17
PRC says clash all India's fault as gruesome details emerge; Beijing outbreak; Xi announces some African debt relief; Fu Ying on US-China,The PRC is blaming the Indians for the deadly border conflict while still not confirming or releasing any details on PLA casualties - Chinese FM urges closer China-India communication to maintain border peace - Xinhua In a telephone conversation with Indian E…,2020-06-17
P.E.I. deficit balloons to $173 million as finance minister blames COVID-19,"CHARLOTTETOWN - The COVID-19 pandemic has blown a hole through the public finances of Prince Edward Island, with the province announcing Wednesday a b...",2020-06-17
"At Cisco Live, CEO Chuck Robbins delivers a strong societal message","For decades, Cisco Systems Inc.’s stated purpose has been to use technology to “Change the way we work, live, learn and play.” Sure, the taglines have changed as Cisco has been known for things like “Empowering the Internet Generation,” welcoming us to the “H…",2020-06-17
"Chipotle Mexican Grill, Inc. (CMG) CEO Brian Niccol Presents at Evercore ISI Virtual Consumer & Retail Summit Conference (Transcript)","Chipotle Mexican Grill, Inc. (NYSE:CMG) Evercore ISI Virtual Consumer & Retail Summit Conference June 17, 2020 12:30 PM ET Company Participants Brian Niccol",2020-06-17
Racial Injustice and the Pandemic Are Inextricably Linked,"“I want to express my discomfort that we, as privileged white people, are discussing racial injustice without African American speakers on this panel. I want us to reckon with that,” said Alison Arieff, research and creative director at SPUR and… Continue rea…",2020-06-17
Slideshow: Overall winners of Sony World Photography Awards 2020,"Winners of Sony World Photography Awards 2020
<table>

<tr>
<td></td>
</tr>


</table>
We've covered quite a few Sony World Photography competitions in the past 5 months. From the Open Competition, to National Award Winners, and recent Finalist and Shortlist…",2020-06-17
News24.com | OPINION | Businesses can make a better world post Covid-19 - and that includes SOEs,"As businesses are called on to assist during the Covid-19 pandemic, SOEs can leverage their existing infrastructure to help, says Ayanda Shezi.",2020-06-17
Guiding Young Businesses to Success - NC State News,NC State Entrepreneurship's experiential programs and funding opportunities help students turn ideas into reality.,2020-06-17
Congress targets COVID cyber fraud,"In addition to loss of life and economic costs, COVID-19 pandemic has also become a cottage industry for cyber-enabled fraud and other schemes. According to FBI Deputy Assistant Director Tonya Ugoretz, the number of daily complaints to their Internet Crime Co…",2020-06-17
FS KKR Capital Corp. II Announces Listing on New York Stock Exchange,"PHILADELPHIA and NEW YORK, June 17, 2020 /PRNewswire/ -- FS KKR Capital Corp. II (FSKR), a leading business development company (BDC) focused on providing customized credit solutions to private middle market U.S. companies, announced today that its shares of …",2020-06-17
FS KKR Capital Corp. II Announces Listing on New York Stock Exchange,"FS KKR Capital Corp. II (FSKR), a leading business development company (BDC) focused on providing customized credit solutions to private middle market U.S. companies, announced today that its shares of common stock commenced trading on the New York Stock Exch…",2020-06-17
"This 90-year-old New York activist fought racist housing practices, was a nurse during the AIDS epidemic, and is now protesting for Black Lives Matter","<ul>
<li>Lifelong New York activist Shatzi Weisberger is refusing to let age, curfew, or nosy neighbors discourage her from fighting for what she believes in.</li>
<li>As a young adult, she fought racist redlining practices that prevented Black people from ho…",2020-06-17
A long way to the top: Australian musicians balance multiple roles to make their careers work,"Australian musicians make it work by balancing music and non-music jobs, self-employment, contracts, and a love for the art.",2020-06-17
"Elder Jeffery R. Holland hospitalized, COVID-19 not a factor","Elder Jeffrey R. Holland of the Quorum of the Twelve Apostles of The Church of Jesus Christ of Latter-day Saints was admitted to the hospital last week following several days of illness, according to a statement released Wednesday.",2020-06-17
"‘India is inadequately industrialised, inadequately skilled… coronavirus leaves no choice for India but to change’","In this E-Xplained event on Zoom, Manish Sabharwal, chairman & co-founder of the staffing and human capital firm Teamlease Services, and Director, RBI Central Board, discusses lockdown, unlockdown and jobs.",2020-06-17
OFN Awards First Round Of Grow With Google Small Business Fund Loans And Google.org Grants To Help Small Businesses Recover Nationwide,"WASHINGTON, June 17, 2020 /PRNewswire/ -- Today, Opportunity Finance Network (OFN) announced the first round of Grow with Google Small Business Fund loans and grants from Google.org. Five community development financial institutions (CDFIs) have received a to…",2020-06-17
OFN Awards First Round Of Grow With Google Small Business Fund Loans And Google.org Grants To Help Small Businesses Recover Nationwide,"OFN Awards First Round Of Grow With Google Small Business Fund Loans And Google.org Grants To Help Small Businesses Recover NationwidePR NewswireWASHINGTON, June 17, 2020Opportunity Finance Network (OFN) announces $15.",2020-06-17
Helping small businesses get access to capital,"Since the start of the COVID-19 pandemic, we have been actively working on ways to support communities and small businesses in the United States and around the world. In March, we announced the $125 million Grow with Google Small Business Fund as one way to o…",2020-06-17
Helping small businesses get access to capital,"Since the start of the COVID-19 pandemic, we have been actively working on ways to support communities and small businesses in the United States and around the world. In March, we announced the $125 million Grow with Google Small Business Fund as one way to o…",2020-06-17
The 25 most innovative CMOs in the world in 2020,"<ul>
<li>The advertising industry is changing radically.</li>
<li>Chief marketing officers are dealing with fragmented consumer attention and figuring out data-driven marketing while adapting to a landscape altered by the novel coronavirus.</li>
<li>Here's Bu…",2020-06-17
Microsoft unveils Azure Machine Learning courses and scholarships on Udacity,A newly unveiled introductory course for machine learning on Azure will be available for free on Udacity. A set of chosen top performers will then get scholarships for a more advanced course. Read more...,2020-06-17
Motion Picture Academy Proceeding With Gold Internship Program Despite COVID -19 Crisis; 74 Students Participating,"Just as they had to make adjustments this week  for their own 2021 Oscar show due to events out of their control, AMPAS is also applying necessary changes, while moving forward, with one of their most important programs. With the impressive support of 19 part…",2020-06-17
"SC’s jobless fund, broadband, summer camps focus of $1.9B COVID-19 spending plan","SC awmakers face limits on how they can spend the money. But a proposal adopted by senators Tuesday includes millions to replenish the state’s unemployment trust fund, expand broadband internet and add five days to the school calendar.",2020-06-17
New Louisiana Law Will Let Doctors Decide When Marijuana Is Right for Their Patients,"While there are still numerous barriers to access in Louisiana's medical marijuana system, a specific list of ""qualifying conditions"" will no longer be one of them.",2020-06-17
The Academy’s Entertainment Industry Summer Internships Go Virtual,"The Academy Gold summer internship program goes on, for students and young professionals from underrepresented communities.",2020-06-17
Film Academy Kicks Off 2020 Internship Program for Underrepresented Communities,"The Academy of Motion Picture Arts and Sciences launched its fourth Academy Gold internship program. The program, which is being held virtually because of the COVID-19 pandemic, offers mentorship for 74 students and young professionals from underrepresented c…",2020-06-17
UW-Milwaukee confirms students will return to campus in fall,"Students will return to the University of Wisconsin-Milwaukee campus this fall for in-person and online classes, the school said Wednesday.

The decision is based on planning by 14 teams that included more than 140 faculty, staff members and students, accordi…",2020-06-17
"Fact check: Bill Gates, Tyson Foods not instigating collapse of meat supply",COVID-19 has impacted the meat industry. Supply chain issues are not related to Bill Gates' or Tyson Foods' investment in meat alternatives.,2020-06-17
"For Indigenous Zapotec Families, Spinning Becomes a Lifeline","The COVID-19 pandemic has hurt communities all over Mexico. But a network of Indigenous artisans is finding a way to survive during the shutdown.
The post For Indigenous Zapotec Families, Spinning Becomes a Lifeline appeared first on Yes! Magazine.",2020-06-17
Australia 'likely' to keep international border closed until next year: official,"Australia's borders will likely remain closed to international travelers for the rest of the year, Trade Minister Simon Birmingham said Wednesday.Birmingham said the country is exploring options for relaxing entry...",2020-06-17
Mandatory mask laws are spreading in Canada,"Governments across the country are starting to make mask wearing mandatory in certain situations to curb the spread of COVID-19. Here’s a closer look at why some advocates are calling for that to be more widespread, and why others have reservations.",2020-06-17
"Voices of Protest, Crying for Change, Ring Across US, Beyond","They are nurses and doctors, artists, students, construction workers, government employees; black, brown and white; young and old.  

Hundreds of thousands of demonstrators have taken to the streets in big cities and tiny towns in every U.S. state - and even …",2020-06-17
Governing with Fear: Gavin Newsom's strategies are based on fear because he doesn't have an army,"The following quote and photograph are currently displayed on Gavin Newsom's state website:The California Dream â the idea that every person can achieve a better life, regardless of where they start out â is central to who we are as Californians. Even in …",2020-06-17
Stanford Law School Celebrates the Graduating Class of 2020,"2020 Class Logs Record-breaking 21,937 Pro Bono Hours  On June 14, 2020, 261graduating Stanford Law School (SLS) students celebrated their accomplishments and each other virtually via video and chat rooms, with the promise to come together to cheer each other…",2020-06-17
Don't fall for COVID-19 student loan relief scams,"Student loan borrowers were targets for scams before the coronavirus pandemic hit. The longer people struggle, the more desperate they become, and that's when scammers and fraudsters thrive. 
 ""They're using the same playbook, but more aggressively,"" says Set…",2020-06-17
Impact of Covid-19: Cloud Migration Is Evolving as an Essential Strategy?,The worldwide unprecedented disruptions caused by COVID 19 pandemic has strengthened the importance of being an agile business than ever. Enterprises have started accepting this “new normal” to make their Business Continuity Plan comprehensive. Organizations …,2020-06-17
Don't fall for COVID-19 student loan relief scams,"Follow the StarTribune for the news, photos and videos from the Twin Cities and beyond.",2020-06-17
‘It feels something was missing’: Pandemic forces new Canadians’ citizenship ceremonies onto Zoom,"With in-person citizenship ceremonies cancelled due to the COVID-19 pandemic, Haseena Hotaki had to take her oath and sign her certificate virtually — but she’s still extremely proud to be a full-fledged Canadian.",2020-06-17
Senate HELP Committee weighs the future of telehealth,"Of the 31 changes federal policymakers have enacted so far to ease access to virtual care, senators wondered: How many should be made permanent?",2020-06-17
Powhatan County still faced with uphill battle for broadband,POWHATAN – The Powhatan County Board of Supervisors recently took another in-depth look at the critical problem the county continues to face with lack of broadband access and the difficulties inherent in getting it.,2020-06-17
COVID-19: Kicking Digital Transformation into Overdrive,"While many businesses considered going digital, the COVID-19 pandemic has served as a massive accelerant. Businesses have moved operations remotely, with 43% of U.S. workers working off-site some or all of the time. However, many are experiencing major disrup…",2020-06-17
"San Diego Will Begin Parking Enforcement Again On July 1, Citations On July 15","The enforcement will begin with a two-week grace period, during which violators will receive written warnings. Citations with corresponding fines will be issued beginning July 15.",2020-06-17
Opinion | Three pathways for us to achieve the Indian dream,Clarity on the purpose of education can yield distinct ways to make the most of our human capital,2020-06-17
Millions lost: Language school on the brink as foreign student cash dries up,"A Bay language school may have to shut its doors as millions of dollars in revenue from fee-paying international students is lost from the national economy due to border restrictions.

 

Mount Maunganui ...",2020-06-17
Breweries throughout region join Black is Beautiful beer collaboration inspired by #BlackLivesMatter,Black is Beautiful is a nationwide brewing project that supports local organizations fighting for equality and justice.,2020-06-17
Snapshots from the Uprising : Accounts from Three Weeks of Countrywide Revolt,An analysis of three weeks of revolt in response to the murder of George Floyd and a collection of accounts from participants all around the US.,2020-06-17
Infrastructure and cyber security are key to America’s safety | Opinion - The Philadelphia Inquirer,"Pennsylvania has been at the vanguard of the energy revolution that made America the world’s top producer of natural gas — and today provides 19.5% of our nation’s natural gas output. Meanwhile, Pittsburgh’s private sector transformed “The Steel City” into an…",2020-06-17
Safe and secure? Why a return to work needs careful planning,"Jay Ryerse, Vice President of Cybersecurity Initiatives for ConnectWise, explains how organisations need to prepare for bringing remote workers back to a shared work environment after the COVID-19 pandemic is over.

Podcast Are your new starters getting the s…",2020-06-17
Want to support Black-owned businesses? Here's a list - Decaturish.com,Here is a list of some Black-owned businesses located throughout the Decatur and Atlanta area.,2020-06-17
Chartered Security Professionals presentations,"), and Centre for the Protection of National Infrastructure were also represented, alongside universities which provide academic qualifications in security. Unable to attend was Lord Alex Carlile, who had accepted a position as Patron of the Register in 2019.",2020-06-17
"Professional Tennis Returns In Washington, DC","WASHINGTON, June 17, 2020 /PRNewswire/ -- Three months after the pro tours suspended their seasons due to the COVID-19 pandemic, the ATP and tournament officials announced today that the professional tennis tour will return to the world stage with the Citi Op…",2020-06-17
"ATA President, Dr. Joe Kvedar, Testifies at Senate Committee Hearing on Telehealth","WASHINGTON, June 17, 2020 /PRNewswire/ -- American Telemedicine Association (ATA) President, Joseph C. Kvedar, MD, testified today before the full Senate Committee on Health, Education, Labor and Pensions (HELP) on telehealth, urging policymakers to ""take spe…",2020-06-17
"ATA President, Dr. Joe Kvedar, Testifies at Senate Committee Hearing on Telehealth","Kvedar, MD, testified today before the full Senate Committee on Health, Education, Labor and Pensions (HELP) on telehealth, urging policymakers to ""take specific actions before the end of the public health emergency to make access to telehealth services  perm…",2020-06-17
Black Americans still face obstacles to voting at every step of the process,"<ul>
<li>Black Americans still face massive disparities and inequalities in accessing the right to vote 150 years after the passage of the Fifteenth Amendment, which extended the franchise to Black men.</li>
<li>Due to ongoing racial disparities in felony cha…",2020-06-17
Kronos Virtual ‘Industry Insights’ Summit Explores the New Dimensions of Work,"LOWELL, Mass.--(BUSINESS WIRE)--Kronos hosts a virtual summit exploring new dimensions of work and the impact on employee experience.",2020-06-17
Innovative Climate and Energy Policies: IMIS Think-Tank Unveils Strategic Analysis,"RABAT, Morocco--(BUSINESS WIRE)--Innovative Climate and Energy Policies: IMIS Think-Tank Unveils Strategic Analysis",2020-06-17
86% of Security Pros Says Common Attacks Rose During COVID-19 - CISO MAG,A new survey from Bitdefender revealed that 50% of infosec professionals did not have a contingency plan to face a situation like the COVID-19 pandemic. The survey “ The Indelible Impact of COVID-19 on Cybersecurity ” stated that lack of forward planning from…,2020-06-17
What a new cold war with China means for you,"AP Photo/Evan Vucci
<ul>
<li>Tensions between the US and China have risen steadily, part of a growing competition that many see as burgeoning cold war between the two powers.</li>
<li>A cold war is characterized by competition short of armed combat, but a loo…",2020-06-17
Samuel Adams And GLAAD Share Unifying Message That Love Conquers All,"Today, Samuel Adams, one of the leading independent, American brewers that pioneered the craft beer revolution, announces Love Conquers All, a Pride platform created in partnership with GLAAD, a leading nonprofit organization working to accelerate acceptance …",2020-06-17
Samuel Adams And GLAAD Share Unifying Message That Love Conquers All,"BOSTON, June 17, 2020 /PRNewswire/ -- Today, Samuel Adams, one of the leading independent, American brewers that pioneered the craft beer revolution, announces Love Conquers All, a Pride platform created in partnership with GLAAD, a leading nonprofit organiza…",2020-06-17
