"'Oh my gosh... I didn't know': Joy, confusion over money allocated for niche U.S. schools amid coronavirus","What do a jazz school, a yeshiva, and a dog training academy have in common?

They were all allocated hundreds of thousands of dollars by the Department of Education (ED) to help them weather the coronavirus pandemic.",2020-05-25
Opinion | A pandemic that could alter the size and shape of governments,Extremes of centralization and decentralization can both pose problems and so a coordinated middle ground may work best,2020-05-25
Richest hospitals sitting on billions in cash got golden bailouts compared to those serving poorest,"While critics have noted in recent weeks the ways in which the Covid-19 pandemic has “laid bare some of the dysfunctions and inequalities in the American healthcare system,” new reporting…
  Related Stories<ul><li>Chris Wallace rips into Kayleigh McEnany for …",2020-05-25
"At Bengaluru airport: 5-year-old travels alone to reunite with family, Minister raises eyebrows for ‘skipping quarantine’","Union Minister and BJP MP from Bengaluru North, Sadananda Gowda, said as minister-in-charge of Department of Pharmaceuticals, he came under the essential services category and was hence exempt from quarantine rules.",2020-05-25
Research Report with COVID-19 Forecasts - Online Education Market In India 2020-2024 | Increased Penetration of Internet and Smartphones to Boost Market Growth | Technavio,LONDON--(BUSINESS WIRE)-- #OnlineEducationMarketShare--The online education market size in India has the potential to grow by USD 14.33 billion during 2020-2024,2020-05-25
How to Support Your Student’s Wellbeing During COVID-19,"Approximately 1 in 4 people (in the UK) suffer from a mental health condition. Couple this with recent research suggesting that 300 million people practise yoga worldwide, and it is reasonable to assume that someone in your yoga class has… Read More How to Su…",2020-05-25
Coronavirus And Crashing Aviation Industry Hollow Kansas' Tech College Pitch - WBUR,The focus on hands-on learning for high-demand jobs is the big draw of tech schools. But the collapse of the aviation industry and the coronavirus crisis has led Kansas technical schools to think about how they can adapt.,2020-05-25
Will the Business School Model Survive the Pandemic?,MBA programs teach students the smartest new business models. Now the pandemic is upending the business model of these programs.,2020-05-25
"Here’s what these young developers predict about our relationship with technology, post-lockdown","With Apple’s Worldwide Developers Conference 2020 going digital this June, we speak to some of the past scholarship winners from India about the future of tech once the lockdown lifts",2020-05-25
Lockdown Level 3 - 'Unfolding Calamity' - Saftu Threatens Strike If Public Servants Are Forced Back to Work,"[News24Wire] Two of South Africa's trade union federations have raised concerns over government's announcement that public servants must go back to work when the country gears down to Level 3 of the lockdown from next week, with the South African Federation o…",2020-05-25
Liquor Traders Associations call for taverns to serve as alcohol collection points,"A consortium of Liquor Trader Associations, made up of associations of township-based taverns and shebeens representing over 50 000 members countrywide, is recommending that township taverns be permitted to operate as sanitary, off-site liquor sales points.",2020-05-25
"updates: using time off to nanny, the Secret Santa gift, and more","It’s a special “where are you now?” season at Ask a Manager, when I’m running updates from people who had their letters here answered in the past. Here are three updates from past letter-writers. 1. Can I used my unlimited time off to do part-time nanny work?…",2020-05-25
"Scott Morrison warns of long, hard economic recovery ahead","Prime Minister Scott Morrison will tell the National Press Club businesses need to be prepared to ""get off the medication"" of handouts like JobKeeper and also warn the economic recovery could take up to five years.",2020-05-25
News24.com | 'Anti-Christian attitude developing in SA' - ACDP leader warns of possible illegal church gatherings,"Some religious leaders are angry over President Cyril Ramaphosaâs refusal to accede to requests to allow small gatherings and say that, if forced, congregants will ignore the government and gather for praise and worship anyway.",2020-05-25
Facebook's Future Is Brighter Than Ever,"Facebook's growth in its core platforms, i.e., Facebook and Instagram, will eventually flatten, likely in the 2020s. Facebook has incredible levers for growth v",2020-05-25
Canada still lacks cybersecurity ‘street smarts’ says CIRA director,"While the federal government combats hostile foreign intelligence services seeking the country’s biggest secrets, hackers and fraudsters are keen on cashing in on the fear the novel coronavirus has created, targeting both individuals and businesses across Can…",2020-05-25
'Here We Go Again': Richest Hospitals Sitting on Billions in Cash Got Golden Bailouts Compared to Those Serving Poorest,"Jon Queally, staff writer
""If you ever hear a hospital complaining they don't have enough money, see if they have a venture fund.""",2020-05-25
Here's how Mesa will spend its $90 million in coronavirus relief funding,"Mesa has outlined a plan to spend its $90M federal coronavirus relief money, with emphasis on public safety, business, food and remote learning help.",2020-05-25
"Questions About Student Loans, Air Fryers, Credit Cards, Sourdough and More","What’s inside? Here are the questions answered in today’s reader mailbag, boiled down to summaries of five or fewer words. Click on the number to jump straight down to the question. 1. Student loans and interest accumulation 2. Thoughts on air fryers 3. Conse…",2020-05-25
28% of Data Breaches in 2020 Involved Small Businesses,"Slightly more than 1 in 4 data breaches in the US in 2020 involved small businesses, according to a new study from Verizon.",2020-05-25
Students are in a game of chicken with colleges.,"I’ve got a new Bloomberg column out today, about the game of chicken that colleges are playing with students and their parents: Covid-19 Will Make Colleges Prove Their Worth Online education should come at an online price. See more of my columns here.",2020-05-25
News24.com | 'Unfolding calamity' - Saftu threatens strike if public servants are forced back to work under lockdown Level 3,"Two of South Africa's trade union federations have raised concerns over government's announcement that public servants must go back to work when the country gears down to Level 3 of the lockdown from next week, with the South African Federation of Trade Union…",2020-05-25
"Indiana budget cuts don't apply to schools yet, but education leaders brace for tough times","Indiana's $7.4 billion education budget is not included in spending cuts announced Friday, but that doesn’t mean school budgets won’t be impacted by the coronavirus pandemic and the havoc it’s wreaking on the state’s economy.",2020-05-25
Coronavirus shows we must get serious about the well-being of animals,COVID-19 raises crucial questions about how best to move forward from the pandemic and its many effects. We are reassessing key political and economic assumptions and perceptions of what is possible and desirable.,2020-05-25
"Chad: As Chad's Problems Mount, What Role for Civil Society?","Opinion - Despite Chad's economic woes and its citizens' frustration with elite impunity, its civil society organisations have struggled to mobilise into a coherent protest movement. But these groups might yet play a more important role if the country undergo…",2020-05-25
Back to School Prep Underway Across SA,"[SAnews.gov.za] With just a week to go until Grade 7 and 12 learners return to the classroom under level 3 of lockdown, preparations are underway at schools across the country to ensure the safe return of pupils, come 1 June 2020.",2020-05-25
Africa's COVID-19 recovery should harness the benefits of nature and conservation,"Today, as we celebrate International Day of Biodiversity, the global community is called to re-examine our relationship to the natural world. We celebrate this day in the midst of the COVID-19 pandemic that is severely impacting people and organizations aroun…",2020-05-25
Code for the Climate: Children Drive Innovation with Purpose in Denmark,"Together with its global network, SAP co-innovates in crucial areas like education and access to technology in order to help the world run better and...",2020-05-25
Fin24.com | Ofentse Mokwena | The road back to school should include better scholar transport,"Failure to provide subsidised transport to and from schools, within the criteria of the Learner Transport Policy, is a violation of the basic right to education, says Ofentse Mokwena.",2020-05-25
Special Needs Parents in Florida Can't Find Open Childcare Centers,"Arasay Peate didn't know what autism spectrum disorder was when she arrived in Little Havana from Cuba three years ago with her young son, who had trouble saying the word ""mam."" But since her son, now-4-year-old David Silva Jr. , was diagnosed",2020-05-25
"This grad student turned medical worker has finally landed a job in his 30s, making $125,000. After renting a bedroom in Chinatown, he hopes to own his first home","Now that Damien’s able to focus on buying a home, where does he start? He wrote to Millennial Money for some help from an expert.",2020-05-25
Solar Industry Fighting To Help Lead Economic Recovery,"The COVID-19 pandemic has extinguished a lot of the economy, but solar industry officials say they could lead the recovery.",2020-05-25
TRUMP APPOINTS BIG PHARMA EXEC CONNECTED TO BILL GATES TO HEAD VACCINE DEVELOPMENTS,"SOURCE: THE LAST AMERICAN VAGABOND
On Friday, Donald Trump announced his appointment of Moncef Slaoui, a former executive with vaccine manufacturer GlaxoSmithKline, to lead “Operation Warp Speed”, Trump’s plan to fast track the development of vaccines for COV…",2020-05-25
The workers that make your food put their lives on the line during pandemic. Whether they're protected now is up to you.,"<ul>
<li>The American food supply chain — from meat processing plants to fast-food chains — relies on people working low-paying jobs that put them at risk for harassment, injury, and even death. </li>
<li>The coronavirus pandemic forced this exploitation into…",2020-05-25
We're glad in helping people stay connected during Covid-19: Zoom India Head,"Zoom India head Sameer Raje, in an exclusive chat with TechRadar India, talks about the various aspects connected with Zoom videoconferencing, which is now the most downloaded app on Google play store India.",2020-05-25
We're glad in helping people stay connected during Covid-19: Zoom India Head,"Zoom India head Sameer Raje, in an exclusive chat with TechRadar India, talks about the various aspects connected with Zoom videoconferencing, which is now the most downloaded app on Google play store India.",2020-05-25
"Monday CoronaBuzz, May 25, 2020: 39 pointers to new resources, useful stuff, research news, and more.",Wash your hands and stay at home as much as you can. Please be careful. I love you. NEW RESOURCES – MEDICAL/HEALTH World Health Organization: WHO launches new search feature for questions on …,2020-05-25
Liberia: 'Projects By Partners Must Be Transformative',[Observer] Minister Tweah pleads as GOL and the EU secure US$59 Million Agreement,2020-05-25
We're Going To Be Living In A Liquid World,"If one thing is clear from observing the highly disruptive impact COVID-19, it’s that we are heading toward a liquid world, one characterized by the virtues of flexibility, versatility and resilience. How will you understand and incorporate this new liquid le…",2020-05-25
Deep Dive: Preventing Financial Crime Amid The COVID-19 Pandemic - pymnts.com,"The ongoing COVID-19 pandemic is significantly affecting everyday life, with more than one-third of the world’s population subject to social distancing guidelines, stay-at-home orders or other regulations to prevent the virus’s spread. Banks are largely consi…",2020-05-25
Premier Doug Ford government gives $500M loan to Ontario Lottery and Gaming,"Gambling accounts for around 17,600 jobs in Ontario and OLG has resisted laying off workers during the pandemic.",2020-05-25
"Noam Chomsky on Trump's Disastrous Coronavirus Response, WHO, China, Gaza and Global Capitalism","How did the United States — the richest country in the world — become the worldwide epicenter of the coronavirus outbreak, with one person dying of COVID-19 every 47 seconds? We spend the hour with Noam Chomsky, the world-renowned political dissident, linguis…",2020-05-25
"The Elite’s COVID-19 Coup: Fighting for Our Humanity, Our Liberty and Our Future","We are being utterly transformed. And the world is being utterly transformed around us.
Ostensibly, this is to tackle a simple virus. In reality, it is to achieve an elite design at staggering cost to humanity and to life generally.…
The post The Elite’s COVI…",2020-05-25
Is Ahmad Lawan Truly Committed to Rebuilding Nigeria's Economy,"[Vanguard] The doctrine of separation of powers is unwittingly defective such that irrespective of the possible good governance implications of legislative outputs, they are of no effects whatsoever, if the executive rightly or wrongly, chooses not to impleme…",2020-05-25
President Halimah Yacob gives in-principle support to draw on reserves for 4th COVID-19 support package,"Jobs will be a key part of the Fortitude Budget, says Deputy Prime Minister Heng Swee Keat.",2020-05-25
Effectiveness Of Online Instruction Post-COVID,"The presence of technology has transformed education, making online learning as a part of the new learning method. In the past few years, online enrolments in higher education have continued to increase in the USA.
This post was first published on eLearning I…",2020-05-25
Cash-Strapped Liberia Mired in Elections Quagmire in the Midst of COVID-19 Pandemic,"[FrontPageAfrica] Monrovia -At the height of the deadly Ebola virus epidemic, Liberia had all the reasons in the world not to hold crucial Senatorial Mid-Term elections. Despite appeals from several international partners, who, at the time, advised against ho…",2020-05-25
"As Mass. Businesses Reopen, Enforcement Falls On Already Strapped Local Health Departments - WBUR","The state wants all businesses and workers to practice social distancing, sanitizing and mask-wearing. The agency responsible, in large part, for ensuring they comply with all the rules? Your local health department.",2020-05-25
"A Women, an Arab Engineer, and a Haredi Certified Coder Walk Into a Job Interview - CTech","While work from home, as a new standard, helped remove some of the barriers preventing diversity in Israeli tech, there is still a long way to go to ensure equal opportunities are truly available",2020-05-25
Clashes ahead during coming week -- and beyond -- for GOP legislators and John Bel Edwards,The Louisiana Legislature heads into its final week of the regular session unlikely to complete its main task – passing a budget for the upcoming fiscal year.,2020-05-24
Coronavirus: Reform Scotland says graduates should pay towards tuition,A think tank claims the very survival of Scotland's universities is at risk because of its funding structure.,2020-05-24
"Greater Dublin, provincial cities best equipped to deal post Covid-19 crisis","Regions will be affected by having fewer jobs where remote working an option, UCC study finds",2020-05-24
"This new-age industry is in the 'valley of despair,' but it may have a new catalyst: Ark Invest CEO","3D printing stocks have fallen up to 90% from their highs, but the group might be saved by other struggling industries looking to lower costs, says Ark Invest CEO Cathie Wood.",2020-05-24
"Arkansas Gov: ‘We Have To Manage The Risk’ With COVID-19, Like ‘Wearing A Seatbelt’ While Driving","On Sunday, Arkansas Governor Asa Hutchinson appeared on “Fox News Sunday” with host Chris Wallace to discuss his state’s response to the ongoing COVID-19 crisis. “You never issued a stay-at-home order in your state, and now, you’ve officially reopened all you…",2020-05-24
"Rich, but household debt is growing: A time bomb for South Korea?","South Korean households are piling up debt for various reasons, from overspending on credit cards to unemployment to gambling losses. The programme Undercover Asia looks at the causes — and the effects.",2020-05-24
Thai TV series give ugly truths a rosy hue,"As I've been following progress of the Dawei Special Economic Zone (SEZ) in Myanmar, I can see the project receives little attention from the mainstream Thai media, despite the fact the contentious project involves a big investor, the Thai government -- and h…",2020-05-24
An Interview With A Rum Master,Kiowa Bryan shares some advice on how to stay safe and sane during COVID-19.,2020-05-24
The day Dominic Cummings's (many) enemies have ALL been waiting for,Somehow it was inevitable that Dominic Cummings would turn up at Downing Street on a Sunday. The man seen is seen as a sinister hybrid of Rasputin and a 'career psychopath'.,2020-05-24
"Coronavirus charities, organizations that still need your help",Here are charities and organizations that are helping Americans during the coronavirus pandemic.,2020-05-24
We shan’t fight him on the breaches,"Good morning, early birds. Boris Johnson has refused to sack senior adviser and Brexit mastermind Dominic Cummings over multiple lockdown breaches, and despite the $60 billion error, Josh Frydenberg stands firm on the JobKeeper eligibility criteria. It's the …",2020-05-24
Spotlight: Coronavirus Lockdown—Week 5 Digest,"Each week the digest of Spotlight: Coronavirus Lockdown is bringing you the latest submissions about this issue. Let's review together everything that happened last week.
This post was first published on eLearning Industry.",2020-05-24
"Fire marshal to begin to enforce 25% occupancy at clubs and bars amid health violations, Mayor Turner says",Mayor Sylvester Turner said some clubs and bars are ignoring the 25% occupancy requirement established by the State to prevent the spread of COVID-19.,2020-05-24
"New Lamps for Old: Australia, Puerto Rico Open to Efforts for Small Modular Reactors",Australia / Government To Examine SMRs As Part Of Energy PlanningPuerto Rico / New Report Finds Small Modular Reactors are FeasibleU.S. / New TVA Board Members Support Development Work for SMRsFrance / Nuclear Society Urges Government To Commit To New-BuildSo…,2020-05-24
Delhi Confidential: Offer Of Support,LJP patriarch and Union Minister Ram Vilas Paswan urged Sports Minister Kiren Rijiju to arrange training and scholarship for her.,2020-05-24
"If migration stops, should we stop building?","Some see a Covid-19 building spree as a chance to catch up, but others worry about over-building as migration stalls.",2020-05-24
'Stressful nine weeks' at its end as all Queensland kids return to school,"Parents feel mixed emotions as more than 600,000 other students from year 2 to year 10, are allowed to come back to school from today.",2020-05-24
From Harley to wheelchair - Inside rise and fall of Killer Beez boss,"Josh Masters pulled into the driveway of the Auckland's Harley Davidson dealership on his new motorcycle. 

He'd left just a few minutes ago after picking up the keys to his Harley, in the shop for some ...",2020-05-24
Gov. Cuomo says US economy won't bounce back on its own post-pandemic because 'too many' small businesses have closed and corporations won't rehire laid-off workers,"<ul>
<li>New York Gov. Andrew Cuomo said the US economy won't recover on its own because ""too many small businesses have closed"" and corporations won't rehire as many workers as they laid off.</li>
<li>""They had fewer workers and used more technology and they…",2020-05-24
Gov. Cuomo says US economy won't bounce back on its own post-pandemic because 'too many' small businesses have closed and corporations won't rehire laid-off workers,"Cuomo also said too many small businesses have closed and that the government will need to ""stimulate"" an economy transformed by the coronavirus.",2020-05-24
This little known organization brings additional perspective to a COVID-19 world,The low-key Organization for Economic Cooperation & Development aims to improve the global economy and promote world trade.,2020-05-24
Portrait of a Pandemic - The Wall Street Journal,How the coronavirus rippled through eight young lives.,2020-05-24
Call for action on special needs education supports,A body representing people with disabilities has said the Government must act urgently to provide educational supports for children with special needs.,2020-05-24
Boris Johnson says schools in England set to reopen on 1 June as planned,"Boris Johnson, who replaced Housing Secretary Robert Jenrick at the Downing Street briefing on Sunday, acknowledged the planned reopening date of 1 June may not be possible for all schools but remained committed to it.  It added any positive tests would resul…",2020-05-24
PM press conference statement: 24 May 2020,Prime Minister Boris Johnson made a statement at the daily coronavirus press conference on 24 May 2020.,2020-05-24
GOP governor says wearing masks is public health issue,"""This is one time where we are truly all in this together,"" Ohio Gov. Mike DeWine said Sunday. ""What we do directly impacts others.”",2020-05-24
Meet Bill Gates,"James Corbett examines the motives, the ideology, and the connections of this man who has been so instrumental in shaping the post-coronavirus world.",2020-05-24
What To Make Of Community QE - Look Now To New York,"Despite seriously shortcomings that will have to be rectified, the Fed's new Municipal Liquidity Facility, or 'Community QE,' holds great promise for cities and states struck by pandemic. New York now shows a path forward with legislation that puts Community …",2020-05-24
"Sunday CoronaBuzz, May 24, 2020: 36 pointers to new resources, useful stuff, research news, and more.",Wash your hands and stay at home as much as you can. Please be careful. I love you. NEW RESOURCES – STATE-SPECIFIC University of Mississippi News: Mississippi Teacher Corps Offers Free Summer […],2020-05-24
View: The need to look at India’s technology agenda in a holistic way,"Data-gathering exercises conducted once in every 10 years are inadequate in today’s times for policymaking, and are prone to being used as political fodder.",2020-05-24
18 Million Jobs At Risk Of Permanent Loss: What Happens To Small Businesses When The Bailout Money Is Spent,"18 Million Jobs At Risk Of Permanent Loss: What Happens To Small Businesses When The Bailout Money Is Spent

 Tyler Durden
 
Sun, 05/24/2020 - 13:45

 Submitted by Nick Colas of DataTrek Research


American small businesses are going to bear the brunt of the…",2020-05-24
Mumbai: 250 private doctors start working in BMC hospitals,BMC officials expect the dearth of beds and doctors to treat critical patients will be plugged for the coming days with the fresh inflow of doctors and beds through 80 per cent reservation of beds in private hospitals.,2020-05-24
"PM confirms schools, colleges and nurseries on track to begin phased reopening","From 1 June schools, colleges and nurseries are set to open to more children.",2020-05-24
Twilio To Power New York’s COVID-19 Contact Tracing Initiative; Shares Jump 7.5%,Twilio (TWLO) announced that it will provide the communications platform to power New York City’s coronavirus contact tracing initiative sending shares up 7.5% on Friday.The cloud communications company said that New York City’s Department of Information Tech…,2020-05-24
Twilio To Power New York’s COVID-19 Contact Tracing Initiative; Shares Jump 7.5%,Twilio (TWLO) announced that it will provide the communications platform to power New York City’s coronavirus contact tracing initiative sending shares up 7.5% on Friday.The cloud communications company said that New York City’s Department of Information Tech…,2020-05-24
Muslims worldwide celebrate Eid-al-Fitr amid coronavirus restrictions,"Muslims began celebrating Eid al-Fitr, the holiday marking the end of Ramadan, amid fears of coronavirus outbreaks.",2020-05-24
"Dr. Deborah Birx on COVID-19 death toll in US, timeline for coronavirus vaccine","Guests: Deborah Birx, Asa Hutchinson, Mark Parkinson, Jonah Goldberg, Donna Brazile, Josh Holmes",2020-05-24
Jason Blum Reassures Vassar Grads During COVID-19 Times: “Don’t Let Moments Of Failure And Frustration Distract You”,"EXCLUSIVE: The near future for 2020 college graduates is very much akin to a horror movie filled with an immense amount of uncertainty, as they leave the great halls of knowledge into the biggest pandemic of the last 100 years, with 43 states currently seeing…",2020-05-24
Ardern's 'almost perfect' brand: Personality politics and how marketing can shape elections,"COMMENT: 

Personality politics has long paved the road to power. Jacinda Ardern knows it, Simon Bridges should have known it and Todd Muller must now show he knows as he vies to be prime minister this ...",2020-05-24
Working for good: 4 day week employees should volunteer for charities with extra time off,OPINION: There is measurable value to the worker and their employer in helping the community.,2020-05-24
Venezuelan refugees in Peru face increasing barriers to settlement,Migrant families caught in country’s Covid-19 border closing and new visa rules,2020-05-24
