Fewer students say degree is ‘good value for money’ amid Covid-19 and strikes,"Fewer university students think they are getting their money’s worth because of the Covid-19 pandemic and industrial action, a survey suggests.The proportion of undergraduate students reporting that their course is good or very good value for money has droppe…",2020-06-10
"5G starts with your phone, but is about bigger ideas","If you're finding it hard to get excited about 5G, think bigger.",2020-06-10
Dem lawmakers in Michigan introduce resolution to declare racism a public health crisis,Two Democrat lawmakers in Michigan introduced a resolution on the state’s Senate floor Wednesday to declare racism a public health crisis.,2020-06-10
"UCLA Business School Lecturer Placed on Leave for E-Mail to Student Rejecting Request for Exam ""Leniency"" for ""Black Students""","Long-time Anderson School of Management lecturer Gordon Klein got an e-mail from a student, whom he had before in another class as well, and with whom he had cordially exchanged e-mails in the past; to quote Inside Higher Ed (Colleen Flaherty), According to s…",2020-06-10
6 Ways to Bring Students and Staff Back to Schools,Here are six models for how to operate your schools within social distancing requirements and health and safety requirements.,2020-06-10
How Schools in Other Countries Have Reopened,"Ideas from Australia, Denmark, and Taiwan can help American district and school leaders as they shape their reopening plans.",2020-06-10
Essye Miller: The exit interview,"Cyber Essye Miller: The exit interview By Lauren C. Williams; Jun 10, 2020. After a career spanning almost four decades, Essye Miller, the Defense Department's first black female principal deputy CIO is retiring. And while there's no immediate pivot to indust…",2020-06-10
Will China’s e-commerce reshape a reopening world?,"For many years, delivery drivers—like so many other workers now deemed essential—blended into the background of daily life around the globe. Despite their ubiquity in an era of inescapable e-commerce platforms, they have often gone widely unseen, unrecognized…",2020-06-10
Commentary: The systematic testing Singapore needs to ditch circuit breakers for good,"A system of testing may be expensive but will be less costly than if circuit breakers have to be slapped on again, say NUS Business School’s Neo Kok Beng and Jia Zhunan.",2020-06-10
Women Were Making Historic Strides in the Workforce. Then the Pandemic Hit,"Women were the first to lose their jobs in the COVID-19 recession, and so far, the slowest to regain them.",2020-06-10
China accuses Australia of being 'chronically racist' and warns against making friends or shopping,"The claim comes as the communist government threatens to destroy China's relationship with Australian universities, worth $3.1 billion in fees alone.",2020-06-10
"Amgen, Inc. (AMGN) Presents at Goldman Sachs Healthcare Conference (Transcript)","Amgen, Inc. (NASDAQ:AMGN) Goldman Sachs Healthcare Conference Call June 10, 2020 01:20 PM ET Company Participants Peter Griffith - EVP and CFO Dave Reese - EVP",2020-06-10
Maine finds unique solution to welcome visitors safely,"AUGUSTA, Maine, June 10, 2020 /PRNewswire/ -- Maine has unveiled the Keep Maine Healthy plan, a multilayered strategy that offers an alternative to the 14-day quarantine requirement for out-of-state visitors. The plan's goal is to protect Maine people and vis…",2020-06-10
"Second Library 2.020 mini-conference is just one week away! “Small, Rural, and Independent Libraries,” will be held online (and for free) on Wednesday, June 17th, from 12:00 – 3:00 pm US-Pacific Daylight Time","Our second Library 2.020 mini-conference is just one week away! “Small, Rural, and Independent Libraries,” will be held online (and for free) on Wednesday, June 17th, from 12:00 – 3:00 pm US-Pacific Daylight Time (click for your own time zone). This mini-conf…",2020-06-10
Gov. Northam announces $66.8 million of federal funding to help Virginia schools,"According to Northam, schools across Virginia will receive $66.8 million through the federal Governor's Emergency Education Relief (GEER) Fund.",2020-06-10
Editorial Roundup: US,"Follow the StarTribune for the news, photos and videos from the Twin Cities and beyond.",2020-06-10
U.S. Reckoning Over Racism Spreads to Science,Scientists and academicians are participating in a one-day strike as the scientific community examines its roll in perpetuating institutional racism.,2020-06-10
Email Open Rates Rising: What Are Marketers Doing Differently During COVID-19?,"With stay-at-home orders still in place for much of the world the past few months, it’s no surprise that people…",2020-06-10
Alnylam Announces Publication of ENVISION Phase 3 Study Results for Givosiran in the New England Journal of Medicine,"CAMBRIDGE, Mass.--(BUSINESS WIRE)--Alnylam Pharmaceuticals, Inc. (Nasdaq: ALNY), the leading RNAi therapeutics company, announced today that pivotal results from the ENVISION Phase 3 study of givosiran, an RNAi therapeutic targeting aminolevulinic acid syntha…",2020-06-10
‘It has just been devastating’: This state could face an entire year with almost no tourists,"Just a few months ago, Premier Alaska Tours was gearing up for a record summer tourist season. The Alaska-focused tour company — one of the state’s biggest — was expecting tens of thousands of customers for its multiday trips to classic destinations like Dena…",2020-06-10
COVID-19 business updates: Brunei enters second de-escalation phase - Biz Brunei,This is a dedicated page to covering business news in Brunei relating to the COVID-19 outbreak.,2020-06-10
Boris Johnson pledges 'massive' summer school 'catch-up operation' to help pupils,Boris Johnson has announced there will be a 'big summer of catch up' for pupils who have missed out on their education amid the coronavirus pandemic.,2020-06-10
Chicago Mayor Announces $5 Million Fund for City Residents Excluded From Federal Covid-19 Relief,"Jessica Corbett, staff writer
Chicago Mayor Lori Lightfoot, the Resurrection Project, and Open Society Foundations announced on Wednesday a $5 million cash assistance program for the over 300,000 city residents excluded from federal Covid-19 relief, includin…",2020-06-10
Startup Spotlight: KeeperHR leverages imagery so workers can show personality not found on resume,"The fun GIFs and videos that you like and share on social media platforms or in text messages with friends could be just the type of imagery that lands you your next job or helps you better interact with a team at work. That’s the hope of KeeperHR, a Seattle …",2020-06-10
Lopez Obrador doesn’t even have bank account. How can he run Mexico’s economy? | Opinion,Mexico’s 66-year-old populist President Andres Manuel Lopez Obrador’s latest claim that he hasn’t had a bank account or a credit card for the past 30 years raises a serious question: Does a leader who doesn’t use the banking system have the foggiest idea abou…,2020-06-10
Education Leaders Warn Senators of 'Perfect Storm' of Challenges in Reopening Schools,"Starting a new school year will be a high-stakes challenge for educators who must help get students back on track, education administrators told U.S. senators Wednesday.",2020-06-10
K-12 Dealmaking: Investment to Help Develop Education Workforce; Unacademy Could Become Unicorn,"In the latest issue of K-12 Dealmaking, Asia remains especially active, and a Denver-based tech firm receives an investment that will aid education workforce development.
The post K-12 Dealmaking: Investment to Help Develop Education Workforce; Unacademy Coul…",2020-06-10
"Here's the Wolf administration's COVID-19 guidance for the reopening of all sports in PA, including high school and youth sports","All sports in the state, including professional, college, Pre-K to 12 school athletics, and amateur and rec sports, are covered by this guidance, Gov. Tom Wolf said",2020-06-10
"11 Black-Owned Brands Donating to Black Lives Matter, Grassroots Organizations & George…","For those of you who are looking to give back and wear pieces by diverse designers, we’ve rounded up 11 Black-owned brands that are donating profits to social justice organizations.  During these times, protesting and voting might seem like the most useful so…",2020-06-10
"Katikati woman Ann Owen pledges $150,000 for horticulture centre","Ann Owen believes so passionately in both education and the horticultural industry she has pledged $150,000 to the project to build a dedicated horticultural facility in Katikati.""Education, in my view, should have the highest priority...",2020-06-10
University students aren't cogs in a market. They need more than a narrow focus on 'skills',"Education should equip people not just with specific skills, but also with the knowledge they need to be citizens,  and for occupations in which they can develop across the course of their lives.",2020-06-10
New-look school rules for Queensland students as they head back to classrooms today,"Parents feel mixed emotions as more than 600,000 students from year 2 to year 10, return to school from today, as the Premier announces Queensland has another day with no new COVID-19 cases reported.",2020-06-10
Senate Panel Asks: When Can K-12 Schools Safely Reopen?,The U.S. Senate's education committee grappled with the challenges public schools face as they prepare to reopen safely in the fall.,2020-06-10
Xi's Ningxia inspection tour; Arm China mess; Telling the Covid-19 story,"The propaganda rollout for Xi’s Ningxia inspection tour has begun. The major themes do not seem to be anything surprising, though the inclusion of CCP Organization Department head Chen Xi in his delegation seems interesting, and he did take a picture with a c…",2020-06-10
Ontario releases plan for reopening colleges and universities,"Thousands of Ontario post-secondary students were left in lurch this March when, with just months (if not weeks) to go until graduation, the province declared a state of emergency over COVID-19.
Like restaurants, bars, hair salons and most office buildings, …",2020-06-10
Roger Goodell spoke. But nobody speaks for Jerry Jones — and that’s why his silence on kneeling is deafening.,This matters because it leaves everyone to wonder if Jones is standing on his catalogue of previous remarks. Ones that were often mixed and confusing.,2020-06-10
Roger Goodell spoke. But nobody speaks for Jerry Jones — and that’s why his silence on kneeling is deafening.,This matters because it leaves everyone to wonder if Jones is standing on his catalogue of previous remarks. Ones that were often mixed and confusing.,2020-06-10
"How schools should look as they reopen despite the coronavirus pandemic, according to the CDC and education experts","""Good luck getting 6- & 7-year-olds not to want to hug their teacher, and touch their face, and hug their friends—it's going to be nearly impossible...",2020-06-10
"How schools should look as they reopen despite the coronavirus pandemic, according to the CDC and education experts","<ul>
<li>As schools weigh how best to reopen with the coronavirus at hand, the CDC recommends keeping classes small and isolated.</li>
<li>They recommend staggering pick-up and drop-off times, and encouraging telework for coronavirus-exposed students and teac…",2020-06-10
A New Wave of Reckoning Is Sweeping the Porn Industry,"Dozens of women came forward in the last week about abuse on porn sets, and performers say it's just the beginning.",2020-06-10
South Africa: COVID-19 - South Africa's Social Divide and Economic Woes Exposed,"[DW] The pandemic has unearthed South Africa's stark social and economic differences between rich and poor. Experts say the crisis has worsened the country's ailing economy, as the government flounders to find a solution.",2020-06-10
NCCN Policy Summit Explores 21st Century Cures Act and the Impact of Health Information Technology,"Today, the National Comprehensive Cancer Network® (NCCN®)—an alliance of leading cancer centers—hosted a Virtual NCCN Policy Summit titled Accelerating Advances in Cancer Care Research: A Lookback at the 21st Century Cures Act in 2020. The program included a …",2020-06-10
NCCN Policy Summit Explores 21st Century Cures Act and the Impact of Health Information Technology,"PLYMOUTH MEETING, Pa., June 10, 2020 /PRNewswire/ -- Today, the National Comprehensive Cancer Network® (NCCN®)—an alliance of leading cancer centers—hosted a Virtual NCCN Policy Summit titled Accelerating Advances in Cancer Care Research: A Lookback at the 21…",2020-06-10
A pair of long-time Seattle-area comic book stores are closing up shop,"Comics Dungeon and Corner Comics will close their doors permanently in mid-July.
The post A pair of long-time Seattle-area comic book stores are closing up shop appeared first on The Beat.",2020-06-10
Why 2020 Could Turn Out to Be a Transformative Year,"2020 could turn out to be one of the most transformative years of our collective lives, marking the turning point when unjust, destructive, and inhumane systems began to be toppled and transformed... It’s easy to feel overwhelmed by the sheer awfulness of 202…",2020-06-10
"Fortinet establishes corporate foundation to protect, positively impact communities worldwide",Fortinet announced the creation of the Fortinet Corporate Foundation to further its impact on global communities and expand the companyâ€™s Corporate Social Responsibility initiatives. Fortinet Foundation commits to matching multi-million dollars in employee …,2020-06-10
"‘Black owned don’t loot:’ For some business owners, signs show solidarity - and provide protection - The Philadelphia Inquirer","‘Black owned don’t loot:’ For some business owners, signs show solidarity - and provide protection  The Philadelphia Inquirer",2020-06-10
Africa: COVID-19 - Caring for Care Workers,"[IPS] United Nations -COVID-19 has brought the world to a halt. Nations, businesses, and schools have closed, and billions are confined to their homes. Yet millions of care workers step out daily to keep the lights on and support those in need.",2020-06-10
"IU appoints new vice presidents for communications and marketing, information technology: News at IU: Indiana University","Karen Ferguson Fuson will be VP for communications and marketing, and Rob Lowden will be VP for information technology and chief information officer.",2020-06-10
Coronavirus and the Aftermath,"A summary of COVID cases and demographics by Greg Presseau Of Perennial Capital Having successfully averted disaster by imposing economically-debilitating lockdowns, we have seemingly ceased the spread of coronavirus for the time being.  Ultimately we want to…",2020-06-10
COVID-19 Catapults Indoor Air Quality To Top Of The List,"The coronavirus outbreak is bringing indoor air quality into the spotlight as hospitals work to mitigate the spread of disease and offices, retail, and education facilities are considering strategies to reopen safely and minimize infection.",2020-06-10
"To protect frontline workers during and after COVID-19, we must define who they are","As the COVID-19 pandemic continues, America’s frontline workers are still valiantly reporting to their job sites and risking their personal health to keep the economy in motion and the rest of us safe. But to adequately protect these workers, their households…",2020-06-10
Hagens Berman: NYU Sued by Student and Alumni in Class-Action Lawsuit Seeking Repayment After COVID-19 Campus Closure,"NEW YORK--(BUSINESS WIRE)-- #classaction--New York University (NYU) has been sued in a class-action lawsuit demanding repayment for tuition amid COVID-19 closure, according to Hagens Berman.",2020-06-10
"United Natural Foods, Inc.'s (UNFI) CEO Steve Spinner on Q3 2020 Results - Earnings Call Transcript","United Natural Foods, Inc. (NYSE:UNFI) Q3 2020 Earnings Conference Call June 10, 2020, 08:30 AM ET Company Participants Steve Bloomquist - VP, IR Steve Spinner",2020-06-10
San Diego defies demands to defund police by expanding budget - Fox Business,San Diego defies demands to defund police by expanding budget  Fox Business,2020-06-10
Education interrupted,"In late January, we delivered an 8-week ‘Introduction to Web Mapping’ course at the University of San Francisco. Two weeks after our students presented their final projects, universities all over the…",2020-06-10
50 percent capacity restriction to lift for some businesses June 12 - KCRG,"Gov. Reynolds announced, during her Wednesday press conference, that she’s lifting the 50 percent capacity restriction for some businesses effective June 12 at 8 a.m.",2020-06-10
Tradehorn to launch crypto exchange platform for Indian users,"New Delhi [India] June 10 (ANI/Digpu): Bengaluru-based crypto exchange startup Tradehorn announced that it will be launching a new cryptocurrency exchange platform called 'Tradehorn' for Indian users in June 2020. The users can now trade, deposit and withdraw…",2020-06-10
United Natural Foods Inc (UNFI) Q3 2020 Earnings Call Transcript,"UNFI earnings call for the period ending May 2, 2020.",2020-06-10
Cintas: A Reopening Bet At The Right Price,"As the economy reopens, businesses will need services to make their workplaces safer for their employees and customers. To address this demand, Cintas has added",2020-06-10
How Ambarella Is A Potential COVID-19 Play,Ambarella is a potential COVID-19 video camera screening play. Near-term risk: unfavorable valuations. Price target discussed.,2020-06-10
Pusha T’s Manager Steven Victor Pledges $1M To Fight Systemic Racism,Pusha T's manager and Universal SVP of A&R Steven Victor launched his philanthropic company with a $1 million pledge to fight systemic racism.,2020-06-10
Dutch pension fund APG eyes Tata Power’s RE InvIT,"APG is interested in acquiring 51% stake in Tata Power’s renewable energy InvIT.Citibank was given the mandate to find an investor for the InvIT, which includes 3GW RE projects",2020-06-10
Watch live: Ontario Premier Doug Ford makes COVID-19-related announcement - CTV News,"<ol><li>Watch live: Ontario Premier Doug Ford makes COVID-19-related announcement  CTV News
</li><li>Ont. minister holds coronavirus briefing as premier, health minister being tested for COVID-19  Global News
</li><li>Toronto Coun. Michael Ford, Ontario pre…",2020-06-10
How the president of the California Black Chamber of Commerce is helping thousands of Black business owners weather the pandemic and fight systemic racism in the lending process,"<ul>
<li>Jay King is the CEO and president of the California Black Chamber of Commerce, the largest Black nonprofit business organization.</li>
<li>He and the CBCC have dedicated themselves to supporting Black small businesses affected by the pandemic by orga…",2020-06-10
"The Exit, Voice, And Loyalty Model",Introduction. Macro and Credit – Overshooting creates spillover effects onto other markets. ELV Model ? Civil unrest is a rising global trend.,2020-06-10
Hackers Increasingly Rely on Trojans to Deploy Ransomware Attacks,Kroll’s Cyber Risk team detected a growing trend in the use of banking trojans to launch ransomware attacks.,2020-06-10
China accuses Australia of 'chronic racism',"China's state media has unleashed an extraordinary attack on Australia, saying its ""chronic"" problem with racism is worsening.

In a scathing piece overnight, the government-friendly Global Times said ...",2020-06-10
CareJourney Launches Solution to Analyze Highly Configurable Patient Cohorts,"ARLINGTON, Va., June 10, 2020 /PRNewswire/ -- CareJourney, a leading healthcare analytics company, announced the availability of its Cohort Atlas product that helps payers, life sciences, and providers analyze highly configurable patient cohorts. Customers ar…",2020-06-10
CareJourney Launches Solution to Analyze Highly Configurable Patient Cohorts,"CareJourney, a leading healthcare analytics company, announced the availability of its Cohort Atlas product that helps payers, life sciences, and providers analyze highly configurable patient cohorts. Customers are using CareJourney's new solution to measure …",2020-06-10
"COVID-19 “CARES Act” Bankrolls AI Post-Human Education: DeVos, Thiel, Phase 2 of Project BEST","In 1982, former Senior Policy Advisor in the Office of Educational
Research and Improvement for the US Department of Education, Charlotte Thomson
Iserbyt, blew the whistle on the Reagan Administration’s Project BEST (Better
Education Skills through Technology…",2020-06-10
The challenges of revamping public transport after COVID-19 safely,"This article was originally published by Sarah Wray on Cities Today, the leading news platform on urban mobility and innovation, reaching an international audience of city leaders. For the latest updates follow Cities Today on Twitter, Facebook, LinkedIn, Ins…",2020-06-10
Targeted training fund not just for the 'traditional' trades,"As the Government pumps money into getting people to study trades, it's hoped people take up careers in aged care and youth sectors.",2020-06-10
The Coronavirus Pandemic Isn’t Over: Keep Washing Your Hands As Economies Reopen,"Dr. Rodney Rohde, a virologist and clinical laboratory expert, explains why regular surface cleaning and handwashing will be even more important as social distancing requirements are relaxed.",2020-06-10
Former Halifax teacher pleads guilty to 35 historical sex offences,"A former Halifax-area teacher and coach has pleaded guilty to 35 historical sex offences involving 34 victims. Michael Patrick McNutt, 67, was facing more than 90 charges",2020-06-10
Michigan lawmakers want to declare racism a public health crisis,"“The only pre-existing condition that truly impacts black people and their health is racism,” one of the resolution's sponsors, Sen. Marshall Bullock, said Wednesday.",2020-06-10
"COVID-19: Of Masks, Social Distancing and More","By Peter Tocci Has advice from medical authority, commanded by politicians, aided by media-borne fear, created undue confidence in COVID-19 masks and social distancing? Questioning...
COVID-19: Of Masks, Social Distancing and More",2020-06-10
3 Unconventional Tips for Analyzing New Real Estate Markets,"In order to evaluate a real estate market, much advice suggests looking at the same metrics: population growth, household income growth, employment growth, and so on. Instead, let's discuss a few unconventional, forward-thinking ways to analyze regions from a…",2020-06-10
Why I broke with Boris Johnson,"A devastating indictment of the Prime Minister from one of his former allies and Downing Street advisers. 


 

 
"" data-adaptive-image-768-img="""" data-adaptive-image-max-img="""">


The dashboard was flashing red many months before Boris Johnson’s own life…",2020-06-10
Experts predict MBA programs post-COVID-19 will invest in more advanced virtual learning and courses on leading during crises — and experience a drop in international applicants,"<ul>
<li>Just as undergraduate institutions moved classes online at the onset of the COVID-19 pandemic, business schools have also had to rethink their teaching strategy.</li>
<li>Experts say that the high cost of virtual learning may cause lower-tier busines…",2020-06-10
Filipinos in UAE band together to weather coronavirus pandemic,"DUBAI, United Arab Emirates – Filipinos here have resorted to preparing hot meals and repacking groceries for fellow overseas Filipino workers (OFWs) heavily affected by the COVID-19 pandemic.
While some have lost jobs, others, like those in the hospitality s…",2020-06-10
Teachers Union Warns Safely Reopening US Schools During 'Triple Crisis' Could Cost $116.5 Billion,"Jessica Corbett, staff writer
A leading U.S. teachers union warned Wednesday that safely reopening K-12 public schools this fall in the midst of the coronavirus pandemic will require an estimated $116.5 billion federal investment—and that's on top of the fun…",2020-06-10
The Vanishing Social Dimension of Education in the Wake of COVID-19,"Like most other human activities, education has been brutally affected by the COVID-19 pandemic. The traditional classroom, a place of safety in which the teacher reigned over students and represented a form of political order, suddenly came to be seen as a p…",2020-06-10
The Broken Hearts Gallery: Sony Nabs Rights to Selena Gomez-Produced Rom Com,Sony Pictures Worldwide Acquisitions has successfully won the global rights to executive producer Selena Gomez's forthcoming romantic comedy film titled The Broken Hearts Gallery.,2020-06-10
"The Aspirations For Stakeholder Capitalism Must Be Very, Very High","The pause for the pandemic offers business leaders the perfect chance to rethink their business model and see the primary, creative role of employees in the pursuit of success.",2020-06-10
PM frees millions of couples to visit their partners and allows lone grandparents to see families,From Saturday two households can form 'support bubbles' that can meet indoors and stay overnight. But one of the two must be either a single person living alone or a single parent with children.,2020-06-10
CISLAC felicitates with 9th NASS after 12 months of inauguration,"Commends legislative activities Tasks legislators on PIGB, Electoral Reforms, NHIS Act, others By Gabriel Ewepu – Abuja The Civil Society Legislative Advocacy Centre, CISLAC, Wednesday, felicitated with the 9th National Assembly, NASS, after 12 months of the …",2020-06-10
Scientists and Others Stage a #Strike4BlackLives,"June 10 is a day off from “business as usual” for non-Black academics and a day of rest for Black students, staff and faculty

-- Read more on ScientificAmerican.com",2020-06-09
