Report Puts Verizon at Bottom of Clean Energy Rankings for Telecoms,"Verizon is back at the bottom of Green America’s Clean Energy Wireless Scorecard that grades the top US telecommunications companies on their renewable energy usage, with only 3-5% estimated clean energy use.
The post Report Puts Verizon at Bottom of Clean En…",2020-06-16T22:08:52Z
"Coastal GasLink ramps up pipeline work, 4 months after Wet'suwet'en land conflict sparked rail blockades","A pipeline project at the centre of a Wet'suwet'en land dispute that sparked rail blockades is ramping up work with 2,500 people set to lay pipe this summer.",2020-06-16T21:42:13Z
Big Brother at the airport and other commentary,"From the left: Big Brother at the Airport Coronavirus fears are bringing a whole new wave of surveillance for air travelers, warns Natasha Frost at Slate. But are the measures — from mandatory tracking apps to biometric scanning — worth it? “Between the hospi…",2020-06-16T21:38:24Z
U.S. Energy Infrastructure Hit Hard By Pandemic,"“And like in the current crisis, liquidity is king,” Phillips 66 chairman and chief executive Greg Garland said on the company’s Q1 conference call in early May.     Like the upstream, America’s midstream sector is also grappling with preserving liquidity in …",2020-06-16T21:00:00Z
What Proximity Detection For Contact Tracing Apps Is Going To Look Like In 2021.,Innovation flourishes in times of crisis - and we can see this in a range of new location-based technologies coming soon to your smartphone,2020-06-16T20:59:20Z
UN celebrates innovative public service delivery as pandemic heightens importance of work of the public sector,"Seven public institutions from Bangladesh, Botswana, Brazil, Mexico, Portugal, Republic of Korea, and Spain receive prestigious UN Public Service Awards.  

New York, 16 June– The UN announced today that seven innovative projects will receive this year’s UN…",2020-06-16T20:20:56Z
"Stocks end strong, overcoming sharp midday swings","Wall Street ends the session with solid gains Tuesday. The S&P 500 notches a gain of 1.9%, the Dow ends up 2% and the Nasdaq Composite rises 1.75%.Stocks wer",2020-06-16T20:13:15Z
Polaris Infrastructure Signs Letter of Intent to Acquire 10 MW Run-of-River Hydro Project in Panama,"Polaris Infrastructure Inc. (TSX: PIF) (""Polaris"" or the ""Company""), a Toronto-based company engaged in the operation, acquisition and development of renewable energy projects in Latin America, announced today that it signed a Memorandum of Understanding (""MO…",2020-06-16T20:00:00Z
Texas Regulator Eyes Flaring Crackdown,"Texas will look into policies to ""drastically reduce"" natural gas flaring as investors become increasingly sensitive to climate change concerns.",2020-06-16T19:40:00Z
Israel’s Annexation Puzzle in the Age of Great Power Competition,"Editor's Note: This piece originally appeared on Order from Chaos.
Jerusalem’s plan to apply Israeli sovereignty over parts of the West Bank next month poses a unique challenge to geopolitical alliances. As Washington adopts a more assertive China strategy, a…",2020-06-16T19:25:26Z
Israel’s Annexation in the Age of Great Power Competition,"Editor's Note: This piece originally appeared on Order from Chaos.
Jerusalem’s plan to apply Israeli sovereignty over parts of the West Bank next month poses a unique challenge to geopolitical alliances. As Washington adopts a more assertive China strategy, a…",2020-06-16T19:25:26Z
"Keynesians on the Cause of, and Cure for, Depressions","[This article is part of the Understanding Money Mechanics series, by Robert P. Murphy. The series will be published as a book in late 2020.]
In chapter 8 we presented Ludwig von Mises’s explanation of how bank credit expansion causes the boom-bust cycle, wha…",2020-06-16T19:00:00Z
"Power Sector: New electricity tariff regime starts in July, FG tells Senate","THE Federal Government told the Senate Tuesday that the new increment on electricity tariff would take off next month, July.
The post Power Sector: New electricity tariff regime starts in July, FG tells Senate appeared first on Vanguard News.",2020-06-16T18:47:59Z
The End Of The OPEC Deal Could Be The Start Of A New Oil Price War,,2020-06-16T18:40:41Z
"New electricity tariff regime starts in July, FG tells Senate","ABUJA - THE Federal Government told the Senate on Tuesday  that the new increment on electricity tariff would take off next month, July.
The post New electricity tariff regime starts in July, FG tells Senate appeared first on Vanguard News.",2020-06-16T18:30:55Z
Israel sends clear message of support to Greece in light of Turkish aggression (read full joint statement),The statement reaffirmed the cooperation between the two countries,2020-06-16T18:29:31Z
"FAPCCI, CII hail State budget","Federation of Andhra Pradesh Chambers of Commerce and Industry (FAPCCI) president C.V. Atchut Rao welcomed the State budget presented in the Assembly on Tuesday. In a statement, Mr. Rao said that the",2020-06-16T18:25:16Z
Lawmakers weigh how to help struggling energy industry,Lawmakers in both chambers are looking for ways to assist the energy industry as the economic fallout hits fossil fuels and renewables alike.Oil demand has plunged amid stay-at-home orders and co...,2020-06-16T18:19:45Z
Smart Money Is Betting On These 5 Exciting Energy Technologies,,2020-06-16T17:50:56Z
"Top priority to welfare, social justice: Governor",‘90% poll promises fulfilled; three capitals aimed at decentralisation of administration’,2020-06-16T17:48:31Z
Gov. Northam to address Virginia as COVID-19 trends decline,"Governor Ralph Northam is set to address the commonwealth on Tuesday for his latest briefing amid both the COVID-19 pandemic and continuing civil unrest over the murders of George Floyd, Breonna Taylor, Ahmaud Arbery and other black Americans.",2020-06-16T17:48:20Z
Schlumberger makes 'major changes' to organization to cut costs by $1.5 billion a year,"Schlumberger Ltd. said Tuesday that it has initiated ""major changes"" to its organizational structure, aimed at permanently removing over $1.5 billion in costs on an annual basis. The stock rose 2.4% in afternoon trading. The changes will result in $1.2 billio…",2020-06-16T17:47:14Z
Ashtead Group plc (ASHTF) CEO Brendan Horgan on Q4 2020 Results - Earnings Call Transcript,"Ashtead Group plc (OTCPK:ASHTF) Q4 2020 Earnings Conference Call June 16, 2020 6:00 A.M. ET Company Participants Brendan Horgan - Chief Executive Officer Michae",2020-06-16T17:45:44Z
5 US Clean Energy Projects That Barrelled Through the Coronavirus Lockdowns,"Fears that the coronavirus outbreak would sideswipe the U.S. clean energy market appear to be have been overblown so far, and the proof is in the projects.

2020 is the most socially and economically disruptive year for Americans in a generation. It’s also li…",2020-06-16T17:33:00Z
"Scientists criticize Alberta’s environmental monitoring suspension, lack of consultation","Despite pandemic fears, most monitoring could have been done safely, says the head of a group responsible for such work. “We’re trained to deal with dangerous, toxic biological hazards in our day-to-day work,” Jay White said. “The virus is no different.”",2020-06-16T17:15:58Z
Eight current Overseers share their unique stories,Profiles of eight current members of the Board of Overseers who share their unique stories of experience and service.,2020-06-16T17:10:26Z
Report: Annual Investment in Distributed Energy Resources Will Increase 75% by 2030,"The rate of annual investment in distributed energy resources (DERs) will increase 75% by 2030, with the market set for a decade of high growth.
The post Report: Annual Investment in Distributed Energy Resources Will Increase 75% by 2030 appeared first on Env…",2020-06-16T17:05:05Z
Campaigners take Estonian government to court over plans to build new shale oil plant,"Friends of the Earth Europe accuse the Estonian government of ""gambling on the failure of international climate agreements, a continued dependence on fossil fuels and the subsidising of the declining oil industry"".",2020-06-16T16:36:57Z
New Jersey aims to lead nation in offshore wind. So it’s building the biggest turbine port in the country.,,2020-06-16T16:20:21Z
180 Democrats ask House leadership for clean energy assistance,"A group of 180 Democratic lawmakers penned a letter to House leadership asking for congressional action to help the ""decimated"" clean energy sector, which has lost hundreds of thousands of jobs amid the coronavirus pandem...",2020-06-16T16:16:26Z
Colorado Rising Calls It Quits On New Ballot Initiatives,“Keep It In The Ground” activist group Colorado Rising recently announced that it is abandoning its campaign to put costly new anti-oil and natural gas initiatives up for a vote in November after admitting it couldn’t gather enough signatures to qualify for t…,2020-06-16T16:06:20Z
If you want to invest in the digital economy then Aveva shares are just the ticket - Motley Fool UK,"If you believe that post-Covid, the digital economy will be the area to invest in, then I think Aveva shares are just right.",2020-06-16T16:00:05Z
Carbon emissions may have peaked in 2019 — but scientists aren't celebrating just yet,"Reaching the peak of human-produced greenhouse gases would signal a historic turning point, but Earth is still projected to get warmer without a more drastic reduction.",2020-06-16T15:53:00Z
"The US Has Already Lost More Than 100,000 Oil And Gas Jobs","The US Has Already Lost More Than 100,000 Oil And Gas Jobs

 Tyler Durden
 
Tue, 06/16/2020 - 11:40

 Via Rystad Energy,


The US oil and gas labor market is amongst the world’s most severely hit by the downturn that the Covid-19 pandemic has brought, a Ryst…",2020-06-16T15:40:00Z
"$801 Million Worldwide Inline Metrology Industry to 2025 - Featuring Hexagon, Faro Technologies & Nikon Metrology Among Others","The ""Inline Metrology Market by Offering (Hardware, Software), Product (CMM, Machine Vision Systems, Optical Scanners), Application (Reverse Engineering, Quality Control & Inspection), Industry, and Geography - Global Forecast to 2025"" report has been added t…",2020-06-16T15:30:00Z
"$801 Million Worldwide Inline Metrology Industry to 2025 - Featuring Hexagon, Faro Technologies & Nikon Metrology Among Others","DUBLIN, June 16, 2020 /PRNewswire/ -- The ""Inline Metrology Market by Offering (Hardware, Software), Product (CMM, Machine Vision Systems, Optical Scanners), Application (Reverse Engineering, Quality Control & Inspection), Industry, and Geography - Global For…",2020-06-16T15:30:00Z
Remarks by President Trump in Roundtable Discussion on Fighting for Americas Seniors,"Cabinet Room2:40 P.M. EDTTHE PRESIDENT:Â  Okay, thank you very much.Â  Today is World Elder Abuse Awareness Day, and weâre here to discuss our ironclad commitment to protecting and caring for Americaâs seniors.Weâre joined by Vice President Mike Pence, …",2020-06-16T15:26:47Z
"BP Adopts $100 Carbon Price Assumption for 2030, with Big Implications for Clean Energy","For BP, some drilling just doesn't make sense anymore. The European oil major said this week that it will write down as much as $17.5 billion from its oil and gas portfolio, while baking in a new carbon price forecast of $100 per ton by 2030 — up from the $40…",2020-06-16T15:08:00Z
"Demand for Power & Distribution Transformers 2019-2025 and Utility Analysis of Distribution Transformers; Listing 7,188 DSOs by Country, Numbers of Customers and Transformers","The ""Bundle Report: Transformers Report Ed 8 and Utility Analysis 2020"" report has been added to ResearchAndMarkets.com's offering.",2020-06-16T15:00:00Z
"Diesel Generator Market to Reach $37.1 Bn, Globally, by 2027 at 9.8% CAGR: Allied Market Research","PORTLAND, Oregon, June 16, 2020 /PRNewswire/ -- Allied Market Research published a report, titled, ""Diesel Generator Market by Type (Small (0–75 KVA), Medium (75–375 KVA), and High (Above 375 KVA)), Mobility (Stationary and Portable), Cooling System (Air Cool…",2020-06-16T14:00:00Z
"Diesel Generator Market to Reach $37.1 Bn, Globally, by 2027 at 9.8% CAGR: Allied Market Research","Allied Market Research published a report, titled, ""Diesel Generator Market by Type (Small (0–75 KVA), Medium (75–375 KVA), and High (Above 375 KVA)), Mobility (Stationary and Portable), Cooling System (Air Cooled and Liquid Cooled), and Application (Standby …",2020-06-16T14:00:00Z
COLUMN-Copper blind-sided by the strength of Chinese recovery: Andy Home,The copper price has recovered strongly from its COVID-19 collapse in March.',2020-06-16T13:59:37Z
Indian LLDPE Market Assessment 2015-2030: Large Scale Capacity Additions and Lucrative Investment Opportunities - COVID-19 Updated - ResearchAndMarkets.com,"DUBLIN--(BUSINESS WIRE)--The ""India LLDPE Market: Plant Capacity, Production, Operating Efficiency, Technology, Process, Demand & Supply, Grade, End Use, Application, Distribution Channel, Region, Competition, Trade, Customer & Price Intelligence Market Analy…",2020-06-16T13:55:54Z
Nearly $1 Trillion in Investments Estimated by 2030 as Power Sector Transitions to a More Decarbonized and Flexible System,"Frost & Sullivan's recent analysis, Growth Opportunities in Distributed Energy, Forecast to 2030, finds that the rate of annual investment in distributed energy resources (DER) will increase by 75% by 2030, with the market set for a decade of high growth. Fav…",2020-06-16T13:39:00Z
"COVID – 19 Impact on Internet of Things in Energy Industry 2020 Market Size, Share, Growth, Regional Analysis, Top Manufacturers and Future Insights by 2025 - 3rd Watch News","COVID – 19 Impact on Internet of Things in Energy Industry 2020 Market Size, Share, Growth, Regional Analysis, Top Manufacturers and Future Insights by 2025  3rd Watch News",2020-06-16T13:31:14Z
"Growth in Automotive Manufacturing in Asia Pacific to Spur Strides in Computer Numerical Controls (CNC) Market, Global Valuation to Climb to US$ 115.1 Bn by 2027, Projects TMR",Deployment of computer numerical controls (CNC) technologies has reduced production times and human errors and increased precision of numerous complex industrial machinery such as lathes and milling machines. Technologies in the CNC market have been key enabl…,2020-06-16T13:30:00Z
"Looking Up: Market Takes Sharp Turn Higher As Fed Support, Infrastructure Hopes Front And Center","Things are looking up today as investors eye an infrastructure spending proposal, hopes of an ease in tensions with China, and strong retail sales. It looks like there’s still some “nervous longs” out there, and the market appears to still be pretty vulnerabl…",2020-06-16T13:29:52Z
Nearly $1 Trillion in Investments Estimated by 2030 as Power Sector Transitions to a More Decarbonized and Flexible System,"Frost & Sullivan's recent analysis, Growth Opportunities in Distributed Energy, Forecast to 2030, finds that the rate of annual investment in distributed energy resources (DER) will increase by 75% by 2030, with the market set for a decade of high growth. Fav…",2020-06-16T13:12:00Z
"Utilities Must Further Adapt, Diversify Investments to Edge out Competition and Meet Changing Energy Needs",WASHINGTON--(BUSINESS WIRE)--Guidehouse and Public Utilities Fortnightly release fifth annual State & Future of Power report,2020-06-16T13:10:59Z
Washington D.C.’s 25 Most Powerful People Real Estate Players in 2019,Painting the words “Black Lives Matter” on 16th Street in front of Lafayette Square could be described as the ultimate power move. Mayor Muriel Bowser has power. And she wields it. We’ve said before that the word “power” means something different in Washingto…,2020-06-16T13:00:51Z
Pale Blue Dot is a new early-stage fund backing ‘climate-focused’ startups in Europe,"Pale Blue Dot, a new “climate only” venture capital firm located in Malmö, Sweden, is officially de-cloaking today, with a first close of €53 million. Primarily targeting startups in Europe at pre-seed and seed, the VC plans to back companies that are using t…",2020-06-16T13:00:37Z
Vinyl Flooring Market to Reach USD 49.79 Billion by 2027 | CAGR of 6.6% | Reports And Data,"The Vinyl Flooring market is projected to reach USD 49.79 Billion by 2027. Rising demand is anticipated by factors such as High strength, excellent water resistance, and the lightweight properties offered by the product are expected to drive its demand over t…",2020-06-16T13:00:00Z
The World's 50 Best Restaurants Launches Global Fundraising Auction Featuring Bespoke Gastronomic Experiences With the World's Top Chefs,"The organisation behind The World's 50 Best Restaurants announces that its 'Bid for Recovery' Auction will debut on 3 July, offering food and travel enthusiasts the opportunity to bid for out-of-this-world gastronomic experiences with the world's best chefs. …",2020-06-16T13:00:00Z
Vinyl Flooring Market to Reach USD 49.79 Billion by 2027 | CAGR of 6.6% | Reports And Data,"NEW YORK, June 16, 2020 /PRNewswire/ -- The Vinyl Flooring market is projected to reach USD 49.79 Billion by 2027. Rising demand is anticipated by factors such as High strength, excellent water resistance, and the lightweight properties offered by the product…",2020-06-16T13:00:00Z
"Lean, zine-printing machines: how magazines are pressing on through lockdown - The Drum",The Drum reporters John McCarthy and Sam Bradley explore how magazines have adapted during the pandemic with a host of editors and publishers.,2020-06-16T13:00:00Z
The World's 50 Best Restaurants Launches Global Fundraising Auction Featuring Bespoke Gastronomic Experiences With the World's Top Chefs,"LONDON, June 16, 2020 /PRNewswire/ -- The organisation behind The World's 50 Best Restaurants announces that its 'Bid for Recovery' Auction will debut on 3 July, offering food and travel enthusiasts the opportunity to bid for out-of-this-world gastronomic exp…",2020-06-16T13:00:00Z
‘World’s largest green energy fund’ sets sights on US$16bn investment pot,"Copenhagen Infrastructure Partners has already raised €1.5bn of €10-14bn CI IV vehicle, set to back wind, solar and others across OECD states, developed Asian nations and Australia.",2020-06-16T12:47:00Z
50 Best Launches 'Bid for Recovery' Auction of Out-of-this-world Gastronomic Experiences With the World's Top Chefs,"LONDON, June 16, 2020 /PRNewswire/ -- The organisation behind The World's 50 Best Restaurants announces that its 'Bid for Recovery' Auction will debut on 3 July, offering food and travel enthusiasts the opportunity to bid for once-in-a-lifetime experiences wi…",2020-06-16T12:36:00Z
More investment in clean energy will help APAC recover from COVID-19 crisis: ADB,"A greater investment in clean energy will contribute to Asia-Pacific's recovery from the COVID-19 crisis and make economies more resilient against future shocks, the Asian Development Bank (ADB) said on Tuesday.",2020-06-16T12:33:05Z
Understanding What Asset Allocation Really Means,"Many investors see the word ""balance"" and assume that asset allocation automatically leads to diversification. That could be true, but not always.",2020-06-16T12:30:00Z
How Much Has the World Changed? (Not much),“This changes everything!”   That declaration should always be greeted with extreme skepticism. Your daily sheltering-in-place experiences are definitely different from what you previously thought of as your “normal” life. But what you should expect to experi…,2020-06-16T12:25:09Z
"Scientists criticize Alberta's monitoring suspension, lack of consultation","Shutting down a broad range of Alberta's environmental monitoring over pandemic fears wasn't necessary, says the head of a group responsible for such work.",2020-06-16T12:25:00Z
"Futures Soar On Stimulus Hopes, Fed Bond Buying, Ignore Geopolitical Clashes","Futures Soar On Stimulus Hopes, Fed Bond Buying, Ignore Geopolitical Clashes

 Tyler Durden
 
Tue, 06/16/2020 - 08:11

 After Monday's dramatic intraday reversal which saw the S&P500 surge more than 100 points from session lows and closing above its 200-day m…",2020-06-16T12:11:13Z
Swiss Commodity Traders Return to Desks and Jets as Virus Wanes,"(Bloomberg) -- In the commodities-trading capital of the world, staff at most of the biggest companies are returning to their offices and some are even venturing back into the skies for business flights.“In Switzerland, we have been quite lucky,” said Gerard …",2020-06-16T12:03:42Z
BitMEX Report Points to More Consolidation in Bitcoin ASIC Mining,"The Bitcoin mining ASIC manufacturing industry is expected to further consolidate, as is the wider mining farm operating sector.",2020-06-16T11:58:00Z
Innovation at the Vertical Edge: New Business Models for a Digital Economy,All industries feature well established business models — that’s just a more sophisticated way to say they have “proven ways to make money.” These business...,2020-06-16T11:30:39Z
BP takes $17.5B hit as pandemic shocks fossil fuel industry,Energy company BP is writing down its oil and gas assets by as much as $17.5 billion and will review its plans to develop oil wells as the shock to the industry and world demand from the COVID-19 pandemic pushes major producers to consider a faster shift away…,2020-06-16T11:21:57Z
"$7+ Billion Worldwide House Wraps Industry to 2027 - Featuring Alpha Pro Tech, Berry Global & CertainTeed Among Others - ResearchAndMarkets.com - Business Wire","$7+ Billion Worldwide House Wraps Industry to 2027 - Featuring Alpha Pro Tech, Berry Global & CertainTeed Among Others - ResearchAndMarkets.com  Business Wire",2020-06-16T11:21:00Z
East Daley Capital Launches New Solution to Channel Check Midstream Energy Companies,"CENTENNIAL, Colo.--(BUSINESS WIRE)-- #bakken--The Capital Markets solution provides an unbiased, third party perspective including insights down to the asset-level on company performance.",2020-06-16T11:05:10Z
Three capitals for decentralised administration: A.P. Governor,"Under the three-capital concept, Amaravati would be the Legislative capital, Visakhapatnam the Executive capital and Kurnool the Judicial capital, said Andhra Pradesh Governor Biswa Bhusan Harichandan.",2020-06-16T11:03:14Z
Current Affairs for IAS Exams - 16 June 2020,"Current Affairs for IAS Exams - 16 June 2020




::NATIONAL::


Centre asks states to engage with private sectors to improve healthcare


<ul>
<li>The Centre has asked States to engage with the private sector for augmenting healthcare infrastructure, and …",2020-06-16T11:01:45Z
More investment in clean energy will help APAC recover from COVID-19 crisis: Asian Development Bank,"""Greater investment in clean energy infrastructure will contribute to Asia and the Pacific's recovery from the coronavirus disease (COVID-19) pandemic and make economies more resilient against future shocks,"" ADB observed in its virtual Asia Clean Energy Foru…",2020-06-16T10:43:51Z
Turkey Is Struggling to Undo Lockdown Damage,"(Bloomberg) -- Once the growth engine of Turkey’s $750 billion economy, consumers are setting their sights lower in the post-lockdown era.After the coronavirus pandemic struck Turkey in mid-March, the government severely limited people’s movements at the expe…",2020-06-16T10:21:21Z
Long standing Indo-Nepal partnership threatened by vested interests in Kathmandu,"Long standing Indo-Nepal partnership threatened by vested interests in KathmanduAfter India became independent, the first Indian Prime Minister Jawaharlal Nehru stressed for economic development of Nepal to continue with the existing good relations between th…",2020-06-16T10:21:03Z
Sustainable Investment And The Race to Zero Emissions During The COVID-19 Pandemic,"Leaders internationally are calling for a green and equal economic recovery as the world rebuilds from the coronavirus pandemic. Will governments, companies, investors and funds align to drive the Sustainable & Impact investment needed to achieve net-zero car…",2020-06-16T10:12:26Z
'Our prosperity must be compromised because it is killing us',Coronavirus has forced the global economy to shrink. Is this what a more sustainable world without growth could look like? DW spoke to environmental economist Niko Paech about his ideas for a post-growth society.,2020-06-16T10:10:00Z
3 Elephant-Sized Deals Buffett Should Consider,Warren Buffett's company has $137 billion in cash -- here's how he could put some of it to work.,2020-06-16T10:06:00Z
"Bridge To India cuts solar, wind power capacity addition outlook to 35 Gw",The consultancy further noted that the sector was already grappling with a series of vexatious issues over the last few years,2020-06-16T09:40:00Z
EV industry grapples with consensus as sales fall further in May,The continued bleakness of the EV market has raised concerns about the extent by which Beijing will miss its near-term targets.,2020-06-16T09:35:56Z
South Africa: Environment and Religious Groups Stand Together Against Nuclear Energy,[Notes from the House] The Southern African Faith Communities Environment Institute (SAFCEI) and Earthlife have sent a letter to the Minister of Mineral Resources and Energy urging the government to abandon all plans for new nuclear energy programmes.,2020-06-16T09:27:03Z
"Nigeria: Experts Urge Govt to Unbundle TCN, Liquidate Stake in DISCOs",[This Day] Abuja -Experts in global energy business have asked the federal government to hasten its planned unbundling of the Transmission Company of Nigeria (TCN) into three separate entities.,2020-06-16T09:24:26Z
