"Examining the Coronavirus Impact: Internet of Things (IoT) Security Product Sales Accelerate, as Security Risk Concerns Aggravate over Remote Work Policies - Future Market Insights - Yahoo Finance","Internet of Things (IoT) security product market players are investing in the development of digital infrastructure for network security to sustain growth post the end of the COVID-19 pandemic. DUBAI, ...",2020-06-02T15:20:00Z
"SP 500, Dow scale fresh three-month peaks","Some of the worst-hit stocks in the travel sector, including American Airlines Group Inc, United Airlines, Norwegian Cruise Line and Carnival Corp, rose between 1.5 percent and 2.7 percent.",2020-06-02T15:13:03Z
Sustainable Finance Live: How investment opportunities can transform the greenhouse gas landscape,"Finextra Research and ResponsibleRisk today hosted Sustainable Finance Live, the first virtual workshop in series of events designed to create actionable ESGtech strategies and build an ecosystem of partnerships that will turn strategy into reality.",2020-06-02T15:05:10Z
Spotting Investment Opportunities In This Crisis Market,"There is a silver lining in the midst of all this economic uncertainty caused by the pandemic. While many companies have lost value due to the shelter-in-place orders and mandated business shutdowns, some industries and businesses are actually seeing growth d…",2020-06-02T14:24:24Z
Funding shortfall hinders pandemic response – World Bank chief,"WASHINGTON, USA – The global economy is facing ""staggeringly large"" losses and the recovery effort is hampered by a shortage of resources to make up for the damage caused by the coronavirus pandemic, World Bank President David Malpass said on Tuesday, June 2.…",2020-06-02T14:15:00Z
"Fitch Ratings downgrades Future Retail, Tata Motors; revises JSW Steel, Tata Steel outlook to negative","Fitch has lowered the ratings of 28 corporates in the APAC region, and made 
negative revisions to the rating outlook for a further 32 large 
undertakings, driven by the impact of COVID-19 pandemic",2020-06-02T14:12:59Z
"LanzaJet Takes Off: Innovative Sustainable Fuel Technology and Investment Structure to Accelerate Commercialization, Regional Job Growth, and Carbon Reduction - GlobeNewswire","LanzaJet Takes Off: Innovative Sustainable Fuel Technology and Investment Structure to Accelerate Commercialization, Regional Job Growth, and Carbon Reduction  GlobeNewswire",2020-06-02T14:06:29Z
"Stocks edge higher as investors focus on economy, ignore urban unrest","The stock market looks to extend recent gains, decoupling from the outside world where the rioting and social unrest that has swept across American cities threat",2020-06-02T14:00:45Z
S&P 500 Dashboard For June,"A score in value, quality and momentum for every sector. Evolution since last month. The best and the worst sectors for these metrics.",2020-06-02T13:56:02Z
LNG Exports And European Inventories: What Is Going On And What It Means For U.S. Natural Gas Prices,LNG export demand peaked at 9.5 BCF/day in February 2020 but has since fallen by over 5 BCF/day. While weak overseas pricing--in some cases negative to Henry Hu,2020-06-02T13:55:28Z
"If Joe Biden wins in November, COVID-19 could force his hand on climate change","The COVID-19 pandemic has had profound impacts on the US economy, and it’s likely to have similarly far-reaching effects on our politics. Over 40 million Americans are currently unemployed. Recent…
  Related Stories<ul><li>Voting Rights Roundup: Court axes Fl…",2020-06-02T13:30:00Z
"Amara Raja bucks automotive sector slowdown with strong performance in replacement market, exports","Aided by strong performance in the replacement market and exports, Amara Raja Batteries Ltd achieved positive numbers during FY20.The company’s good show during the financial year ended March 31, c",2020-06-02T13:21:49Z
Coronavirus Pandemic Will Cost U.S. Economy $8 Trillion,"Covid-19 will inflict long term damage on the U.S. economy, shrinking it by almost $8.0 trillion over the next decade, according to new projections by the Congressional Budget Office (CBO).",2020-06-02T13:20:00Z
Coronavirus pandemic will haunt U.S. economy for a decade and wipe $8 TRILLION off economic growth,"Phillip Swagel, director of the Congressional Budget Office, projected the virus will reduce U.S. economic output by three per cent through 2030 - a loss of $7.9tn. Democrats have called for more help.",2020-06-02T13:17:59Z
Agriculture Equipment Market - Active Promotion of Sustainable Agricultural Practices by Governments in Developing Economies to Fuel the Market Growth - GlobeNewswire,"Key Companies Covered in Agriculture Equipment Market Research Report Are International Tractors Limited Valmont Industries, Inc. Claas KGaA mbH, Mahindra & Mahindra Ltd., Alamo Group Inc., Deere & Company, SDF S.p.A., China National Machinery Industry Corpor…",2020-06-02T13:10:46Z
"3 tech stocks that haven’t fully recovered yet — yes, they still exist","Last week, a rotation started to form from the technology sector into value: sectors that are still discounted such as the energy, financial services, and retail sector. Over the course of the week, the S&P 500 Value ETF (SPYV) gained nearly 5%, while the S&P…",2020-06-02T13:02:21Z
Cargill demonstrates significant progress against critical sustainability goals,"MINNEAPOLIS, June 2, 2020 /PRNewswire/ -- At Cargill, sustainability is written into the company's purpose—and woven into core operations including investment priorities, organizational structure and resource allocation. The company recently outlined progress…",2020-06-02T13:00:00Z
Critical Update: National Labs Pivoted to Help Fight COVID-19. Here's How.,Federal insiders offer a glimpse of how the global health care crisis sparked a new wave of multi-sector collaboration.,2020-06-02T13:00:00Z
Building Information Modeling (BIM) Market Size to Reach USD 16.35032 Billion by 2025 | Valuates Reports,"Building Information Modeling (BIM) is an intelligent digital 3D model-based process that gives architecture, engineering, and construction (AEC) professionals the insight and tools to more efficiently plan, design, construct, and manage buildings and infrast…",2020-06-02T12:49:00Z
Building Information Modeling (BIM) Market Size to Reach USD 16.35032 Billion by 2025 | Valuates Reports,"BANGALORE, India, June 2, 2020 /PRNewswire/ -- Building Information Modeling (BIM) is an intelligent digital 3D model-based process that gives architecture, engineering, and construction (AEC) professionals the insight and tools to more efficiently plan, desi…",2020-06-02T12:49:00Z
"US protests could spread virus, concerns over South America reopening","There are concerns that widespread protests over the death of George Floyd, a black man pinned at the neck by a white police officer, could cause new outbreaks in a nation where the virus has disproportionately affected racial minorities.",2020-06-02T12:46:00Z
CBO projects virus impact could trim GDP by $15.7 trillion,"The office forecasts the GDP will fall at a 37.7% rate in the current April-June quarter, the biggest quarterly decline on record.",2020-06-02T12:38:14Z
Coronavirus will increase investors’ appetite for sustainable strategies – and accelerate major changes in the way capital is allocated,"The relative resilience of ESG strategies through the recent market rout could mark a watershed moment for sustainable investment. Fleeting
The post Coronavirus will increase investors’ appetite for sustainable strategies – and accelerate major changes in the…",2020-06-02T12:33:32Z
"Will Covid-19 Lead To A Greener, Fairer Society?","Attention is increasingly turning to what kind of world we will have after the coronavirus pandemic.  While there is a strong desire to return to a normal life, what should the new normal look like?",2020-06-02T12:30:00Z
GE Sells Yet Another Division,"General Electric's latest sale was relatively small, but it was a big statement about the future of the company",2020-06-02T12:29:07Z
Hotel REITs Vs. Cruise Ships: What Is The Best Contrarian Opportunity In 2020,"Hotel REITs and cruise ship companies are among the most beaten down stocks in the current market place. They offer the potential for enormous reward, but they",2020-06-02T12:25:00Z
Business Process Management (BPM) Market to reach USD 21.41 Billion by 2026; Companies Engage in Introducing Upgraded Versions of Products to Boost Sales | Fortune Business Insights™ - GlobeNewswire,"Key Companies Covered in BPM Market Research Report Are Appian Corporation, IBM Corporation, Kissflow, Laserfiche, BP Logix, Inc., Fujitsu Ltd., Infosys Ltd., SourceCode Technology Holdings, Inc., Ninox, Nintex Platform, Opentext, Inc., Oracle Corporation, Pe…",2020-06-02T12:18:01Z
Shorts Looted As Global Markets Hit 3-Month High After Nationwide Riots Turn Deadly,"Shorts Looted As Global Markets Hit 3-Month High After Nationwide Riots Turn Deadly

 Tyler Durden
 
Tue, 06/02/2020 - 08:03

 The Fed's ""administered market"" just refuses to stop.


Global stocks and S&P futures rose to three-month highs as central banks lo…",2020-06-02T12:03:00Z
How to Be Diversified Without Overexposure,Discover the best way to protect against being overexposed to a single sector or company while still letting your winners win.,2020-06-02T11:54:00Z
Nigeria: Politics and Nigeria's Electricity Sector,"[Premium Times] Lagos -While Nigerians are busy with the management of COVID-19 and its many fall-outs, fire has been burning in other aspects of national life which require equal attention both now and after COVID-19 - the increasing spate of insecurity in t…",2020-06-02T11:25:43Z
Exposing the World's Biggest Carbon Emitters,"“Energy accountant” Richard Heede does research needed to hold major polluters accountable for their actions.

-- Read more on ScientificAmerican.com",2020-06-02T11:24:00Z
CapitaLand obtains S$500 million sustainability-linked bilateral loan,The group raises S$2.42 billion through sustainable finance in less than two years underscoring its commitment to responsible growth.,2020-06-02T11:22:58Z
How The Current Pandemic Reveals The Urgency Of The Renewable Energy Transition,"Much like the rest of the energy sector and many other industries, the renewables market has been hit hard by the coronavirus pandemic.",2020-06-02T11:10:00Z
Bill puts slowly sinking lid on emissions,Proposed sinking lid on New Zealand's emissions would drop carbon by a few tonnes a year.,2020-06-02T11:08:53Z
"Internet of Things (IoT) Security Market Growing at a CAGR of 34.10 % | Intel Corporation, Infineon Technologies AG, Symantec Corporation, Gemalto NV, Allot, Fortinet, Inc. and More - WaterCloud News","Internet of Things (IoT) Security Market Growing at a CAGR of 34.10 % | Intel Corporation, Infineon Technologies AG, Symantec Corporation, Gemalto NV, Allot, Fortinet, Inc. and More  WaterCloud News",2020-06-02T11:07:00Z
“Not just lip service:” Real estate promises change following George Floyd’s death,"As anger and frustration over racism and police brutality grip the nation, real estate executives and business leaders are promising change — and pleading for peaceful protest. George Floyd, a black man in Minneapolis, died May 25 after a police officer knelt…",2020-06-02T11:00:40Z
New interview series examines the future of energy amid COVID-19,"Global thought leaders will examine the future of energy in the new Stanford Global Energy Dialogues series. Topics will include energy’s role in the economic recovery from COVID-19, decarbonization and energy access for all.",2020-06-02T10:55:10Z
Investments in Indian start-ups plunge 57per cent in May,"KhataBook, Lendingkart among top-funded companies",2020-06-02T10:54:13Z
CBO projects virus impact could trim GDP by $15.7 trillion,"CBO called this a ""significant markdown"" in GDP output as a result of the pandemic.",2020-06-02T10:40:37Z
The Energy Bulletin Weekly 2 June 2020,Futures were volatile last week with prices bouncing between $31 and $35 a barrel in response to the latest news. Oil closed out May on Friday with a record monthly gain of 88 percent on hopes demand for oil would continue to rise as economies reopen and crud…,2020-06-02T10:35:57Z
Vision 2030: The Impact of COVID-19 on Saudi Arabia’s Diversification Programme,"by Jaansiva Yuliya Sheejan The COVID-19 pandemic, one of our era’s defining black swan events, has wreaked havoc throughout the global economy, bringing the world to a grinding halt. The energy industry has been among those sectors bearing the brunt of the pa…",2020-06-02T10:04:03Z
Jim Balsillie: Harness the power of innovation to compete in a post-COVID world,"By harnessing their proven ambition and ingenuity, Canadian innovators can help the economic recovery. But only if our governments put wind in their backs",2020-06-02T10:00:01Z
"Trade cautiously in crude, demand may take years to recover",A big question is whether US shale producers could spoil the party by restarting shut-in production or completing wells the moment that prices rise high to earn any positive cash flow.,2020-06-02T09:36:04Z
"‘Not random, aimed at self-reliant India’: PM Modi on policy announcements - Hindustan Times","<ol><li>‘Not random, aimed at self-reliant India’: PM Modi on policy announcements  Hindustan Times
</li><li>PM Modi promises structural reforms, assures industry that economic growth will return  Livemint
</li><li>Coronavirus Outbreak LIVE Updates: Jharkha…",2020-06-02T09:35:59Z
US freight after COVID-19: What’s next?,"The pandemic has scrambled customer demand, further muddying a complicated picture. New research highlights four forces to watch.",2020-06-02T00:00:00Z
Feeding the world sustainably,"Innovations in food sustainability, including green technologies, biotech advances, and artificial intelligence, could help tame agricultural emissions and waste, while safeguarding ocean resources.",2020-06-02T00:00:00Z
Budget Office Finds US Economy Won't Return To Normal Until 2030,"Budget Office Finds US Economy Won't Return To Normal Until 2030

 Tyler Durden
 
Mon, 06/01/2020 - 19:32

 There goes the V-shaped recovery.


In its first official forecast incorporating the impact from the coronavirus shutdowns, today the Congressional Bu…",2020-06-01T23:32:52Z
Do COVID numbers justify Pelosi's 'cheat by mail' idea?,"By Michael Schisler Democrat Nancy Pelosi is spearheading a national effort to implement what many critics label as ""cheat by mail"" as part of the proposed Heroes Act legislation crafted under her direction. The idea is to federalize state election processes …",2020-06-01T23:31:33Z
"Coronavirus will have long-lasting effects on US economy for next decade, CBO says","It could take a decade for the U.S. economy to fully recover from the lingering effects of coronavirus, the Congressional Budget Office said Monday.",2020-06-01T23:03:05Z
The DCN Guide to Online Coffee Events: June 2-8,Welcome to DCN’s weekly roundup of coffee events! Hosting an online event that’s free or nearly free to attend? Let us know here. Due to an overwhelming number of requests and our desire to keep th…,2020-06-01T22:22:50Z
OVERNIGHT ENERGY: Trump rule limits states from blocking pipeline projects | EPA finalizes rule to regulate cancer-linked chemical | Democrats want Congress to help plug 'orphan' oil and gas wells,"HAPPY MONDAY! Welcome to Overnight Energy, The Hill's roundup of the latest energy and environment news. Please send tips and comments to Rebecca Beitsch at rbe...",2020-06-01T21:46:22Z
Australian tradies and labourers could be set for a HUGE hit to the pocket,"Construction companies are pushing for an end to some industry award regulations, which they say are making it difficult for the sector to recover from the COVID-19 shutdown.",2020-06-01T21:38:21Z
'Investors already anxious about it': Australia's gas future questioned on Q+A,Queensland Nationals senator Matt Canavan defends his belief that Australia should leave the Paris Climate Accord as economic researcher Zoe Whitton warns Australia's plans for a gas-fired future may not be entirely plausible.,2020-06-01T21:25:44Z
Young people explain how they're coping with the Covid-19 pandemic,"A carer going the extra mile, a teenager developing a coronavirus tracking app and a student nurse working 12 hour shifts contributed to the Mirror's Next Gen edition",2020-06-01T21:12:47Z
Clear Skies Are a Cover-Up for India’s Fossil Fuel Expansion,"With blue skies in Delhi and the Himalayas peeking out of Punjab’s smog, you’d be forgiven for thinking covid-19 has inadvertently cleaned up pollution-choked parts of India, the world’s third largest emitter and home to its most polluted cities. Instead, in …",2020-06-01T21:10:00Z
‘You have to dominate’ says Trump,"Good morning, early birds. Donald Trump has called on a collection of governors to 'dominate' and arrest protesters and, despite everything, the Morrison government apparently will not rule out rebooting robodebt. It's the news you need to know, with Chris Wo…",2020-06-01T21:06:20Z
SET poised to dip over 1-3 months,"Thailand's stock market is projected to decrease over the next 1-3 months, with the net profit of SET-listed firms bottoming out this quarter from the Covid-19 impact, say analysts.",2020-06-01T21:02:00Z
"Capitol Report: Coronavirus economic shock to be felt for a long time, CBO says",The CBO says it expects real gross domestic product to be about 3% smaller over the 2020 to 2030 period than it had projected in January.,2020-06-01T20:47:15Z
Thermon Group Holdings (THR) CEO Bruce Thames on Q4 2020 Results - Earnings Call Transcript,"Thermon Group Holdings (NYSE:THR) Q4 2020 Earnings Conference Call June 1, 2020 11:00 ET Company Participants Kevin Fox - Vice President, Corporate Development",2020-06-01T20:06:05Z
U.S. Producers Prove Better Swing Supplier Than Previously Thought,The quick reaction of American producers to cut output in response to market conditions have shown the U.S. to be a better swing supplier than previously believed possible.,2020-06-01T19:51:38Z
"If the market can’t provide the beneficial things society needs to save lives, give it a nudge","The world was not prepared for the coronavirus pandemic, and it won’t be prepared for the next one unless we ensure that necessary resources — facemasks, hospital beds, ventilators, skilled professionals — are on hand in sufficient quantities.",2020-06-01T19:43:16Z
Commodities In Crisis As Geopolitical Turmoil Hits Key Markets,"U.S.-China tensions have bubbled up again, and commodity markets could be caught up in the turmoil, not least LNG. Aviation activity and jet fuel are also in the mix this week, along with corn fundamentals in North and South America, and UK solar power. 1. U.…",2020-06-01T19:30:00Z
COVID pandemic will shrink economy by $8 trillion in next decade: CBO,"The COVID-19 pandemic will reduce the size of economic output by a combined $7.9 trillion over the next decade in real terms, or 3 percent of cumulative GDP, according to a report by the Congressional Budget Office....",2020-06-01T19:13:18Z
"EOG Resources, Inc. (EOG) CEO Bill Thomas Presents at AllianceBernstein Strategic Decisions Conference (Transcript)","EOG Resources, Inc. (NYSE:EOG) AllianceBernstein Strategic Decisions Conference Call May 27, 2020 10:00 AM ET Company Participants Bill Thomas - CEO Conference",2020-06-01T18:30:43Z
A Low Vol ETF’s Big Reshuffle,‘SPLV’ has turned its allocation on its head in a year of firsts.,2020-06-01T18:30:00Z
Oil Majors Face Another Impossible Decision,"The oil industry only has two choices as it reshapes itself after the oil price crash — either become broader energy firms or pursue a narrower specialization in oil and gas, Energy Voice reported, citing a new report from PwC. The coronavirus pandemic brough…",2020-06-01T18:00:00Z
Internet of Things (IoT) Security Market Research Report 2027 - openPR,Internet of Things IoT Security Market is set to witness a healthy CAGR of 34 10 in the forecast period of 2019 to 2026 Internet Of Things Iot Security Market 2020 This is a latest report covering the current COVID ...,2020-06-01T17:33:00Z
An Investment-Led Economic Recovery,There are decades when nothing happens; and there are weeks when decades happen”. The political response to the coronavirus has dramatically proved Lenin to be,2020-06-01T17:31:01Z
The End of Meat is Here: Article Debunk with Diana Rodgers | Salty Talk 011 | THRR,"Welcome to Salty Talk. This is a special edition of Healthy Rebellion Radio. Each week on Salty Talk Robb will do a deep dive into current health and performance news, mixed with an occasional Salty conversation with movers and shakers in the world of researc…",2020-06-01T17:25:15Z
AfDB: Amb Doley asks Trump to support Adesina,"Says he is a man of impeccable character Emma Ujah America’s pioneer board member of the African Development Bank (AfDB), Amb. Harold Doley, Jr. has asked President Donald Trump to support the bank’s President Akinwumi Adesina. In an open letter to the Secret…",2020-06-01T17:13:25Z
How Taiwan Can Turn Coronavirus Victory Into Economic Success,Taiwan beat the virus with efficient government and advanced technology—the same ingredients that power the economy.,2020-06-01T17:11:05Z
How Innovation Works,Review of “How Innovation Works” by Matt Ridley,2020-06-01T17:10:47Z
Biofuel Gets Another “Never Surrender!” Moment,"The world of biofuel is having a down moment just now, as is practically every other part of the energy universe. Nevertheless, signs of a green rebirth are ever blooming. The latest development involves cyanobacteria, aka blue-green algae, an organism that h…",2020-06-01T17:10:38Z
"Episode #225: Eric Crittenden, Standpoint Asset Management, “I Enjoy Trying To Win A Marathon Rather Than Winning Sprints”","Episode #225: Eric Crittenden, Standpoint Asset Management, “I Enjoy Trying To Win A Marathon Rather Than Winning Sprints”           Guest: Eric Crittenden is Chief Investment Officer of Standpoint Asset Management. He has over 20 years of experience designin…",2020-06-01T17:00:44Z
Success in the next normal starts with employee education and reskilling | ZDNet,What can businesses do to best position themselves in a digital economy post COVID-19 pandemic? Employee education and reskilling is arguably the most critical success factor in the Next Normal.,2020-06-01T16:40:23Z
World’s Top Solar Panel Producer Opens New Mega Factory,"Renewables stocks have outperformed the broader energy markets in the last couple of months and, while Covid-19 has disrupted supply chains and caused a temporary dip in solar installations, the mid-and-long-term outlook for the sector as a whole remains brig…",2020-06-01T16:30:00Z
Pembina Pipeline Corporation Provides Notice of Series 19 Preferred Share Conversion Right and Announces Reset Dividend Rates,"Pembina Pipeline Corporation (""Pembina"" or the ""Company"") (TSX: PPL; NYSE: PBA) announced today that it does not intend to exercise its right to redeem the currently outstanding Cumulative Redeemable Rate Reset Class A Preferred Shares, Series 19 (""Series 19 …",2020-06-01T16:26:00Z
Pembina Pipeline Corporation Provides Notice of Series 19 Preferred Share Conversion Right and Announces Reset Dividend Rates,"CALGARY, June 1, 2020 /PRNewswire/ - Pembina Pipeline Corporation (""Pembina"" or the ""Company"") (TSX: PPL; NYSE: PBA) announced today that it does not intend to exercise its right to redeem the currently outstanding Cumulative Redeemable Rate Reset Class A Pre…",2020-06-01T16:26:00Z
Africa: First U.S. Representative to African Development Bank Supports AfDB President Adesina,"[allAfrica] An open letter to United States Secretary of the Treasury Steven Mnuchin from Ambassador Harold E. Doley, Jr. This letter follows your recent correspondence to the Chair of the Bureau of the Board of Governors of the African Development Bank Group…",2020-06-01T16:22:54Z
IMFâ€s Kristalina Georgieva: Beyond the COVID-19 Crisis - IMF F&D,IMF Managing Director Kristalina Georgieva looks beyond the COVID-19 crisis and how we can take advantage of this opportunity to build a better world.,2020-06-01T16:07:32Z
Clean energy bill is key to reinvigorating Illinois’ post-COVID economy,"When the Illinois General Assembly met last week, lawmakers addressed the COVID-19 crisis among other priorities. This is, above all, a public health crisis and a human tragedy. More than 100,000 people in the state have been infected with this virus, and hea…",2020-06-01T16:02:08Z
Green income trusts could accelerate Canada’s energy transition,Research into income trusts shows that they once helped increase investments in oil and gas. They could do so again — but this time targeted towards low-carbon technologies.,2020-06-01T15:55:05Z
Platts: 5 Commodity Charts To Watch This Week,"Platts: 5 Commodity Charts To Watch This Week

 Tyler Durden
 
Mon, 06/01/2020 - 11:37

 Via S&P Global Platts Insights blog,


US-China tensions have bubbled up again, and commodity markets could be caught up in the turmoil, not least LNG. Aviation activity…",2020-06-01T15:37:04Z
More than 200 companies call for a green recovery in the UK,"206 multinational and national companies and investors in the UK have signed a letter that calls on the British government to deliver a sustainable coronavirus recovery program.
 more…
The post More than 200 companies call for a green recovery in the UK appea…",2020-06-01T15:18:12Z
Bitcoin Is a Big Opportunity for Investors in the Debt-Fueled Roaring Twenties,"With interest rates for government debt near zero, or negative, the fixed income asset class has disappeared. The investment case for Bitcoin just gets stronger.",2020-06-01T15:16:23Z
