Oil Companies Forced To Renegotiate Deals Or Risk Losing It All,"On April 20, the West Texas Intermediate crude benchmark did not just fall below zero, it plummeted to negative $37.63 a barrel. This stunning price crash was the result of a months-long series of unfortunate events, starting with a global decrease in oil dem…",2020-05-24T19:00:00Z
"‘With limited resources, Rajasthan concerned about economy’s revival’","State govt. is also pursuing the proposed investments of global companies, says Additional Chief Secretary (Industries)",2020-05-24T18:28:46Z
The Coronavirus Should Signal The End Of Fossil Fuels,"Two recent surveys show Americans are concerned about climate change even in the midst of a pandemic, and prefer economic assistance for clean energy rather than fossil fuels.",2020-05-24T18:05:58Z
View: Opportunities India should leverage to make it a global post-Covid model economy,"India must view this crisis as an exercise in building institutional and governance capacity — in particular, by leveraging five opportunities that can position it as a model to emulate in post-Covid-19 recovery and growth.",2020-05-24T17:49:54Z
Hillenbrand: Softness In End-Markets To Weigh On 2020 Revenue,"In Q2 FY 2020, HI delivered a 40% total revenue growth propped up by the Milacron acquisition.Softness in the energy sector and the automotive industry was among the principal culprits of the PEG and Milacron sales decline.Operating income and net earnings we…",2020-05-24T17:35:59Z
"Hercules Capital's 11.8% Yield: Despite Price Plunge, Less COVID Susceptibility","Hercules Capital has been severely impacted by the current crisis, and its share price has plunged.However, its sector exposures and balance sheet position suggest it may have a much easier time weathering this storm compared to other BDCs.This article review…",2020-05-24T17:35:54Z
3 Dividend Stocks That Pay Better Than Coca-Cola,Coke has suffered from restaurant closures. What stocks might be better bets?,2020-05-24T16:27:00Z
Transcript: Jon Taffer,"﻿   The transcript from this week’s, MiB: Jon Taffer, is below. You can stream and download our full conversation, including the podcast extras, on Apple iTunes, Spotify, Overcast, Google, Bloomberg, and Stitcher. All of our earlier podcasts on your favorite …",2020-05-24T16:00:18Z
Peter MacKay says fall election not ‘the priority’ for the country amid coronavirus,The Tory leadership candidate's comments during an interview on 'The West Block' suggest he may not push for a fall 2020 election he takes the helm of the party.,2020-05-24T15:31:56Z
COVID crisis could UNIFY world’s largest oil companies,"Giant M&A deals are in the making following the oil price crisis, but the market may not see the typical kind of merger. Read Full Article at RT.com",2020-05-24T15:10:59Z
Plastics profit and environment neglected during pandemic,"In mid January the British Columbia government announced it was looking at a wide ban on single-use plastic grocery bags to put an end to a piecemeal, city-by-city approach to the problem of plastic pollution.",2020-05-24T14:45:34Z
"UBS lays out market strategies for all 3 economic-reopening scenarios, from a successful recovery to a COVID-19 resurgence","<ul>
<li>Uncertainty around the coronavirus pandemic's trajectory has led Mark Haefele — chief investment officer at UBS — to detail three strategies for various economic-reopening scenarios.</li>
<li>The bank's more optimistic scenario sees the US avoiding a…",2020-05-24T13:20:00Z
Searching For Undervalued Stocks In Insider Purchases - Weekly Update (05/15/20 - 05/21/20),"We are currently in one of the toughest market conditions to find attractively valued stocks which will survive the crisis easily.Following insider purchasing activity could help with this issue, as they trade based on undervaluation and/or superior insider k…",2020-05-24T13:00:00Z
Record low solar tariffs may affect build quality,Calls to review reverse auction mechanism for awarding renewable energy projects to incorporate more quality control,2020-05-24T12:57:16Z
Is ExxonMobil Stock a Buy Right Now?,The sentiment for the oil and gas sector is bad. But savvy investors can see that ExxonMobil is a better buy now than it was a few months ago.,2020-05-24T12:31:00Z
Why Are We Subsidizing Fossil Fuels? Seriously,"Supporting renewables can cut emissions and boost the economy, all while providing cost-competitive energy. Yet the Trump Administration continues propping up the fossil fuel industry — despite the sector facing real financial problems that began long before …",2020-05-24T12:30:49Z
Coronavirus: Jaguar Land Rover in talks over government loan,The carmaker is reportedly seeking more than £1bn in taxpayer support as the pandemic hits sales.,2020-05-24T12:13:33Z
Coronavirus: Jaguar Land Rover in talks over government loan,The carmaker is reportedly seeking more than £1bn in taxpayer support as the pandemic hits sales.,2020-05-24T11:31:42Z
News24.com | Tourism industry working around the clock to prevent loss of up to 600 000 jobs - minister,"Stakeholders in the South African tourism industry have told President Cyril Ramaphosa the industry could lose up to 600 000 jobs by September, if Covid-19 lockdown regulations continue to prevent it from operating.",2020-05-24T11:25:38Z
Remote Amazon tribe decimated by epidemic braces for COVID-19,Indigenous tribes have suffered from contagious diseases dating back to 16th century European incursions into the Amazon basin.,2020-05-24T11:20:07Z
Air Peace to evacuate stranded Indians from Lagos to Kerala - Nairametrics,"A list of the passengers to be attended to has already been given and the flight shall depart Lagos on May 30, 2020, to Cochin Airport, Kerala.",2020-05-24T10:38:17Z
How COVID-19 has affected film industry,"The COVID-19 pandemic has affected every sector of the economy. Banking, oil and gas, tourism, telecommunication, education, energy, even the film, entertainment and media industries have been directly or indirectly affected by the pandemic.
The post How COVI…",2020-05-24T10:18:34Z
The Path To Monetary Collapse,"The financial world is bemused: what is it to make of the economic effects of the coronavirus?The official answer, it seems, is on the lines of don't panic.Whether this evolving policy is right will be proved in due course.",2020-05-24T10:13:48Z
Where To Find Yield Today,"T-bills, savings accounts and money market funds all yield essentially zero, and it's hard to find CDs yielding more than about 1.5%.It is still possible to generate a respectable income stream on your investments without taking excessive risk.You just have t…",2020-05-24T08:35:29Z
Cobalt Miners News For The Month Of May 2020,"Cobalt spot prices were flat for the month and LME cobalt inventory was about the same.Cobalt market news - Both cobalt demand and supply have been down in Q1, 2020 due to COVID-19.Cobalt miners news - Ardea Resources maiden gold Resource, Cobalt Blue testwor…",2020-05-24T07:35:43Z
China crucial to early post-COVID-19 economic recovery,"Author: Wei Li and Hans Hendrischke, Sydney University China’s economy is poised for a quick rebound. In March, factories reopened and in April, schools started reopening in China’s biggest cities. Daily coal consumption has returned to 90 per cent of pre-COV…",2020-05-24T06:00:47Z
Edited Transcript of ELUX B.ST earnings conference call or presentation 7-May-20 7:00am GMT,Q1 2020 Electrolux AB Earnings Call,2020-05-24T04:59:28Z
"View: Cleaner, and now cheaper, solar power beats coal","Solar power has looked a bright prospect for years since the price of solar panels keeps falling.  Priority to solar power makes economic sense since it entails no running costs, whereas thermal power entails fuel costs.",2020-05-24T04:57:58Z
A tale of disconnected dots: The regulatory algorithm behind Electricity Amendment Bill 2020,"Privatisation, which is one of the potential impacts of the amendments, is also the preferred narrative of the govt to deal with Covid–19 pandemic. The Finance Minister, has recently announced that Union Territories will soon have private discoms and the same…",2020-05-24T04:57:02Z
Edited Transcript of LNZ.VA earnings conference call or presentation 6-May-20 7:00am GMT,Q1 2020 Lenzing AG Earnings Call,2020-05-24T04:09:05Z
"Chinese premier stresses achieving main economic, social development targets","Chinese Premier Li Keqiang on Saturday stressed striving to achieve this year's main targets for economic and social development, though the country is facing difficulties and challenges like never before.",2020-05-24T04:00:00Z
"Xi stresses analyzing China's economy from comprehensive, dialectical, long-term perspective","President Xi Jinping on Saturday stressed analyzing China's economic situation from a comprehensive, dialectical and long-term perspective, urging efforts to foster new opportunities amid challenges and make new advances amid changes.",2020-05-24T04:00:00Z
Dharmendra Pradhan sees fuel demand reaching pre-Corona level next month as India gets back to work,A rebound in fuel demand indicates India is getting back to work and the world’s third-largest energy market is poised to regain its position as the global demand centre.,2020-05-24T03:49:54Z
Edited Transcript of BYW6.DE earnings conference call or presentation 7-May-20 6:30am GMT,Q1 2020 BayWa AG Earnings Call,2020-05-24T02:44:53Z
"Blog: Cleaner & cheaper, solar power beats coal","The Covid crisis has diverted attention from a major breakthrough that should leave all smiling. The latest auction for 400 MW of solar power, including storage, has been won by ReNew Power with a levelised...",2020-05-24T02:17:36Z
Injustice now out in open as fractures in society laid bare,"Two summers ago, Ireland was experiencing its lowest rainfall for 160 years. The drought unexpectedly revealed the hitherto hidden outline of a 5,000-year-old prehistoric earthwork not far from Newgrange.",2020-05-24T01:30:00Z
Gov’t eases quarantine restrictions to help more businesses resume operations,"MANILA, Philippines — The Inter-Agency Task Force on Emerging Infectious Diseases (IATF) on Saturday eased some quarantine restrictions to allow more businesses to resume full operations, according to presidential spokesperson Harry Roque. Roque said in a sta…",2020-05-23T23:24:59Z
Commentary: The wonder of clear skies and returning wildlife is our new climate problem,"The COVID-19 pandemic hasn’t really halted climate change but gives the world a timely opportunity to do so, says Winston Chow.",2020-05-23T22:10:56Z
More Signs Of Green Recovery From COVID-19 Sprouting In Agriculture (#CleanTechnica Interview),"So far the green recovery movement has focused on clean power, but agriculture is also gearing up for a COVID-19 makeover.",2020-05-23T19:05:02Z
Midstream Companies Slash Capex By 50% After Oil Crash,"With the collapse in oil demand, oil producers and refiners have come under intense financial pressure. Not far behind are the integrated supermajors like ExxonMobil and Chevron. These companies have upstream (oil- and gas-producing) assets as well as refinin…",2020-05-23T19:00:00Z
3 Top Stocks that Are Cash Cows,Looking for big dividends that look like they'll survive the COVID-19 crisis in stride? This trio of stocks should be on your short list.,2020-05-23T18:20:00Z
Crosby’s Angie’s Hair Studio among businesses reopening after being closed over a month - Chron,Barbershops and salons were allowed to open on May 8 as part of Governor Abbott's phased reopening of the Texas economy,2020-05-23T17:50:48Z
"Virus has pushed auto market back by 4-5 years, says Bosch","Slowdown, pandemic cause decline in revenue and profit",2020-05-23T16:58:47Z
Get Paid While You Wait: 3 Top Dividend Stocks in Energy,"The energy sector is dealing with an unprecedented shock, but that is opening up interesting opportunities for long-term investors.",2020-05-23T16:32:00Z
Connectivity provides a stronger foundation for exports: Harsh Shringla,"He said, the pandemic has highlighted the global shortage of trained personnel in various sectors, especially in health care and the digital domain",2020-05-23T16:26:00Z
Iraq's new finance minister seeks Gulf funds to stave off fiscal collapse,Iraq's new finance minister was in Saudi Arabia on Saturday seeking emergency funds to stave off an impending financial crisis brought on by collapsing oil,2020-05-23T16:07:54Z
"Plastics bans, environmental monitoring get short shrift during pandemic","As the use of plastic containers has gone up, some cities have cut back, or even cancelled outright, municipal recycling programs.",2020-05-23T15:19:59Z
5 Top Dividend Stocks With Yields Over 5%,These dividend stocks could energize your portfolio.,2020-05-23T15:11:00Z
American liquor distilleries shifted gears to help in the fight against coronavirus. Now Congress should help them.,"Associated Press/Carlos Osorio
<ul>
<li>US distilleries have shifted gears to help combat the coronavirus pandemic.</li>
<li>But now those businesses are struggling and need help to make it through.</li>
<li>Congress should include targeted measures to help e…",2020-05-23T14:18:00Z
Signs Of V-Shaped Housing Recovery,"U.S. equity markets surged this week, buoyed by positive vaccine data and on renewed hopes of a V-shaped economic recovery as countries around the world begin the reopening process.The S&P 500 ended the week higher by 3.1%, closing nearly 35% above its lows i…",2020-05-23T14:00:00Z
Signs Of V-Shaped Housing Recovery,"U.S. equity markets surged this week, buoyed by positive vaccine data and on renewed hopes of a V-shaped economic recovery as countries around the world begin the reopening process.The S&P 500 ended the week higher by 3.1%, closing nearly 35% above its lows i…",2020-05-23T14:00:00Z
5 Best CEFs To Buy This Month (May 2020),"During the last few months, most closed-end funds have been hit hard. Moreover, their recovery has been much slower than that of the rest of the market.However, it does not make them bad investments. For income investors, CEFs remain an attractive investment …",2020-05-23T13:29:00Z
Is Chevron a Buy?,The top oil company has outperformed its peers. Can it keep it up?,2020-05-23T12:09:00Z
"Liberia: EU Signs Over U.S.$59 Million Support to Country's Social, Economic Development","[Observer] In a unique e-ceremony for the signing of two Financing Agreements worth USD 59 million, EU Ambassador HE Hélène Cavé reiterated EU's commitment to support Liberia's development agenda and recovery from the Coronavirus pandemic.",2020-05-23T11:56:36Z
3 High-Yield Dividend Stocks I'd Buy Right Now,"If income is the name of the game, these three companies look like compelling purchases.",2020-05-23T11:45:00Z
The Path To Monetary Collapse,"The Path To Monetary Collapse

 Tyler Durden
 
Sat, 05/23/2020 - 07:00

 Authored by Alasdair Macleod via GoldMoney.com,


Few mainstream commentators understand the seriousness of the economic and monetary situation, ranging from a V-shaped rapid return to …",2020-05-23T11:00:00Z
Could Nordic American Tankers Be a Millionaire-Maker Stock?,"The oil tanker giant is well-positioned thanks to the current glut of crude, but what are its long-term prospects?",2020-05-23T10:05:00Z
KWARA: As May 29 beckons!,Governor AbdulRahman AbdulRazaq was not strange to Kwara politics when he won the last general election in 2019. He had been on the political radar of the state for two decades contesting variously as governorship and senatorial candidates until fortune smile…,2020-05-23T08:41:08Z
Edited Transcript of STWD earnings conference call or presentation 4-May-20 12:30pm GMT,Q1 2020 Starwood Property Trust Inc Earnings Call,2020-05-23T07:43:56Z
Buy JSW Energy; target of Rs 58: Emkay Global Financial,"Emkay Global Financial is bullish on JSW Energy has recommended buy rating on the stock with a target price of Rs 58 in its research report dated May 20, 2020.",2020-05-23T06:31:29Z
Auto industry will take a long time to recover: Bosch MD,Soumitra Bhattacharya said the industry had regressed by three to four years due to the slowdown in the economy and COVID-19 had further pushed it back by 1.5 to 2 years.,2020-05-23T05:39:56Z
US sleep-walking on the road to socialism?,"As the pandemic is likely to accelerate the relative decline of the US
The post US sleep-walking on the road to socialism? appeared first on The Express Tribune.",2020-05-23T05:24:33Z
Is the IoT the saviour of the environment? - IT PRO,We are on the cusp of a connection revolution as IoT rapidly develops. Could this technology solve the climate change crisis?,2020-05-23T04:14:09Z
"Bursa Malaysia to hover between 1,420 and 1,450 next week","KUALA LUMPUR: Bursa Malaysia is likely to hover at the 1,420 to 1,450 level next week, supported by expected rotational play among the rubber glove and logistics counters.",2020-05-23T03:48:00Z
"China firm on achieving development goals of 2020, though setting no specific growth target","China will work to ensure achieving the development goals of winning the battle against poverty and completing the building of a moderately prosperous society in all respects this year, though setting no specific economic growth target for 2020, according to …",2020-05-23T02:06:41Z
Prayut: 'Building back better',"Never in our recent history have we faced a major challenge such as coronavirus 2019 (Covid-19). This pandemic is going to bring about drastic changes to our economies and societies, and will force us to adapt and change our way of life. We can no longer retu…",2020-05-23T01:58:00Z
Providence hit by delay to £200k of funding,Providence Resources says funding it was due to receive from Norwegian group Spot-On Energy has been delayed.,2020-05-23T01:30:00Z
WB okays $500m loan to help govt fight Covid-19 effect,"ISLAMABAD: In a fast-moving process, the executive board of the World Bank has approved a $500 million loan to help Pakistan improve health and education facilities, generate jobs for women and strengthen social safety nets under its efforts to fight the impa…",2020-05-23T00:46:37Z
WisdomTree U.S. MidCap Dividend ETF Has A High Exposure To Cyclical Sectors,"DON invests in mid-cap dividend stocks in the United States.The fund has a high exposure to cyclical sectors, and this may cause it to continue to underperform in the current recessionary environment.DON has an inferior growth profile than its large-cap peer …",2020-05-23T00:41:14Z
Texas hits worst unemployment rate on record — 1 in 8 Texans are out of work,"The state’s April jobless rate was 12.8% — Texas’ worst monthly tally on record. That number, included in the Labor Department’s monthly report released Friday, is the government’s clearest and most comprehensive look at the economic devastation in Texas sinc…",2020-05-23T00:18:49Z
"The Asia Pacific radiofrequency ablation devices market is anticipated to reach US$ 1,705.06 Mn by 2027 from US$ 699.62 Mn in 2019. The market is projected to grow at a CAGR of 12.1% from 2020 to 2027","NEW YORK, May 22, 2020 /PRNewswire/ -- Asia Pacific Radiofrequency Ablation Devices Market Forecast to 2027 - Covid-19 Impact and Regional Analysis by Product and Application Read the full report: https://www.reportlinker.com/p05894520/?utm_source=PRN The Asi…",2020-05-23T00:15:00Z
"The Asia Pacific radiofrequency ablation devices market is anticipated to reach US$ 1,705.06 Mn by 2027 from US$ 699.62 Mn in 2019. The market is projected to grow at a CAGR of 12.1% from 2020 to 2027",Asia Pacific Radiofrequency Ablation Devices Market Forecast to 2027 - Covid-19 Impact and Regional Analysis by Product and Application,2020-05-23T00:15:00Z
Essential workers in Yukon get a wage increase over 16 weeks,The territorial government says eligible workers for the program can’t make more than $20 per hour and will receive the benefit for up to 16 weeks.,2020-05-22T23:09:15Z
While we've been occupied with COVID-19,"More progress than you might have expected happened amid the swirl. Other things, too.",2020-05-22T22:47:58Z
Healthcare And Amazon Paint Early Earnings Picture,The Broad Market Index was down 2.26% last week and only 25% of stocks out-performed the index. The big surprise in the first quarter financial statements (now 85% complete) was an increase in the proportion of market capital accounted for by rising sales gro…,2020-05-22T22:26:45Z
Rexnord Has Attractive Long-Term Drivers And Credibility On Margin Improvement,"Rexnord's businesses are going to see a significant hit from the COVID-19 shutdowns/recession, but long-term opportunities in areas like automation are attractive.The water business will help mitigate some of the near-term industrial declines, and Rexnord isn…",2020-05-22T21:47:46Z
$180 Billion Asset Manager Explains What May Spark The Collapse Of The Dollar,"$180 Billion Asset Manager Explains What May Spark The Collapse Of The Dollar

 Tyler Durden
 
Fri, 05/22/2020 - 17:46

 Authored by Tad Rivelle, Chief Investment Officer, Fixed Income, oversees over $180 billion in fixed income assets, including $95 billion …",2020-05-22T21:46:36Z
Bosch Limited (BSWQY) on Q4 2020 Results - Earnings Call Transcript,,2020-05-22T21:43:04Z
Bosch Limited (BSWQY) on Q4 2020 Results - Earnings Call Transcript,,2020-05-22T21:43:04Z
Mastering the nuts and bolts of investment,"From the basics of engineering studies at King Mongkut's Institute of Technology Ladkrabang to extending his education with an MBA at Chulalongkorn University's Sasin Graduate Institute, Vasin Vanichvoranun has successfully chased his dream of becoming a fund…",2020-05-22T21:00:00Z
Ares Capital's 12% Yield: It Sticks Out Like A Sore Thumb,"Ares Capital is a big-dividend business development company that has sold off hard during the pandemic because of its exposure to small (middle market) businesses.In this report we review the business (including important sector exposures), the balance sheet …",2020-05-22T20:49:10Z
Turn coronavirus musician relief into artistic investment,We need music more than ever. Cities can help to make sure that music scenes — and musicians — survive the fallout of the pandemic.,2020-05-22T20:37:13Z
Wall Street ends mixed as China-U.S. tensions weigh,"By Noel Randewich (Reuters) - Wall Street ended mixed on Friday in a mostly tame finish to a week of strong gains, as investors gauged China-U.S. tensions and amid ongoing uncertainty about the pace of economic recovery from the coronavirus. President Donald …",2020-05-22T20:36:20Z
EMERGING MARKETS-Most Latam FX fall as U.S.-China trade worries rise,"haven demand rises
    * Argentina extends debt talks deadline as default looms

 (Adds comments, updates prices)
    By Shreyashi Sanyal
    May 22 (Reuters) - Most Latin American currencies weakened
on Friday as demand for the safe-haven dollar rose after C…",2020-05-22T20:19:03Z
World Nanotechnology Markets to 2025: Robust R&D Scenario Characterizes Nanotechnology Industry,"The ""Nanotechnology - Global Market Trajectory & Analytics"" report has been added to ResearchAndMarkets.com's offering.",2020-05-22T20:15:00Z
World Nanotechnology Markets to 2025: Robust R&D Scenario Characterizes Nanotechnology Industry,"DUBLIN, May 22, 2020 /PRNewswire/ -- The ""Nanotechnology - Global Market Trajectory & Analytics"" report has been added to ResearchAndMarkets.com's offering. The Nanotechnology market worldwide is projected to grow by US$69.5 Billion, driven by a compounded gr…",2020-05-22T20:15:00Z
Forget FAANG: 5 Top Big Dividends Worth Considering,"Some investors cannot handle the volatility and lack of income from FAANG stocks, and the Fed's near-zero interest rate policy creates challenges for income-focused retirees too.Popular growth stocks are near all-time highs, while value and dividend stocks ar…",2020-05-22T20:05:39Z
US STOCKS-Wall Street ends mixed as China-U.S. tensions weigh,"Wall Street ended mixed on Friday in a mostly tame finish to a week of strong gains, as investors gauged China-U.S. tensions and amid ongoing uncertainty about the pace of economic recovery from the coronavirus.",2020-05-22T20:01:30Z
14 Bankruptcy Filings Chalked Up to COVID-19,"The COVID-19 coronavirus outbreak has sent global markets into bear territory and economies into recession. And as the pandemic stretches on, it's inducing a growing number of bankruptcy filings.Though, in most cases, COVID-19 has simply acted as the straw th…",2020-05-22T19:58:36Z
14 Bankruptcy Filings Chalked Up to COVID-19,"The COVID-19 coronavirus outbreak has sent global markets into bear territory and economies into recession. And as the pandemic stretches on, it's inducing a growing number of bankruptcy filings.

Though, in most cases, COVID-19 has simply acted as the straw …",2020-05-22T19:58:36Z
"Foot Locker, Inc. (FL) CEO Dick Johnson on Q1 2020 Results - Earnings Call Transcript",,2020-05-22T19:44:04Z
"Foot Locker, Inc. (FL) CEO Dick Johnson on Q1 2020 Results - Earnings Call Transcript",,2020-05-22T19:44:04Z
Wall Street mixed as China-U.S. tensions weigh,"By Noel Randewich (Reuters) - Wall Street was mixed on Friday in a mostly tame finish to a week of strong gains, as investors gauged China-U.S. tensions and amid ongoing uncertainty about the pace of economic recovery from the coronavirus. President Donald Tr…",2020-05-22T19:35:40Z
David Shoultz seeks tech and science solutions as Washington Research Foundation grants director,"As the new director of the grants program at the Washington Research Foundation, David Shoultz joins at a unique time for an organization dedicated to accelerating innovation in science and technology in the state. As research institutions and companies throu…",2020-05-22T19:30:43Z
