Understanding the Impact of COVID-19 on the GCC Region: Risk Mitigation Strategies for the GCC Region,"The ""Understanding the Impact of COVID-19 on the GCC Region"" report has been added to ResearchAndMarkets.com's offering.",2020-06-09T20:15:00Z
Understanding the Impact of COVID-19 on the GCC Region: Risk Mitigation Strategies for the GCC Region,"DUBLIN, June 9, 2020 /PRNewswire/ -- The ""Understanding the Impact of COVID-19 on the GCC Region"" report has been added to ResearchAndMarkets.com's offering. Like other economies, countries in the GCC have been rendered vulnerable by the COVID-19 pandemic. Wh…",2020-06-09T20:15:00Z
Tetra Tech Provides Third Quarter and Fiscal Year 2020 Guidance,"PASADENA, Calif.--(BUSINESS WIRE)--Tetra Tech, Inc. (NASDAQ: TTEK), a leading provider of high-end consulting and engineering services, today announced guidance for the third quarter and fiscal year 2020, which reflects improved visibility as stay-at-home res…",2020-06-09T20:10:43Z
Tetra Tech Provides Third Quarter and Fiscal Year 2020 Guidance - Financial Post,"PASADENA, Calif. — Tetra Tech, Inc. (NASDAQ: TTEK), a leading provider of high-end consulting and engineering services, today announced guidance for the third quarter and fiscal year 2020, wh…",2020-06-09T20:06:00Z
Tetra Tech Provides Third Quarter and Fiscal Year 2020 Guidance - Galveston County Daily News,Tetra Tech Provides Third Quarter and Fiscal Year 2020 Guidance  Galveston County Daily News,2020-06-09T20:05:44Z
Shale companies look to bolster insurance for directors and officers,"The U.S. oil and gas industry is paying a
hefty price to protect its top brass against potential
bankruptcy and investor lawsuits.",2020-06-09T19:31:16Z
Shale companies look to bolster insurance for directors and officers,"The U.S. oil and gas industry is paying a hefty price to protect its top brass against potential bankruptcy and investor lawsuits.  Oil companies are shelling out as much as 75% more to renew insurance liability coverage for directors and officers, as the sec…",2020-06-09T19:31:16Z
RA: Important Post-Merger Update On Portfolio Changes,"RA and INF finished their merger in February. This merger saw INF's energy assets transferred to holders of RA, however, they quickly sold these positions off.",2020-06-09T19:30:26Z
Business bankruptcies surge in the coronavirus recession,"Economic crash is forcing a growing number of companies to file for Chapter 11, including major consumer brands.",2020-06-09T19:30:23Z
Chesapeake Energy shares halted after 50% plunge on bankruptcy report,Shares in one of the biggest natural gas companies in the U.S. were halted on Tuesday after plunging by half on a report the company could be about to go bankrupt.,2020-06-09T19:18:20Z
KKR & Co. Inc. (KKR) Management Presents at Morgan Stanley Financials Conference 2020 (Transcript),"KKR & Co. Inc. (NYSE:KKR) Morgan Stanley Financials Conference 2020 June 9, 2020 09:30 AM ET Company Participants Joseph Y. Bae - Co-President and Co-Chief",2020-06-09T18:40:08Z
Ferroglobe PLC (GSM) Q1 2020 Earnings Call Transcript,"GSM earnings call for the period ending March 31, 2020.",2020-06-09T18:30:50Z
Oil and gas producers forecast big cuts to investing in sector,"Producers trim $13 billion from previous forecast, citing uncertainty about COVID-19.",2020-06-09T18:17:22Z
Gov. Northam expected to discuss the future for schools in COVID-19 briefing,Governor Ralph Northam is set to address the commonwealth on Tuesday for his latest briefing amid both the COVID-19 pandemic and continuing civil unrest over the murder of George Floyd.,2020-06-09T18:15:58Z
Parents say pupils should be allowed back to school NOW amid fears for their children's wellbeing,The Government's 'ambition' was to see all primary children return for at least a month before the end of the academic year but unions and councils said buildings would have to double in size.,2020-06-09T18:06:51Z
‘Artificial’ petrol shortage irks federal cabinet,"PM Imran orders normal supply of fuel within 48-72 hours
The post ‘Artificial’ petrol shortage irks federal cabinet appeared first on The Express Tribune.",2020-06-09T17:29:57Z
'It needs guts': commercial galleries are reopening – why aren't the rest?,"Hurrah! The real thing returns on Monday. But why is it only commercial galleries reopening? Because for them, art is big businessThe art world is coming back to life. Almost unbelievably, when so much of the UK remains closed, London’s leading commercial gal…",2020-06-09T17:17:50Z
Offshore wind farm proponents warned surf breaks will be protected,By Robin Martin of RNZ Proponents of an idea to build massive offshore wind farms off the coast of Taranaki are being warned its internationally renowned surf breaks will soon be protected and cannot be disturbed.But a Venture...,2020-06-09T17:00:00Z
Canada's Commercial Real Estate Market: Opportunities And Challenges,Has the COVID-19 crisis spelled the death of retail? Outlook for industrial real estate post-COVID-19. Outlook for office real estate post-COVID-19.,2020-06-09T16:44:54Z
"Demand for High Speed Connectivity for Industries in Asia Pacific Makes it Lucrative Region, Global Valuation of Fiber Optic Cables Market to Reach ~US$ 15 Bn by 2030 - TMR","Rapidly growing demand for high-speed connectivity in various sectors, notably in IT and telecommunication, healthcare, and energy, especially in developing regions is key to use of fiber optic cables. They are gathering traction among network providers to en…",2020-06-09T16:30:00Z
"Demand for High Speed Connectivity for Industries in Asia Pacific Makes it Lucrative Region, Global Valuation of Fiber Optic Cables Market to Reach ~US$ 15 Bn by 2030 - TMR","ALBANY, New York, June 9, 2020 /PRNewswire/ -- Rapidly growing demand for high-speed connectivity in various sectors, notably in IT and telecommunication, healthcare, and energy, especially in developing regions is key to use of fiber optic cables. They are g…",2020-06-09T16:30:00Z
Business bankruptcies surge in the coronavirus recession,"Economic crash is forcing a growing number of companies to file for Chapter 11, including major consumer brands.",2020-06-09T16:20:39Z
Ferroglobe Plc (GSM) CEO Marco Levi on Q1 2020 Results - Earnings Call Transcript,"Ferroglobe Plc (NASDAQ:GSM) Q1 2020 Earnings Conference Call June 09, 2020 9:00 AM ET Company Participants Beatriz García-Cos - Chief Financial Officer Marco Le",2020-06-09T16:04:11Z
AVEVA Group plc (AVEVF) CEO Craig Hayman on Q4 2020 Results - Earnings Call Transcript,"AVEVA Group plc (OTCPK:AVEVF) Q4 2020 Earnings Conference Call June 09, 2020 04:30 AM ET Company Participants Craig Hayman - Chief Executive Officer James Kidd",2020-06-09T16:04:07Z
5%+ Dividend Yield Portfolio: Selling Into The Enthusiasm (May 2020 Review),"My +3% April performance lagged the +5% of the S&P 500 as a risk-on fervor dispensed with seemingly ANY bad news. However, my YTD dividends are still up 2% desp",2020-06-09T16:01:01Z
Some start-ups emerge lockdown winners,"Apart from being well-funded, their success comes from being in the right segment and seizing the opportunity",2020-06-09T15:55:06Z
"Long-Term Evolution (LTE) Internet Of Things (IoT) Market 2019 Break Down by Top Companies, Countries, Applications, Challenges, Opportunities and Forecast 2026 - Cole of Duty","Long-Term Evolution (LTE) Internet Of Things (IoT) Market 2019 Break Down by Top Companies, Countries, Applications, Challenges, Opportunities and Forecast 2026  Cole of Duty",2020-06-09T15:54:47Z
Steel firm Celsa closes in on £30m loan,"A Cardiff-based steelmaker is nearing a deal with the government for a loan of £30m to bolster its finances amid
The post Steel firm Celsa closes in on £30m loan appeared first on CityAM.",2020-06-09T15:46:17Z
Steel firm Celsa closes in on £30m loan - report,"A Cardiff-based steelmaker is nearing a deal with the government for a loan of £30m to bolster its finances amid
The post Steel firm Celsa closes in on £30m loan - report appeared first on CityAM.",2020-06-09T15:46:17Z
"Consumer Internet Of Things (CIoT) Market 2019 Break Down by Top Companies, Countries, Applications, Challenges, Opportunities and Forecast 2026 - Cole of Duty","Consumer Internet Of Things (CIoT) Market 2019 Break Down by Top Companies, Countries, Applications, Challenges, Opportunities and Forecast 2026  Cole of Duty",2020-06-09T15:13:39Z
"IoT (Internet Of Things) For Public Safety Market 2019 Break Down by Top Companies, Countries, Applications, Challenges, Opportunities and Forecast 2026 - Cole of Duty","IoT (Internet Of Things) For Public Safety Market 2019 Break Down by Top Companies, Countries, Applications, Challenges, Opportunities and Forecast 2026  Cole of Duty",2020-06-09T15:12:40Z
"Dark Basin: Delhi-based “Hack-for-Hire” firm exposed for hacking politicians, non-profits globally","A Delhi-based IT firm has been exposed for offering its hacking services to help clients spy on more than 10,000 email accounts over a period of seven years.",2020-06-09T15:11:46Z
"France launches $17 billion support plan for aerospace sector, accelerates research on green jetliner","The plans - which include 7 billion euros of aid already awarded to Air 
France (AIRF.PA) and bring forward some defence spending - involve a 
joint effort by government and industry to keep French jobs and prepare 
the next generation of civil jets",2020-06-09T15:09:22Z
Coupa Software Incorporated (COUP) Q1 2021 Earnings Call Transcript,"COUP earnings call for the period ending April 30, 2020.",2020-06-09T14:58:59Z
3 “Strong Buy” Dividend Stocks Yielding at Least 8%,"The rally we've experienced in the stock markets has become something of a sensation. The rebound has been substantial, with the S&P 500 rising almost 34% from its March 23 trough.Even in the current buying mood, however, there are plenty of investors who wan…",2020-06-09T14:58:03Z
CalSTRS investor: Access to capital will tighten for oil and gas companies sidestepping climate,"By Ben RatnerWe’re back with the last in a two-part series on prospects for ESG and climate investing between EDF’s Ben Ratner and Brian Rice, a portfolio manager at California State Teachers’ Retirement Systems, the world’s largest educator-only pension fund…",2020-06-09T14:52:08Z
"Canadian Energy Weekly Round-Up: June 8, 2020",Here are the top news stories covering Canada’s energy landscape: Big Tech Partners with Canadian Oil Sands Industry Amazon and TC Energy announced a new partnership that could help bring the one step closer to being completed. TC Energy announced it would be…,2020-06-09T14:52:08Z
Purpose And Profit: 4 Keys To Creating A Profitable Mission-Driven Business,"Right now, it feels like we’re at a significant inflection point. I’m hearing from people who want to serve a higher purpose through entrepreneurship. If you feel like you’re being called to create or run a mission-driven business here are four fundamental el…",2020-06-09T14:48:02Z
African Destinations Meet to Plan Growth and Sustainable Future for Tourism,"Recovery and resilience were the central themes as the members of the World Tourism Organization's Regional Commission for Africa (CAF) met for the 63rd time today. Reflecting the extraordinary circumstances, the meeting was held virtually, bringing together …",2020-06-09T14:46:26Z
Oil prices are recovering faster than anyone expected. 4 Wall Street banks explain what that means for the energy economy — and share the stocks poised to benefit from the recovery.,"<ul>
<li>After crashing in March, the price of crude oil is recovering faster than banks initially predicted. </li>
<li>Some producers that were forced to pare back oil production are already reversing cuts as a result. </li>
<li>Still, don't expect oil deman…",2020-06-09T14:45:00Z
Why reliable electricity access is critical to stamping out the coronavirus,Reproduced from The Energy Progress Report 2020 using The World Bank data; Map: Axios VisualsThe twin global goals of effectively responding to COVID-19 and bringing power to hundreds of millions of people lacking electricity and cooling infrastructure are co…,2020-06-09T14:40:13Z
"KBRA Assigns Preliminary Ratings to Sunnova Helios IV Issuer, LLC, Solar Loan Backed Notes, Series 2020-A","NEW YORK--(BUSINESS WIRE)--Kroll Bond Rating Agency (KBRA) assigns preliminary ratings to two classes of notes issued by Sunnova Helios IV Issuer, LLC, Solar Loan Backed Notes, Series 2020-A (“Sunnova 2020-A”), an asset-backed securitization collateralized by…",2020-06-09T14:39:33Z
"Internet Of Things Software Market 2019 Break Down by Top Companies, Countries, Applications, Challenges, Opportunities and Forecast 2026 - Cole of Duty","Internet Of Things Software Market 2019 Break Down by Top Companies, Countries, Applications, Challenges, Opportunities and Forecast 2026  Cole of Duty",2020-06-09T14:39:05Z
"Internet Of Things (IoT) Device And Service Market 2019 Break Down by Top Companies, Countries, Applications, Challenges, Opportunities and Forecast 2026 - Cole of Duty","Internet Of Things (IoT) Device And Service Market 2019 Break Down by Top Companies, Countries, Applications, Challenges, Opportunities and Forecast 2026  Cole of Duty",2020-06-09T14:39:05Z
Boris Johnson says the UK isn't a racist country. Black Britons disagree,"There are 4,000 miles between the UK and Minneapolis, where George Floyd was killed by police on 25 May, but Micha Frazer-Carroll says there is little distance in black people's experience of racism",2020-06-09T14:25:55Z
Global EV Market: Already On the Road to Recovery?,"The combination of a pandemic, supply chain disruptions, economy-wide lockdowns and a worldwide recession is bad news for virtually every industry, and the electric vehicle sector is no exception. Add a historic decline in oil prices making fossil fuels cheap…",2020-06-09T14:18:00Z
Following the first farm rescue payments,Beef packers ask to scrap antitrust case — Ethanol advocates appeal to Trump on blending waivers,2020-06-09T14:00:22Z
JinkoSolar 5-year planning remains ‘gold-standard’ for PV module supplier operations,"The PV industry continues to have frequent casualties in terms of PV module suppliers being able to carve out a long-term sustainable business model. This issue remains critical when suppliers are short-listed for large-scale solar sites, globally.",2020-06-09T13:52:00Z
5G Infrastructure Market Size to Reach USD 58.17 Billion by 2025 - Valuates Reports,"BANGALORE, India, June 9, 2020 /PRNewswire/ -- 5G infrastructure is made up of macro and small-cell base stations with edge computing capabilities. In a 5G network, network functions that typically run on hardware become virtualized, running as software. The …",2020-06-09T13:44:00Z
5G Infrastructure Market Size to Reach USD 58.17 Billion by 2025 - Valuates Reports,"5G infrastructure is made up of macro and small-cell base stations with edge computing capabilities. In a 5G network, network functions that typically run on hardware become virtualized, running as software.",2020-06-09T13:44:00Z
PRESS INFORMATION BUREAU (PIB) IAS UPSC – 1st June to 7th June – 2020,"Press Information Bureau (PIB) IAS UPSC – 1st June to 7th June – 2020 ARCHIVES GS-2 One Nation One Card scheme (Topic: Government policies and interventions for development in various sectors) Three more states namely – Odisha, Sikkim and Mizoram … 
The post …",2020-06-09T13:30:25Z
Racist Violence Can’t Be Separated From the Violence of Neoliberal Capitalism,Neoliberal society is built on the myth that economic prosperity is hermetically sealed from racial and social justice.,2020-06-09T13:27:05Z
SPOTLIGHT on KAREN BASS — LA PROSECUTORS won’t charge in curfew violations — SCHOOLS REOPENING plan released — UC BERKELEY study: shutdowns prevented 500M infections — FBI charges 3 more in SF City Hall corruption probe,,2020-06-09T13:26:19Z
"Too Far, Too Fast? Stunning Rally Pauses For Breath As Fed Meeting Gets Underway","After the stunning rally we’ve had, it’s not too surprising to see some profit-taking and a little caution creep in today as the Fed gathers. Caution appears to be back, with volatility and gold both on the rise.",2020-06-09T13:23:56Z
"Internet of Things (IoT) Software Market 2019 Break Down by Top Companies, Countries, Applications, Challenges, Opportunities and Forecast 2026 - Cole of Duty","Internet of Things (IoT) Software Market 2019 Break Down by Top Companies, Countries, Applications, Challenges, Opportunities and Forecast 2026  Cole of Duty",2020-06-09T13:23:01Z
Oil & Gas Job Losses: The Right Thing To Do…But Think About The Workers,"A social safety net in the form of unemployment benefits, job training, etc. can help cushion the blow for workers when economic events beyond their control (like the COVID-19 pandemic) cause companies to shed workers.",2020-06-09T13:21:51Z
"Impact of Covid-19 Global Internet of Things Security Market (2020 To 2027) | Check Point Security Software Technologies, Cisco Systems, Digicert, GE, Gemalto - Surfacing Magazine",Global Internet of Things Security market report gives a top to bottom investigation of the general market over a period from 2020-2027. The Internet of Things Security Market report additionally give,2020-06-09T13:13:17Z
Edited Transcript of PNC earnings conference call or presentation 15-Apr-20 1:30pm GMT,Q1 2020 PNC Financial Services Group Inc Earnings Call,2020-06-09T13:03:37Z
Q1 2020 Investor Letter,The SARS CoV 2 virus is no black swan event in the eye of observer in western world. Governmental actions were fast but critical. Forecasting central bank actio,2020-06-09T13:01:44Z
Electric Vehicle Charging Infrastructure Market to Reach USD 147.94 Billion by 2030 | Reports and Data,"NEW YORK, June 9, 2020 /PRNewswire/ -- The global electric vehicle charging infrastructure market is forecast to reach USD 147.94 Billion by 2030, according to a new report by Reports and Data. Governments across the globe are investing heavily in the chargin…",2020-06-09T13:00:00Z
"Internet of Things (IoT) Develop Services Market 2019 Break Down by Top Companies, Countries, Applications, Challenges, Opportunities and Forecast 2026 - Cole of Duty","Internet of Things (IoT) Develop Services Market 2019 Break Down by Top Companies, Countries, Applications, Challenges, Opportunities and Forecast 2026  Cole of Duty",2020-06-09T12:58:57Z
Ewubare - NNPC Diversifying to Mitigate Oil Sector Challenges,"[This Day] The Chief Operating Officer, Ventures and Business Development, NNPC, Mr. Roland Ewubare, in this interview on Arise TV,",2020-06-09T12:57:51Z
Surprising Jobs Numbers and an Interview With Shopify CEO Tobi Lutke,"The latest headlines from Wall Street, some stocks on our radar, and much more.",2020-06-09T12:52:00Z
Nigeria: Burden of Delayed PIB Passage,"[This Day] As Nigeria prepares for life after the COVID-19 pandemic, there is urgent need for the National Assembly expedite action in the passage of the prolonged Petroleum Industry Bill.",2020-06-09T12:48:45Z
Investing In These 8 Bioeconomy Sectors Could Create Up To 1.6M Jobs Lost To COVID,Governments can create incentives to transition skilled workers from sectors hard-hit by coronavirus into more resilient industries that are better for the environment.,2020-06-09T12:30:00Z
Online illusion,"E-learning, the buzzword in education, has been greatly amplified during COVID-19. But the hype papers over India’s digital divide even as the efficacy of the fundamental premises of online learning, as opposed to conventional classroom methods, are being que…",2020-06-09T12:26:09Z
COVID-19 lockdown allows Britain to go coal-free for record two months,Demand for electricity in the UK fell after the introduction of a lockdown on March 23  due to a decrease in energy use from commercial and industrial consumers.,2020-06-09T12:24:10Z
Top Dems put the kibosh on ‘defund the police’,,2020-06-09T12:17:42Z
SAP AppHaus Wins Four 2020 German Innovation Awards,"Despite the obstacles of the COVID-19 pandemic and out of more than 700 submissions, SAP has been awarded four German Innovation Awards. Under SAP Executive Board Member and Chief...",2020-06-09T12:15:47Z
Capital recycling for energy transition post-COVID-19,An inability to recycle capital is one of the most important issues to hobble the renewable energy infrastructure in India. A few fixes could enhance the attractiveness of the sector for investors.,2020-06-09T12:13:32Z
Deutsche Bank consortium puts Jindal Thermal deal on hold,"Jindal Thermal owes nearly  ₹7,600 crore to a clutch of 17 lenders, led by Punjab National Bank. Lenders hold 51% in the unlisted JITPL after shares pledged by the promoter company were invoked because of difficulties in repaying bank loans",2020-06-09T12:08:55Z
MARKEY-KENNEDY race gets REAL — New rule for CAMBRIDGE cops — VIRUS puts undocumented workers at risk,,2020-06-09T12:01:45Z
"Conversational Artificial Intelligence Market Research Report by Operations, by Product, by Technology, by Type, by Industry, by Deployment - Global Forecast to 2025 - Cumulative Impact of COVID-19","NEW YORK, June 9, 2020 /PRNewswire/ -- Read the full report: https://www.reportlinker.com/p05913968/?utm_source=PRN The Global Conversational Artificial Intelligence Market is expected to grow from USD 4,290.05 Million in 2019 to USD 17,142.57 Million by the …",2020-06-09T12:00:00Z
"Futures Tumble As Historic Rally Fizzles; Treasurys, Dollar Jump","Futures Tumble As Historic Rally Fizzles; Treasurys, Dollar Jump

 Tyler Durden
 
Tue, 06/09/2020 - 07:59

 After hanging around at 3-month highs well into the overnight session, U.S. equity futures took a sharp leg lower around the time Europe opened, slidin…",2020-06-09T11:59:20Z
Voltalia-Auchan deal brings 61MW solar PPA to France’s budding scene,"Agreement for new solar plants to power all French sites of retail multinational comes as European country eyes post-COVID renewable future, with 152MW in new rooftop tender awards.",2020-06-09T11:50:00Z
Why Climate Investors May Be Missing Out On A Huge Investment Opportunity To Reduce Carbon,"Plastic waste and climate change go together. In fact, the mismanagement of plastic waste is a serious contributor to climate change and a significant -- but often overlooked -- investment opportunity for climate investors.",2020-06-09T11:43:41Z
Coronavirus pandemic | France announces $16.9 billion in aid to aviation industry,"In exchange for aid, companies will be required to invest more and faster in electric, hydrogen or other lower-emission aircraft, as France aims to make its aviation industry the âcleanest in the world.â",2020-06-09T11:30:06Z
Legislature moves to repeal police secrecy law — Businesses and commuters adapt on first day of reopening — De Blasio protested by staffers,,2020-06-09T11:22:59Z
Parkway police shooting video released,,2020-06-09T11:20:29Z
Ensuring Cybersecurity for Critical Civilian Infrastructure,"Although the world has long needed a more systematic approach to cybersecurity, the issue has come to the fore as a result of the COVID-19 pandemic. The fact that cyberattacks are increasingly targeting health facilities underscores the need for a rapid, conc…",2020-06-09T11:20:01Z
Déjà Vu: Extremely Valued Tech Companies Propping Up Stock Markets,"Tech stocks make up just 8.8% of the Canadian stock market today. On a valuation basis, Canada's S&P/TSX Info Tech Index is now trading at an average price to e",2020-06-09T11:11:37Z
Cleveland-Cliffs Inc. Announces Earlier Than Planned Restart of HBI Construction and Tilden Mining Operations,"CLEVELAND--(BUSINESS WIRE)--Cleveland-Cliffs Inc. (NYSE: CLF) (“Cliffs”) today announced that it will be resuming construction of its Hot-Briquetted Iron (HBI) plant in Toledo, Ohio, and accelerating the restart of its Tilden mining operations in Michigan. Th…",2020-06-09T11:09:32Z
"After COVID-19, green investment must deliver jobs to get political traction",Analysis of past recoveries shows a low-carbon reboot matters more for climate than does the brief emissions crash.,2020-06-09T00:00:00Z
"After COVID-19, green investment must deliver jobs to get political traction",Analysis of past recoveries shows a low-carbon reboot matters more for climate than does the brief emissions crash.,2020-06-09T00:00:00Z
Isabel Schnabel: Q&A on Twitter,The European Central Bank (ECB) is the central bank of the 19 European Union countries which have adopted the euro. Our main task is to maintain price stability in the euro area and so preserve the purchasing power of the single currency.,2020-06-09T00:00:00Z
Powering up sustainable energy,"As the power industry continues to shift to more sustainable energy, can it simultaneously decarbonize generation, propel the transition to electric vehicles, and keep the lights on?",2020-06-09T00:00:00Z
Avoiding a ‘social recession’: A conversation with Vivek Murthy,"The former US surgeon general discusses the effects of the crisis on both individuals and the public-health system, issues a call to action, and warns against slipping backward.",2020-06-09T00:00:00Z
Could the coronavirus crisis finally finish off coal?,Coal is the most polluting of all fossil fuels - could the Covid-19 crisis finally finish it off?,2020-06-08T23:27:58Z
Stocks In Green For 2020 On Same Day U.S. Declares Recession - Why The Disconnect?,"Today saw stocks turn positive for 2020, right as the U. S. formally recognized a recession.",2020-06-08T23:27:23Z
"Canada needs to clarify foreign takeover rules amid heightened risk of state-led acquisitions, committee told",Ottawa has for years struggled to strike a balance between attracting foreign investment and fending off politically-motivated takeovers by foreign states,2020-06-08T22:55:07Z
