Banks#39; risk aversion may worsen COVID-19 crisis; these 40 companies are high liquidity risk,"Addressing banks#39; risk- aversion is a vital to unclogging credit flow, say experts.",2020-05-27T07:03:05Z
"Very positive on Bharti Airtel, use dips to accumulate stock: Dipan Mehta",‘Telecom is one industry which is able to maintain its present earnings power’,2020-05-27T06:56:50Z
Prudent lenders like Axis Bank & Kotak Bank should keep some powder dry: SBICap Securities,‘The valuations at this point of time are fairly attractive across the financial sector’,2020-05-27T05:55:06Z
The Twilio Plateau,Twilio is one of the best-run companies in tech. Its innovation keeps it head and shoulders above mounting competition. The valuation today is a little rich giv,2020-05-27T03:04:08Z
Anaplan Inc (PLAN) Q1 2021 Earnings Call Transcript,"PLAN earnings call for the period ending March 31, 2020.",2020-05-27T02:30:50Z
"SP 500 rises on economic recovery and vaccine hopes, pulls back from highs","The Dow Jones Industrial Average rose 529.95 points, or 2.17%, to 24,995.11, the S&P 500 gained 36.32 points, or 1.23%, to 2,991.77, and the Nasdaq Composite added 15.63 points, or 0.17%, to 9,340.22.",2020-05-27T01:59:04Z
COVID-19’s effect on minority-owned small businesses in the United States,"Already vulnerable, minority-owned small businesses brace for disproportionate impact. Here’s how to help.",2020-05-27T00:00:00Z
COVID-19’s effect on minority-owned small businesses in the United States,"Already vulnerable, minority-owned small businesses brace for disproportionate impact. Here’s how to help.",2020-05-27T00:00:00Z
Edited Transcript of TMUS earnings conference call or presentation 6-May-20 8:30pm GMT,Q1 2020 T-Mobile US Inc Earnings Call,2020-05-26T22:54:35Z
Mobile TeleSystems PJSC (MBT) Q1 2020 Earnings Call Transcript,"MBT earnings call for the period ending March 31, 2020.",2020-05-26T22:30:25Z
"Mining and health care drag ASX down, despite bank surge","The Australian share market finishes the day in negative territory, with sharp falls for healthcare and mining stocks wiping out earlier gains.",2020-05-26T21:56:11Z
Mobile TeleSystems Public Joint Stock Company (MBT) CEO Alexey Kornya on Q1 2020 Results - Earnings Call Transcript,"Mobile TeleSystems Public Joint Stock Company (NYSE:MBT) Q1 2020 Earnings Conference Call May 26, 2020 11:00 AM ET Company Participants Polina Ugryumova - Direc",2020-05-26T21:47:06Z
Edited Transcript of GEN.CO earnings conference call or presentation 6-May-20 4:00pm GMT,Q1 2020 Genmab A/S Earnings Call,2020-05-26T21:30:34Z
"TSX gets lift from financials, U.S. markets rise to highest levels since March","TORONTO — Canada's main stock index got a lift from the heavyweight financials sector, while U.S. markets surged to their highest levels in more than two months on improving sentiment from economic reopenings.That prompted a rotation by investors on Tuesday t…",2020-05-26T21:12:16Z
China Yuchai International Ltd (CYD) Q1 2020 Earnings Call Transcript,"CYD earnings call for the period ending March 31, 2020.",2020-05-26T20:30:42Z
"S&P 500 clears 3,000 barrier on hopes of recovery, Covid-19 vaccine",The benchmark index traded above the key psychological level for the first time since March 5,2020-05-26T19:52:00Z
Wall Street up as recovery hopes overshadow virus worries,Wall Street is sharply higher as hopes for economic recovery overshadow worries over the coronavirus pandemic,2020-05-26T19:33:04Z
"Anaplan, Inc. (PLAN) CEO Frank Calderoni on Q1 2021 Results - Earnings Call Transcript","Anaplan, Inc. (NYSE:PLAN) Q1 2021 Earnings Conference Call May 26, 2020 08:30 AM ET Company Participants Edelita Tichepco - Vice President, Investor Relations F",2020-05-26T18:51:06Z
"Bosch sees auto on a slow road to recovery, faces valuation pressure",This gloomy outlook which the company shared with investors after declaring its March quarter results could weigh on its valuations.,2020-05-26T18:43:29Z
Airline stocks soar as Covid-19 worries ease,Markets bounce back as hopes rise for economic recovery,2020-05-26T17:36:45Z
BW LPG Ltd. (BWLLF) CEO Anders Onarheim on Q1 2020 Results - Earnings Call Transcript,"BW LPG Ltd. (OTCPK:BWLLF) Q1 2020 Results Earnings Conference Call May 26, 2020, 08:00 AM ET Company Participants Anders Onarheim - Chief Executive Officer Niel",2020-05-26T16:29:04Z
BW LPG Ltd. (BWLLF) CEO Anders Onarheim on Q1 2020 Results - Earnings Call Transcript,"BW LPG Ltd. (OTCPK:BWLLF) Q1 2020 Results Earnings Conference Call May 26, 2020, 08:00 AM ET Company Participants Anders Onarheim - Chief Executive Officer Niel",2020-05-26T16:29:04Z
"S&P 500 tops 3,000 on hopes of economic recovery, COVID-19 vaccine","U.S. stocks jumped and the S&P 500 breached 3,000 points on Tuesday as optimism about a potential coronavirus vaccine and a revival in business activity helped investors overlook simmering Sino-U.S. tensions.",2020-05-26T16:24:49Z
"S&P 500 tops 3,000 on hopes of economic recovery, COVID-19 vaccine","U.S. stocks jumped and the S&P 500 breached 3,000 points on Tuesday as optimism about a potential coronavirus vaccine and a revival in business activity helped investors overlook simmering Sino-U.S. tensions.",2020-05-26T16:19:01Z
"S&P 500 tops 3,000 points on hopes of economic recovery, COVID-19 vaccine","U.S. stocks jumped and the S&P 500 breached 3,000 points on Tuesday as optimism about a potential coronavirus vaccine and a revival in business activity helped investors overlook simmering Sino-U.S. tensions.",2020-05-26T15:41:26Z
"SP 500 tops 3,000 points on hopes of economic recovery, COVID-19 vaccine","All 11 S&P sector indexes gained in early trading, with cyclical financials, industrials and energy stocks jumping more than 3 percent.",2020-05-26T15:17:04Z
"S&P 500 tops 3,000 pts on hopes of economic recovery, COVID-19 vaccine","U.S. stocks jumped and the S&P 500 breached 3,000 points on Tuesday as optimism about a potential coronavirus vaccine and a revival in business activity helped investors overlook simmering Sino-U.S. tensions.",2020-05-26T14:55:39Z
BDJ: Overweight Financial Exposure Makes This Fund Lag For Now,"BDJ is right around its 5-year average discount, after pulling back significantly YTD along with the rest of the market. The greater volatility should help its",2020-05-26T14:33:59Z
"Bajaj Fin, HDFC Bank & ICICI Bank top bets: MOAMC",‘A large part of value for a lot of private banks is coming from subsidiaries’,2020-05-26T13:44:50Z
"Coronavirus to trigger fresh consolidation across sectors, says BofA",The first round of consolidation was triggered by demonetisation and implementation of the unified goods and services tax (GST) regime in 2016 and 2017.,2020-05-26T13:34:00Z
"Clinical Chemistry Analyzers Market Anticipated to Cross $21 Billion by 2027 - Assessment of Products, Technologies, End-users, Emerging Markets and More","DUBLIN, May 26, 2020 /PRNewswire/ -- The ""Clinical Chemistry Analyzers - Global Market Outlook (2018-2027)"" report has been added to ResearchAndMarkets.com's offering. The Global Clinical Chemistry Analyzers market accounted for $11,114.09 million in 2018 and…",2020-05-26T13:30:00Z
"Clinical Chemistry Analyzers Market Anticipated to Cross $21 Billion by 2027 - Assessment of Products, Technologies, End-users, Emerging Markets and More","The ""Clinical Chemistry Analyzers - Global Market Outlook (2018-2027)"" report has been added to ResearchAndMarkets.com's offering.",2020-05-26T13:30:00Z
The Great Inflation/Deflation Debate: What's An ETF Investor To Do? (Podcast Transcript),"With the Fed's balance sheet expanding at an unprecedented rate, inflation concerns have made a comeback among some market watchers on both Wall Street and Main",2020-05-26T12:30:59Z
"Futures Soar Above 3,000, Dollar Tumbles On Vaccine Hopes, Reopening Optimism","Futures Soar Above 3,000, Dollar Tumbles On Vaccine Hopes, Reopening Optimism

 Tyler Durden
 
Tue, 05/26/2020 - 08:04

 S&P futures continued their Memorial Day surge, rising 2% and breached the key 3,000 level on Tuesday morning as global easing of lockdown…",2020-05-26T12:04:44Z
"Alibaba hits gross market value of $1 trillion, one sixth of China’s total retail sales","In other words one out of every two Chinese are buying our platform,"" Daniel Zhang, Executive Chairman and CEO of Alibaba Group Holding Limited said.",2020-05-26T11:47:19Z
Online learning leads to EDUCATION GAP — CLARK calls for SUPPLY CHAIN oversight czar — Is state reopening is TOO SOON?,,2020-05-26T11:19:05Z
Underinvested in equities? Time to accumulate stocks via SIP route: Devarsh Vakil,"If you are overweight on equities, reduce the allocation of rallies.",2020-05-26T08:08:43Z
CDW Corp.: Higher Market Share Ahead,CDW Corp.'s resilience and scale will lead to market share gains. Its strong competitive position supports higher cash flow generation. Shares are modestly pric,2020-05-26T07:53:53Z
"Buy Trent, target price Rs 610: Motilal Oswal","rent’s cost of retailing should rise due to high store additions in FY20, which would weigh on its EBITDA margins.",2020-05-26T07:24:54Z
"#39;Nifty lacking fresh triggers, focus on outperforming sectors such as pharma#39;",Focusing on sectors which are showing outperformance & underperformance is an ideal way to trade in this market.,2020-05-26T06:09:55Z
"Pain likely to exacerbate for banks, financials; should you avoid the sector?","Nifty Bank index plunged 2.6 percent on May 22. As many as 9 out of a total of 12 stocks ended in the red, with Axis Bank, Federal Bank, RBL Bank, ICICI Bank and Bandhan Bank as the top losers.",2020-05-26T05:31:16Z
2020 marked as year of reforms: 10 potential wealth-creators for next 2-3 years,"The year 2020 can be called the year of reforms that are likely to benefit the economy in the next 2-3 years or longer but in the short term, investors have been left asking for more.",2020-05-26T05:00:32Z
SGX Nifty trades 90 points higher; here's what changed for market while you were sleeping,"Nifty futures on the Singapore Exchange traded 93 points, or 1.03 per cent higher at 9,134 in signs that Dalal Street was headed for a positive start on Tuesday.",2020-05-26T02:59:40Z
SFL Corporation: This Shipper That Will Survive,Operating revenues were $121.896 million compared to $116.64 million the same quarter a year ago and up 4.5% sequentially. The company had a net loss of $87.054,2020-05-26T00:14:12Z
Financials Still A Value Trap,Financials have underperformed dramatically and seem optically cheap - with large capital buffers and unlimited Fed liquidity support and would benefit from GDP,2020-05-25T21:22:46Z
Toronto stock market rally led by cannabis while U.S. stock markets closed - Yahoo Canada Finance,"<ol><li>Toronto stock market rally led by cannabis while U.S. stock markets closed  Yahoo Canada Finance
</li><li>At midday: TSX gains on hopes of economic recovery, pot stocks soar  The Globe and Mail
</li><li>Top TSX Financial Stocks for June 2020  The Mo…",2020-05-25T20:27:00Z
Shopify Is Taking The E-Commerce World By Storm,"Lately, Shopify (SHOP) is firing on all cylinders. The company announced a series of new features on its May 20 Reunite event, together with a new partnership w",2020-05-25T17:13:36Z
Edited Transcript of B4B.DE earnings conference call or presentation 7-May-20 6:45am GMT,Q2 2020 Metro AG Earnings Call,2020-05-25T16:45:42Z
"Bill Allowing Commercial Tenants to Renegotiate, Break Lease Deals Advances in Calif.","Commercial landlords and property owners across California may need to get a lot of Wite-Out ready. The state’s Senate Judiciary Committee advanced a bill on Friday that would allow small businesses — like cafes, restaurants and bars — to renegotiate and modi…",2020-05-25T15:30:43Z
These International Stocks Are Extremely Undervalued - Part 1,"In this article, we echo a similar piece done about a week ago but instead focus on undervalued international stocks. Here, we find companies hailing from Scand",2020-05-25T14:54:42Z
Top TSX Financial Stocks for June 2020 - The Motley Fool Canada,"<ol><li>Top TSX Financial Stocks for June 2020  The Motley Fool Canada
</li><li>TSX futures rise on optimism as economies reopen  Yahoo Canada Finance
</li><li>At the open: TSX gains on hopes of economic recovery  The Globe and Mail
</li><li>Market Crash: …",2020-05-25T13:05:09Z
Jefferies breaks down the top 22 stocks it thinks you should buy right now — including 6 fast-risers that just captured its attention,"<ul>
<li>Jefferies names its 22 top US stock picks, according to the conviction and buy ratings assigned by their analysts. The firm out the investment thesis for each one.</li>
<li>Their choices are about evenly split between companies that are already outpe…",2020-05-25T12:05:00Z
"Weekly S&P 500 ChartStorm - Downgrades, Dividends, Buybacks","This week we take stock of the uneasy landscape with downgrades, delayed payments, and yet massive monetary easing.We also document a couple of key trends in dividend land; such as dividend cuts, dividend yield attractiveness, buybacks, and REITs.Lastly we lo…",2020-05-25T11:26:38Z
"Two months of lockdown: Sensex gains 15%, 45 BSE500 stocks rally over 50%","Among largecaps (BSE Sensex), M&M, Reliance Industries, Bharti Airtel, Sun Pharma, Hero MotoCorp and Bajaj Auto gained 32-58 percent, whereas only four stocks were in the red.",2020-05-25T08:40:49Z
Transcript: Jon Taffer,"﻿   The transcript from this week’s, MiB: Jon Taffer, is below. You can stream and download our full conversation, including the podcast extras, on Apple iTunes, Spotify, Overcast, Google, Bloomberg, and Stitcher. All of our earlier podcasts on your favorite …",2020-05-24T16:00:18Z
Covid-19 dents financials of private healthcare sector,"Chennai, May 24India’s private healthcare industry has not been in the pink of health since the Covid-19 pandemic broke out. The highly capital-intensive sector is staring at deep financial stress as",2020-05-24T15:12:04Z
Edited Transcript of METSO.HE earnings conference call or presentation 7-May-20 10:00am GMT,Q1 2020 Metso Oyj Earnings Call,2020-05-24T04:10:32Z
Edited Transcript of LNZ.VA earnings conference call or presentation 6-May-20 7:00am GMT,Q1 2020 Lenzing AG Earnings Call,2020-05-24T04:09:05Z
Edited Transcript of BYW6.DE earnings conference call or presentation 7-May-20 6:30am GMT,Q1 2020 BayWa AG Earnings Call,2020-05-24T02:44:53Z
Midstream Companies Slash Capex By 50% After Oil Crash,"With the collapse in oil demand, oil producers and refiners have come under intense financial pressure. Not far behind are the integrated supermajors like ExxonMobil and Chevron. These companies have upstream (oil- and gas-producing) assets as well as refinin…",2020-05-23T19:00:00Z
Startups Weekly: SoftBank portfolio results show which tech sectors are still thriving - TechCrunch,"Remember when the top investors and companies in tech were reacting to SoftBank's every move? These days, we are picking through the latest results from the Japanese conglomerate and its Vision Fund to see how things went wrong, and where it is still succeedi…",2020-05-23T17:46:49Z
Coronavirus Beaten Down Stocks/Funds Series - iShares MSCI Germany ETF,"The iShares MSCI Germany ETF has recently bounced up slightly but is still back at the 2012 level. The fund is down 36% from a 2017 peak and 23% YTD.Germany is the powerhouse of Europe, the world's 4th largest economy, and the world's 3rd larger exporter and …",2020-05-23T12:02:53Z
"EXG: 10% Yielding CEF, Earlier Than Expected Vaccine For COVID-19 Can Support The Rebound","The key bullish catalyst is a potential, earlier-than-expected available vaccine for COVID-19.The second wave of coronavirus infections remains the key near-term risk.The fund has underperformed the Vanguard Total World Stock ETF over the last decade.",2020-05-23T10:46:24Z
"EXG: 10% Yielding CEF, Earlier Than Expected Vaccine For COVID-19 Can Support The Rebound","The key bullish catalyst is a potential, earlier-than-expected available vaccine for COVID-19.The second wave of coronavirus infections remains the key near-term risk.The fund has underperformed the Vanguard Total World Stock ETF over the last decade.",2020-05-23T10:46:24Z
"EXG: 10% Yielding CEF, Earlier Than Expected Vaccine For COVID-19 Can Support The Rebound","The key bullish catalyst is a potential, earlier-than-expected available vaccine for COVID-19.The second wave of coronavirus infections remains the key near-term risk.The fund has underperformed the Vanguard Total World Stock ETF over the last decade.",2020-05-23T10:46:24Z
Edited Transcript of STWD earnings conference call or presentation 4-May-20 12:30pm GMT,Q1 2020 Starwood Property Trust Inc Earnings Call,2020-05-23T07:43:56Z
The Market Still Has Legs To Run: 6 Names That Will Stand To Benefit The Most,"Our current six portfolio names seek to benefit the most from this newfound COVID-19 environment.Our portfolio has selected names with two umbrellas of diversification that we have labeled as “More Room for Growth” and ""Guilty by Association"" companies/indice…",2020-05-23T07:16:52Z
Buy Mahindra Logistics; target of Rs 300: ICICI Direct,"ICICI Direct is bullish on Mahindra Logistics has recommended buy rating on the stock with a target price of Rs 300 in its research report dated May 21, 2020.",2020-05-23T06:39:41Z
These 5 sectors should have highest portion in equity portfolio due to stable outlook in COVID-19 crisis,"We have to be theme oriented, basically investing in sectors and stocks for which the outlook is stable in this situation.",2020-05-23T06:32:51Z
Covid Impact: 43 out of 153 listed entities avow pandemic’s material impact,"Companies see impact on future revenues, costs and contracts due to Covid-19 crisis",2020-05-23T05:09:18Z
WisdomTree U.S. MidCap Dividend ETF Has A High Exposure To Cyclical Sectors,"DON invests in mid-cap dividend stocks in the United States.The fund has a high exposure to cyclical sectors, and this may cause it to continue to underperform in the current recessionary environment.DON has an inferior growth profile than its large-cap peer …",2020-05-23T00:41:14Z
Alibaba Group Holding Limited (BABA) Q1 2020 Earnings Call Transcript,"BABA earnings call for the period ending March 31, 2020.",2020-05-22T22:30:38Z
Alibaba Group Holding Limited (BABA) CEO Daniel Zhang on Q4 2020 Results - Earnings Call Transcript,,2020-05-22T20:25:47Z
Alibaba Group Holding Limited (BABA) CEO Daniel Zhang on Q4 2020 Results - Earnings Call Transcript,,2020-05-22T20:25:47Z
TJX: Bucking The Trend And Poised For Recovery,"TJX reported Q1 2020 results with revenue falling ~$5 billion due to the impacts of the virus and store shutdowns.The company began reopening stores in May and has seen strong initial demand from shoppers due to pent-up demand.As a financially solid company, …",2020-05-22T20:15:00Z
TJX: Bucking The Trend And Poised For Recovery,"TJX reported Q1 2020 results with revenue falling ~$5 billion due to the impacts of the virus and store shutdowns.The company began reopening stores in May and has seen strong initial demand from shoppers due to pent-up demand.As a financially solid company, …",2020-05-22T20:15:00Z
ORIX (IX) Q4 2020 Earnings Call Transcript,"IX earnings call for the period ending March 31, 2020.",2020-05-22T18:30:56Z
"Three Warren Buffett Tech Stocks to Buy: AMZN, AAPL, STNE","Three Warren Buffett Tech Stocks to Buy by Harvi Sadhra Berkshire Hathaway’s (NYSE: BRK.A) (NYSE:BRK.B) owner Warren Buffett is the most popular investor who built...
The post Three Warren Buffett Tech Stocks to Buy: AMZN, AAPL, STNE appeared first on ValueWa…",2020-05-22T15:50:41Z
8 Reasons D.R. Horton Is A Pre-Retirement Stock,D.R. Horton is fair value with a PE of 10 and long-term growth trends in the 12-17% range per annum.DHI suits investors entering the countdown to retirement who are looking for safe diversification from FAANG and volatile technology stocks.Quantitative easing…,2020-05-22T15:15:01Z
"It’s Not Delivery, It’s Diminished Competition: Can Uber Really Buy Grubhub?","The COVID-19 pandemic has taken so much from so many, so we’ve got to find bits of joy where we can. For me, quarantined with my mother in Lexington, KY, that has become weekend food delivery. To be sure, my mother is an incredible cook and I am a middling (t…",2020-05-22T15:03:49Z
Mining and mineral sector impacted due to Covid-19 led slowdown: KPMG,"In the construction sector, there is a lack of automation and the resultant dependence on manual labourers. The monsoon is expected to affect the return to normalcy in Q2 of FY21",2020-05-22T14:42:00Z
"CANADA STOCKS-TSX falls as oil weakens, Sino-U.S. tensions rise","Canada's main stock index was dragged
down by energy stocks on Friday, as oil prices fell and tensions
between the United States and China rose.",2020-05-22T14:20:56Z
ORIX Corporation (IX) CEO Makoto Inoue on Fiscal Q4 2020 Results - Earnings Call Transcript,,2020-05-22T14:07:02Z
'Financials to be under pressure for next two qtrs',‘Market leadership will change over the next 12 months’,2020-05-22T13:04:59Z
"Centre, states to incur Rs 12k cr revenue loss in FY21 on lower coal, mineral consumption: Report","Falling demand as a result of the nationwide lockdown, decreased consumption and supply chain issues have forced the miners to either run at significantly lower capacity utilisation, or close operations temporarily, the report said.   As an immediate conseque…",2020-05-22T12:47:03Z
"Futures Slide, Yuan Tumbles, Hang Seng Plunges Most In 5 Years On Hong Kong Crackdown","Futures Slide, Yuan Tumbles, Hang Seng Plunges Most In 5 Years On Hong Kong Crackdown

 Tyler Durden
 
Fri, 05/22/2020 - 07:56

 S&P futures dropped alongside European and Asian stocks on Friday, while the Hang Seng index crashed 5.6%, the most in five years,…",2020-05-22T11:56:01Z
COVID-19 - Firms Must Engage Professional Accountants,[Zimbabwe Independent] A volatile mix of high inflation and Covid-19 turmoil has thrown Zimbabwe's financial reporting system into a tailspin. Chartered accountants have a front-row seat as this turbulent situation unfolds. Business reporter Fidelity Mhlanga …,2020-05-22T11:52:11Z
"Taking Stock: RBI surprise repo cut fails to cheer D-Street, financials take a hit","Financial stocks that hit a fresh 52-week low included Bajaj Finserv, Bajaj Finance, Shriram City Union Finance, SBI Cards, SBI, M&M Financial and Union Bank of India.",2020-05-22T11:28:16Z
"Invest slowly, nothing is changing in the next three months: Samir Arora",Things have a way of turning around with new sectors or stocks emerging.,2020-05-22T11:03:00Z
SCHV: Value Is The Contrarian Play,"Value has been a long-term laggard compared to both growth strategies and the broader market.Investors expect value to continue to under-perform going forward, which does open up a contrarian opportunity.SCHV's top holdings are established players that will s…",2020-05-22T09:46:34Z
Market stares at an uncertain tomorrow; 12 stocks that can still reap gains,Experts continue to warn that the market will keep oscillating between rise and fall and one must remain cautious while taking a call for trade.,2020-05-22T08:41:29Z
"Buy Tata Steel, target price Rs 330: Edelweiss","The first quarter of FY21E is likely to be particularly weak for the company. That said, FY22E EBITDA is expected to normalize to Rs 7,500/t anticipating that demand would have recovered by then.",2020-05-22T07:54:09Z
"Stock Ideas: Edelweiss has a buy on Dr Reddy’s, target price Rs 4,500","With a focused management, promising complex pipeline and 21% earnings CAGR, the company remains on a strong growth trajectory over FY20–22.",2020-05-22T07:32:05Z
#39;Nifty consolidation to go into May series expiry week; Bank Nifty will continue to underperform#39;,"The Nifty failed to sustain above the morning highs above 9,150 as banking stocks dragged lower in the second half on the weekly expiry.",2020-05-22T07:15:04Z
"Financials tumble as RBI extends moratorium; SBI, Bajaj Fin hit 52-wk low","The RBI has extended moratorium period by another three months till August 31, 2020.",2020-05-22T06:11:59Z
"This Is Why Not To Count On A Strong, Earnings-Driven, Broad-Market Rebound","The outlook for economic rebound and earnings growth in 2021 is robust, but there are some things you need to know about the data.Despite growing uncertainty of the COVID-19 impact, some sectors are still looking at steady, stable revenue and earnings growth.…",2020-05-22T05:43:39Z
"Agilysys, Inc.'s (AGYS) CEO Ramesh Srinivasan on Q4 2020 Results - Earnings Call Transcript",,2020-05-22T03:30:51Z
"Buy JSW Energy, target price Rs 58: Emkay Global",The brokerage has lowered its earnings estimate for FY21/FY22 by 22 per cent/14 per cent to factor in a steep fall in generation across the open capacity of Vijaynagar and Ratnagiri stations due to a likely prolonged fall in power demand.,2020-05-22T03:25:22Z
Agilysys Inc (AGYS) Q4 2020 Earnings Call Transcript,"AGYS earnings call for the period ending March 31, 2020.",2020-05-22T01:30:34Z
Ross Stores Inc (ROST) Q1 2020 Earnings Call Transcript,"ROST earnings call for the period ending May 2, 2020.",2020-05-22T01:00:45Z
"Ross Stores, Inc. (ROST) CEO Barbara Rentler on Q1 2020 Results - Earnings Call Transcript",,2020-05-21T22:39:06Z
"Ross Stores, Inc. (ROST) CEO Barbara Rentler on Q1 2020 Results - Earnings Call Transcript",,2020-05-21T22:39:06Z
US Physical Therapy Inc (USPH) Q1 2020 Earnings Call Transcript,"USPH earnings call for the period ending March 31, 2020.",2020-05-21T22:00:25Z
"111, Inc. (YI) CEO Junling Liu on Q1 2020 Results - Earnings Call Transcript",,2020-05-21T21:54:03Z
Apollo Investment Corp (AINV) Q4 2020 Earnings Call Transcript,"AINV earnings call for the period ending May 22, 2020.",2020-05-21T21:30:37Z
