"Invesco S&P 500 High Beta ETF: Careful, Icarus","Invesco S&P 500 High-Beta ETF has risen 30% in only about three weeks, leaving in the dust a rallying broad market. The combination of lower-quality and increas",2020-06-05T13:51:28Z
"Invesco S&P 500 High Beta ETF: Careful, Icarus","Invesco S&P 500 High-Beta ETF has risen 30% in only about three weeks, leaving in the dust a rallying broad market. The combination of lower-quality and increas",2020-06-05T13:51:28Z
"Surprise Of The Month: Jobs Report Shows Big May Employment Gains, Falling Unemployment","It’s probably fair to say few if anyone expected this kind of a payrolls report, and the numbers are still being digested. Could the worst be over? It’s arguable, and a lot of Americans are still suffering. But this does suggest the economy started improving …",2020-06-05T13:35:11Z
"Capital Southwest Corp.: 13% Yield, 2nd And 3rd Quarter Dividends Maintained, No K-1",CSWC yields 13.6% with strong 1.4X coverage. Mgt. maintained the distributions for June and Sept. CSWC has 90% 1st lien investments in its portfolio.,2020-06-05T13:15:00Z
"Capital Southwest Corp.: 13% Yield, 2nd And 3rd Quarter Dividends Maintained, No K-1",CSWC yields 13.6% with strong 1.4X coverage. Mgt. maintained the distributions for June and Sept. CSWC has 90% 1st lien investments in its portfolio.,2020-06-05T13:15:00Z
The Implication Of Berkshire Hathaway's Record Insider Buying Activity For Future Stock Returns,"Director Meryl B Witmer bought $1.7 bln worth of Berkshire Hathaway shares last week, which is the highest insider purchase on record for the company. Berkshire",2020-06-05T13:00:00Z
Airtel ARPU may go as high as Rs 300: Kotak,"‘In the near term, L&T will definitely face challenges on the order intake front’",2020-06-05T12:42:03Z
"Indices close higher for 2nd week; Sensex gains 306 points, Nifty at 10,142","Barring FMCG that fell marginally and IT sector that closed flat, all 
other indices ended on a bullish note, with PSU Bank rising 6.8%, 
followed by 5.2% rise in media stocks and 3.8% gain in metal scrips",2020-06-05T12:06:47Z
S&P 500: Nine Stocks Really Shine Every Summer (Do You Own Them Yet?) - Investor's Business Daily,"<ol><li>S&P 500: Nine Stocks Really Shine Every Summer (Do You Own Them Yet?)  Investor's Business Daily
</li><li>Stocks just had their biggest 50-day rally ever — here's what they did next after similar gains (SPY)  Business Insider
</li><li>Wall Street’s …",2020-06-05T12:03:53Z
Stocks Soar On Fresh Stimulus Flood Ahead Of Worst Unemployment Print In US History,"Stocks Soar On Fresh Stimulus Flood Ahead Of Worst Unemployment Print In US History

 Tyler Durden
 
Fri, 06/05/2020 - 08:00

 Just when it seemed that the record 40% rally from the March lows was coming to an end, as Treasury yields blew out and tech names r…",2020-06-05T12:00:08Z
A Viral Market Update IX: A Do-It-Yourself S&P 500 Valuation,"Markets have settled in, mostly with an upward bias in these last few weeks, and the big question, as US equities climb back towards pre-crisis levels, is wheth",2020-06-05T11:24:56Z
"Bank stocks, firm global cues drive Sensex 307 points higher",Top private lender HDFC Bank was the biggest Sensex contributor as it rose 3.14 per cent.,2020-06-05T11:21:26Z
"Taking Stock: Nifty reclaims 10,100, but experts say wait for a breakout above 10,176","Traders should wait for a breakout in either direction before initiating trading bets, experts say.",2020-06-05T11:10:43Z
States power discoms debts to hit all-time high of ₹4.5 trillion: Crisil,"With power demand weak and cash losses high amid the Covid-19 pandemic, discoms would end up owing lenders a staggering  ₹4.5 lakh crore by the end of this fiscal, or 30% more than last fiscal",2020-06-05T10:58:22Z
Coronavirus Roundtable - Still Some Dancing To Be Done,We ask trading-oriented authors on the Marketplace to share their view on the eventful 2020 market. There's something of a consensus that the market is overboug,2020-06-05T10:30:29Z
"At the open: TSX jumps almost 2% with jobs data, higher oil prices - The Globe and Mail","At the open: TSX jumps almost 2% with jobs data, higher oil prices  The Globe and Mail",2020-06-05T08:51:15Z
Gap's (GPS) CEO Sonia Syngal on Q1 2020 Results - Earnings Call Transcript,"Gap Inc. (NYSE:GPS) Q1 2020 Earnings Conference Call June 4, 2020 5:00 PM ET Company Participants Tina Romani – Senior Director of Investor Relation Sonia Synga",2020-06-05T07:57:06Z
Don’t take a broad-brush approach when picking BFSI & pharma stocks: Aashish Somaiyaa,‘Be selective when picking stocks as we move into the next quarter’,2020-06-05T07:41:01Z
Gap Inc (GPS) Q1 2020 Earnings Call Transcript,"GPS earnings call for the period ending May 2, 2020.",2020-06-05T04:30:24Z
"Buy MAS Financial Services, target price Rs 632: Motilal Oswal","According to the brokerage, this company has one of the best capitalisations amongst NBFCs with Tier I of ~29 per cent.",2020-06-05T03:41:55Z
GreenTree Hospitality Group Ltd. (GHG) CEO Alex Xu on Q1 2020 Results - Earnings Call Transcript,"GreenTree Hospitality Group Ltd. (NYSE:GHG) Q1 2020 Earnings Conference Call June 04, 2020 09:00 PM ET Company Participants Rene Vanguestaine - Christensen, Inv",2020-06-05T03:33:09Z
"DocuSign, Inc. (DOCU) CEO Dan Springer on Q1 2021 Results - Earnings Call Transcript","DocuSign, Inc. (NASDAQ:DOCU) Q1 2021 Earnings Conference Call June 4, 2021 4:30 P.M. ET Company Participants Anne Leschin - Head of Investor Relations Dan Sprin",2020-06-05T03:05:42Z
10 things you need to know before the opening bell on June 5 - CNBCTV18,"<ol><li>10 things you need to know before the opening bell on June 5  CNBCTV18
</li><li>What changed for the market while you were sleeping? Top 10 things to know  Moneycontrol.com
</li><li>Share Market LIVE: SGX Nifty points to gap-up start for Sensex, Nif…",2020-06-05T02:39:33Z
Five equity funds have given superior 10-year SIP returns,"While 10-year SIP returns of various equity schemes have been in single digits, there are some that managed to outperform peers and the benchmark indices.",2020-06-05T02:19:00Z
Five equity funds have given superior 10-year SIP returns,"The fund manager is overweight on financials and auto, and underweight pharma and FMCG.",2020-06-05T02:18:58Z
"DocuSign, Inc. (DOCU) Q1 2021 Earnings Call Transcript","DOCU earnings call for the period ending April 30, 2020.",2020-06-05T01:30:29Z
A Viral Market Update IX: A Do-it-Yourself S&P 500 Valuation,,2020-06-04T17:54:00Z
5 Sector ETFs Just Got Upgraded to Buy,Zacks recently issued quarterly rank updates for ETFs and these sector ETFs have been upgraded to Buy.,2020-06-04T17:00:05Z
"Market Extra: The next 10% up in the S&P 500 is all about the pandemic recovery — and it’s doable, this analyst says","It’s not out of the question that the stock index could rise 10%, one analyst argues, because there are both fundamental and technical reasons why the stocks that will make up the pandemic recovery play can lead the way.",2020-06-04T16:18:36Z
Ratings agencies will see merit in India's 'historic' reforms: NITI Aayog's Amitabh Kant,"Earlier this week, Moody's downgraded India's sovereign rating to the lowest investment grade citing weak government financials, sustained slowdown, and poor executin of economic reforms",2020-06-04T15:38:05Z
COVID-19 Puts AI M&A In The Spotlight,"COVID-19 puts artificial intelligence AI M&A in the spotlight on the back of record deal volumes in 2019, says Hampleton Partners’ report Q1 2020 hedge...
The post COVID-19 Puts AI M&A In The Spotlight appeared first on ValueWalk.",2020-06-04T14:55:42Z
"Costco, Travel Stocks See Strength In Pre-Market Trading As Reopening Optimism Continues","It’s not surprising to see the market pause after sizzling for weeks. Jobless claims were worse than expected, and payrolls loom tomorrow. If stocks fall just slightly today, that might be seen as not too bad a thing considering how far we’ve come.",2020-06-04T13:29:07Z
"Global Disinfectant Spray Market Forecast to 2027 with Profiles of Major Players Including Johnson & Johnson, P&G, 3M, Kimberly-Clark, Reckitt Benckiser, and DuPont","DUBLIN, June 4, 2020 The ""Disinfectant Spray - Global Market Outlook (2018-2027)"" report has been added to ResearchAndMarkets.com's offering. The Global Disinfectant Spray market accounted for $654.05 million in 2018 and is expected to reach $2,487.32 million…",2020-06-04T12:45:00Z
"Global Disinfectant Spray Market Forecast to 2027 with Profiles of Major Players Including Johnson & Johnson, P&G, 3M, Kimberly-Clark, Reckitt Benckiser, and DuPont","DUBLIN, June 4, 2020 The ""Disinfectant Spray - Global Market Outlook (2018-2027)"" report has been added to ResearchAndMarkets.com's offering.",2020-06-04T12:45:00Z
"Buffett's Portfolio Hasn't Done This in 4 Years, Until Now",Are we witnessing a changing of the guard in the Oracle of Omaha's investment portfolio?,2020-06-04T10:06:00Z
Edited Transcript of SATS earnings conference call or presentation 7-May-20 3:00pm GMT,Q1 2020 EchoStar Corp Earnings Call,2020-06-04T08:37:16Z
The Future Is Bright For Spotify,Spotify is the dominant leader in audio streaming from an engagement standpoint. The Freemium offering is a subsidy program that offsets the costs of acquiring,2020-06-04T07:39:11Z
How banks and NBFCs can thrive after Covid-19,How banks and NBFCs can thrive after Covid-19COVID-19 is upending the banking sector while simultaneously forcing it to transform radically.,2020-06-04T06:39:39Z
"How Doug Hastie's high-tech firm, Syft, and his low-tech Chanui Tea have fared during the outbreak - New Zealand Herald","How Doug Hastie's high-tech firm, Syft, and his low-tech Chanui Tea have fared during the outbreak  New Zealand Herald",2020-06-04T04:02:06Z
10 things you need to know before the opening bell on June 4 - CNBCTV18,"<ol><li>10 things you need to know before the opening bell on June 4  CNBCTV18
</li><li>SGX Nifty down 20 points; here's what changed for market while you were sleeping  Economic Times
</li><li>Share Market LIVE: Sensex rises 130 points, Nifty at 10,088; Te…",2020-06-04T02:41:16Z
Wall Street closes sharply higher on signs of economic rebound,"The Dow Jones Industrial Average rose 527.24 points, or 2.05%, to 26,269.89, the S&P 500 gained 42.05 points, or 1.36%, to 3,122.87 and the Nasdaq Composite added 74.54 points, or 0.78%, to 9,682.91.",2020-06-04T01:35:07Z
"If we focus on our long-term future, it's clear investment in higher education is crucial","Some of our higher education institutions may be on the brink of collapse. A decade of austerity, reduced State support relative to student numbers, and ageing capital stock has made some of them financially vulnerable. And now Covid-19 may push them over the…",2020-06-04T01:30:00Z
Ruhnn Holding Limited (RUHN) CEO Lei Sun on Q4 2020 Results - Earnings Call Transcript,"Ruhnn Holding Limited (NASDAQ:RUHN) Q4 2020 Earnings Conference Call June 3, 2020 08:00 ET Company Participants Sterling Song - Investor Relations Lei Sun - Fou",2020-06-04T01:24:07Z
"Internet of Things Insurance Market 2020 research studies increasing demands, latest trend, future scope, growth opportunities and challenges with future estimation | COVID-19 effect analysis - WhaTech Technology and Markets News","Allied Market Research published a new report, titled, \""Internet of Things Insurance Market\"" The report offers an extensive analysis of key growth strategies, drivers, opportunities, key segment, Porter's Five Forces analysis, and competitive landscape. Thi…",2020-06-03T22:31:28Z
Athene: The Dislocation In The Financial Industry Has Exposed A Secret Gem For Investors To Find,The large drop in the financial sector has taken down some undeserving companies. Athene may see a boost in deposits as investors look for a safe place to store,2020-06-03T21:56:35Z
Dow Notches Third-Straight Win as Bets on Faster Economic Recovery Continue - Investing.com,"<ol><li>Dow Notches Third-Straight Win as Bets on Faster Economic Recovery Continue  Investing.com
</li><li>Even Stock Optimists Grow Nervous About Rally  Yahoo Canada Finance
</li><li>S&P 500 opens above 3,100 points, DJIA gains nearly 1%  FXStreet
</li><…",2020-06-03T20:03:00Z
Wall Street surges on signs of economic rebound,"By Stephen Culp NEW YORK (Reuters) - Wall Street jumped in a broad rally on Wednesday, closing ground on all-time highs as signs of recovery from mandated economic shutdowns helped investors look beyond ongoing social unrest and pandemic woes. Financials, ind…",2020-06-03T19:37:37Z
"Palo Alto Networks Inc (PANW) CEO Nikesh Arora at Robert W. Baird Global Consumer, Technology & Services Conference 2020 (Transcript)","Palo Alto Networks Inc (NYSE:PANW) Robert W. Baird Global Consumer, Technology & Services Conference 2020 June 2, 2020 03:45 PM ET Company Participants Nike",2020-06-03T19:32:07Z
Kingsoft Cloud Holdings' (KC) CEO Yulin Wang on Q1 2020 Results - Earnings Call Transcript,"Kingsoft Cloud Holdings Limited (NASDAQ:KC) Q1 2020 Earnings Conference Call June 03, 2020 8:00 AM ET Company Participants Nicole Shan – Investor Relations Yuli",2020-06-03T18:30:43Z
"Canaccord Genuity Group, Inc. (CCORF) CEO Dan Daviau on Q4 2020 Results - Earnings Call Transcript","Canaccord Genuity Group, Inc. (OTCPK:CCORF) Q4 2020 Earnings Conference Call June 3, 2020, 8:00 AM ET Company Participants Dan Daviau - President and Chief Exec",2020-06-03T17:28:05Z
6 ETFs to Buy for June,These ETFs should make a winning portfolio for June.,2020-06-03T17:00:05Z
Disinfectant Spray Market Assessment and Outlook to 2027: Impact Assessment of COVID-19 - ResearchAndMarkets.com,"DUBLIN--(BUSINESS WIRE)--The ""Disinfectant Spray - Global Market Outlook (2018-2027)"" report has been added to ResearchAndMarkets.com's offering. The Global Disinfectant Spray market accounted for $654.05 million in 2018 and is expected to reach $2,487.32 mil…",2020-06-03T16:24:39Z
"Exelon Corporation: Strong, Defensive, But Unexciting","Though Exelon Corporation has a robust balance sheet, its profitability ratios are way lower than the profitability of other companies in its sector. The compan",2020-06-03T16:16:59Z
APPEN - AI Driven High Quality Growth Stock Trading At A Fair Price,Exposure to strong secular growth in a nascent AI/Machine Learning industry. Track record of growth and highly cash generative business model. No material impac,2020-06-03T15:19:40Z
CANADA STOCKS-TSX hits 3-month high on recovery hopes; BoC stands pat,"Canada's main stock index clinched a new
three-month high on Wednesday on optimism over reopening of
global economies, while the country's central bank held interest
rates unchanged as expected.",2020-06-03T14:46:40Z
JPMorgan Chase: COVID-19 Will Have A Short-Term Impact,JPMorgan Chase is the largest U.S. bank by assets. The impact of COVID-19 will be a short-term issue for this financial colossus. It currently trades at a 21% d,2020-06-03T14:18:37Z
NIO: Can Almost See The Turning Point,The new EV subsidy extension is a breeze to NIO. The recent earnings call suggests a potential turn with its financial in 2020. NIO's service-focused sales stra,2020-06-03T14:18:24Z
Toll Brothers Earnings Show a Housing Rebound Could Be Underway,Some early shoots of growth are starting to reveal themselves for the housing sector.,2020-06-03T13:45:00Z
India has potential to lead growth in a post-Covid world: Murarka,‘Invest in businesses which are leaders across sectors.’,2020-06-03T13:44:09Z
Zooming Up: Rising Rates Could Help Financials As Reopening Optimism Continues,"There’s growing optimism that the economy can recover from the pandemic and civil unrest, and we’re seeing that today in rising bond yields. People are selling the safety of bonds and VIX is starting to flirt with 25.",2020-06-03T13:31:30Z
"""The Disconnect Is Getting Wider And Wider"": Futures Storm Higher As America Burns For 8th Night","""The Disconnect Is Getting Wider And Wider"": Futures Storm Higher As America Burns For 8th Night

 Tyler Durden
 
Wed, 06/03/2020 - 08:10

 
""The disconnect between what the average person sees happening in the world and what they see happening in the financi…",2020-06-03T12:10:28Z
Medallia Inc (MDLA) Q1 2021 Earnings Call Transcript,"MDLA earnings call for the period ending March 31, 2020.",2020-06-03T10:30:43Z
Don't Let Already Failing Companies Monopolize Vital Economic Resources,"Robert Earle, Jung Park, Karl Schmedders
economy, 
 
Governments are all deciding which struggling companies to help out in the COVID-19 pandemic

Governments are all deciding which struggling companies to help out in the COVID-19 pandemic. Among the many loo…",2020-06-03T09:15:00Z
U.S.-China Trade Tensions Resurface As Lockdowns Lift,"As the outbreak appears to be passing its peak and governments are focusing on returning to normalcy and gradually re-opening their economies, attention has onc",2020-06-03T09:12:47Z
"Banks, financials pushing the market higher; should you trust the rally?","There is not much hope for the banking and financial stocks or for the market, for that matter, unless the COVID-19 comes under control and the economy opens completely.",2020-06-03T08:44:52Z
Basant Maheshwari advises investors to look at âAtmanirbharâ companies,"When Coronavirus hit us, investors moved from financials and took shelter in defensive names such as FMCG as well as pharma stocks.",2020-06-03T06:52:20Z
"Back at 10,000 in 46 sessions! Nifty rally is getting a push from all sides","Most index components contributed to the ongoing rally, except for one - SBI.",2020-06-03T06:50:46Z
This market momentum is quite strong: Kotak AMC,‘We expect larger private banks to handle asset quality issues much better’,2020-06-03T06:14:14Z
"Medallia, Inc. (MDLA) CEO Leslie Stretch on Q1 2021 Results - Earnings Call Transcript","Medallia, Inc. (NYSE:MDLA) Q1 2021 Earnings Conference Call June 2, 2020 4:30 PM ET Company Participants Leslie Stretch - Chief Executive Officer Roxanne Oulman",2020-06-03T04:48:08Z
Why This Key Indicator Bodes Well for O’Reilly Automotive,The auto parts retailer will continue benefiting from secular tailwinds even after COVID-19.,2020-06-02T20:57:00Z
7 High-Dividend Stocks With Durable Distributions,The market's violent rebound since the March 23 lows has been a welcome relief for long-term shareholders and a boon for dip buyers. But one group of investors has actually been put out by the rally: income investors looking to put dry powder to work in high-…,2020-06-02T20:00:42Z
"Market Extra: Stock-market investors are eager to rotate into unloved sectors, but they should look before they leap","Sectors of the economy left behind as the COVID-19 pandemic shut down the economy are showing signs of life, but investors should proceed with caution, says one top fund manager.",2020-06-02T18:29:13Z
Edited Transcript of MSI.TO earnings conference call or presentation 11-Mar-20 2:00pm GMT,Q4 2019 Morneau Shepell Inc Earnings Call,2020-06-02T17:45:34Z
"Marathon Petroleum: Maybe, Maybe Not",Marathon Petroleum's first-quarter revenues were $24.08 billion compared to $28.60 billion the same quarter a year ago. The retail segment saved the day with op,2020-06-02T16:59:17Z
Closed-End Funds: Eaton Vance's Leveraged Equity Funds Overview,"Eaton Vance has three funds that they describe as equity/hybrid funds, they are largely invested in equity positions. Two of these funds focus on global assets,",2020-06-02T16:08:23Z
Closed-End Funds: Eaton Vance's Leveraged Equity Funds Overview,"Eaton Vance has three funds that they describe as equity/hybrid funds, they are largely invested in equity positions. Two of these funds focus on global assets,",2020-06-02T16:08:23Z
Eltek Ltd. (ELTK) CEO Eli Yaffe on Q1 2020 Results - Earnings Call Transcript,"Eltek Ltd. (NASDAQ:ELTK) Q1 2020 Results Conference Call June 2, 2020 8:30 AM ET Company Participants Eli Yaffe - Chief Executive Officer Alon Mualem - Chief Fi",2020-06-02T16:04:06Z
"Perceptron, Inc. (PRCP) Interim CEO Jay Freeland on Q3 2020 Results - Earnings Call Transcript","Perceptron, Inc. (NASDAQ:PRCP) Q3 2020 Results Earnings Conference Call June 2, 2020, 08:30 AM ET Company Participants Jay Freeland - Interim Chief Executive Of",2020-06-02T15:29:06Z
"SP 500, Dow scale fresh three-month peaks","Some of the worst-hit stocks in the travel sector, including American Airlines Group Inc, United Airlines, Norwegian Cruise Line and Carnival Corp, rose between 1.5 percent and 2.7 percent.",2020-06-02T15:13:03Z
"Forget IQVIA, Veeva Systems Is a Better Growth Stock",Here’s why Veeva Systems is the better choice for investors looking for exposure to companies performing clinical trial analytics.,2020-06-02T14:58:11Z
'Manappuram & Bajaj Finance good long-term bets',‘Do not take a top down approach at the market at current levels’,2020-06-02T14:02:09Z
"Stocks edge higher as investors focus on economy, ignore urban unrest","The stock market looks to extend recent gains, decoupling from the outside world where the rioting and social unrest that has swept across American cities threat",2020-06-02T14:00:45Z
"Wall Street’s Focus Remains On Economic Reopening Instead Of Unrest, China Worries","This morning, oil prices and equity index futures were higher as traders and investors looked past civil unrest to continue focusing on the economic recovery.",2020-06-02T13:59:13Z
S&P 500 Dashboard For June,"A score in value, quality and momentum for every sector. Evolution since last month. The best and the worst sectors for these metrics.",2020-06-02T13:56:02Z
Does value investing still work in a post-Covid world?,‘We have churned about 15% of our investment portfolio’,2020-06-02T13:11:55Z
Micron's 40% Equipment Spend Cut - Whom It Will Hurt Most?,"Micron Technology's recent pre-earnings guidance was hailed as an indication that despite COVID-19, the memory market is set for recovery. Micron's planned 40%",2020-06-02T12:23:32Z
Attack of zombie companies: don't let them eat bailouts that are vital to restore the economy,"They stumble around, baying for assistance, hoping to drink the lifeblood of other companies' financial aid.",2020-06-02T12:22:08Z
"Hospitals managing without price hike despite cost pressure, says industry","Claims revenue from regular operations impacted by Covid-19, is down 60-80%",2020-06-02T12:19:00Z
Shorts Looted As Global Markets Hit 3-Month High After Nationwide Riots Turn Deadly,"Shorts Looted As Global Markets Hit 3-Month High After Nationwide Riots Turn Deadly

 Tyler Durden
 
Tue, 06/02/2020 - 08:03

 The Fed's ""administered market"" just refuses to stop.


Global stocks and S&P futures rose to three-month highs as central banks lo…",2020-06-02T12:03:00Z
Investments in Indian start-ups plunge 57per cent in May,"KhataBook, Lendingkart among top-funded companies",2020-06-02T10:54:13Z
Edited Transcript of ENT earnings conference call or presentation 19-Mar-20 12:00pm GMT,Q4 2019 Global Eagle Entertainment Inc Earnings Call,2020-06-02T09:23:49Z
"Nifty marches towards 10,000, Sensex jumps 500 pts; 5 factors aid rally","Experts feel the rally is expected to continue given the momentum, and Nifty may surpass 10,000 soon.",2020-06-02T09:10:05Z
#39;Current valuations offer attractive long-term entry points in mid smallcaps#39;,The biggest risk to market sentiment emanates from geopolitical developments in relation to China.,2020-06-02T08:40:38Z
"Auto, pharma and bank stocks IIFL’s Abhimanyu Sofat is bullish on",‘Commercial vehicles will probably take more time to recover’,2020-06-02T06:55:50Z
"Buy KEC International, target price Rs 260: ICICI Securities","The brokerage expects the company’s healthy order book, stable traction from railways and focus on debt reduction to support earnings CAGR of 3.6 per cent during FY20-FY22E.",2020-06-02T05:23:09Z
Edited Transcript of SBRA earnings conference call or presentation 7-May-20 5:00pm GMT,Q1 2020 Sabra Health Care REIT Inc Earnings Call,2020-06-02T03:45:36Z
Edited Transcript of MNTX earnings conference call or presentation 7-May-20 8:30pm GMT,Q1 2020 Manitex International Inc Earnings Call,2020-06-02T03:05:37Z
Edited Transcript of SO earnings conference call or presentation 30-Apr-20 5:00pm GMT,Q1 2020 Southern Co Earnings Call,2020-06-02T02:58:37Z
"California Faces ""Financial Collapse"" As It Moves To Allow Businesses To Walk Away From Commercial Leases","California Faces ""Financial Collapse"" As It Moves To Allow Businesses To Walk Away From Commercial Leases

 Tyler Durden
 
Mon, 06/01/2020 - 21:54

 One of the bedrocks of modern US capitalism - which is now mutating by the day if not hour as the Fed scramble…",2020-06-02T01:54:19Z
Thermon Group Holdings Inc (THR) Q4 2020 Earnings Call Transcript,"THR earnings call for the period ending March 31, 2020.",2020-06-02T00:30:25Z
Singapore Telecommunications: New To My Portfolio,"Last quarter saw a 65% drop in profits, but it is more to the story than just that. The company's large footprint, diverse businesses, and solid balance sheet w",2020-06-01T20:47:14Z
XLF: Time For Financial Sector To Catch Up,SPDR Financial Sector ETF has drastically underperformed broader market in 2020 on weak earnings and plummeting interest rates. The banking sector is not facing,2020-06-01T20:46:35Z
Piraeus Bank S.A. (BPIRY) CEO Christos Megalou on Q1 2020 Results - Earnings Call Transcript,"Start Time: 11:00 End Time: 11:43 Piraeus Bank S.A. (OTCPK:BPIRY) Q1 2020 Earnings Conference Call June 01, 2020, 11:00 AM ET Company Participants Christos Mega",2020-06-01T20:40:03Z
Thermon Group Holdings (THR) CEO Bruce Thames on Q4 2020 Results - Earnings Call Transcript,"Thermon Group Holdings (NYSE:THR) Q4 2020 Earnings Conference Call June 1, 2020 11:00 ET Company Participants Kevin Fox - Vice President, Corporate Development",2020-06-01T20:06:05Z
