Ashtead Group plc (ASHTF) CEO Brendan Horgan on Q4 2020 Results - Earnings Call Transcript,"Ashtead Group plc (OTCPK:ASHTF) Q4 2020 Earnings Conference Call June 16, 2020 6:00 A.M. ET Company Participants Brendan Horgan - Chief Executive Officer Michae",2020-06-16T17:45:44Z
Bfsi Security Market to Witness a Healthy Growth during 2016 – 2024 - 3rd Watch News,"In past one decade, electronic banking platforms have been implemented as an ever more efficient channel through which banking transactions can be executed without having to leave house or office. These home banking transactions are done from web based applic…",2020-06-16T17:06:00Z
Understanding What Asset Allocation Really Means,"Many investors see the word ""balance"" and assume that asset allocation automatically leads to diversification. That could be true, but not always.",2020-06-16T12:30:00Z
East Daley Capital Launches New Solution to Channel Check Midstream Energy Companies,"CENTENNIAL, Colo.--(BUSINESS WIRE)-- #bakken--The Capital Markets solution provides an unbiased, third party perspective including insights down to the asset-level on company performance.",2020-06-16T11:05:10Z
3 Elephant-Sized Deals Buffett Should Consider,Warren Buffett's company has $137 billion in cash -- here's how he could put some of it to work.,2020-06-16T10:06:00Z
"Hold Mastek, target price Rs 370: ICICI Direct",Cost rationalisation and higher margins at Evosys is expected to gradually drive margins upwards.,2020-06-16T08:12:18Z
Edited Transcript of LUN.CO earnings conference call or presentation 12-May-20 11:00am GMT,Q1 2020 H Lundbeck A/S Earnings Call,2020-06-16T05:03:37Z
What to buy in 2020? Here are 7 stocks from sectors that usually do well in bear market,"Historically, stocks from sectors such as consumption and IT generally bounce back, but 2020 could be different",2020-06-16T04:54:47Z
"Stocks in the news: Tata Motors, Lakshmi Vilas Bank, RIL, HPCL, IndiGo and JK Tyre",The housing finance arm of Canara Bankreported a 35.84 per cent rise in its net profit to Rs 90.91 crore for the March 2020 quarter,2020-06-16T02:13:33Z
Watch live: Half our DHBs should be scrapped - major report,"A ""once-in-a-generation"" report into New Zealand's health sector has recommended a significant overhaul of the country's district health board system and the creation of new health agencies. 

The report ...",2020-06-15T22:15:27Z
Signs That Bristol Myers Squibb Can Finally Break Cycle Of Under-Performance,Bristol Myers Squibb stock has provided a poor return for investors over the past 5 years but there are signs its $76bn acquisition of Celgene has sparked a rev,2020-06-15T21:57:48Z
Creating Software-First Businesses Using SDM,"Organizations striving to be “software-first” businesses are focusing their investments narrowly – on creating the best development and deployment practices they can. They’re implementing DevOps cultures, standing up CI/CD pipelines, integrating new sets of t…",2020-06-15T17:45:56Z
Closed-End Funds: 2 Global Covered Call Funds Worth Considering,"International securities have underperformed for over the last decade, this could be a potential place to look for a reversal. IGA and BOE are both attractive o",2020-06-15T17:14:47Z
Closed-End Funds: 2 Global Covered Call Funds Worth Considering,"International securities have underperformed for over the last decade, this could be a potential place to look for a reversal. IGA and BOE are both attractive o",2020-06-15T17:14:47Z
"Colony Capital: Preferred Shares Yield 10%, Offer 30% Upside",Colony Capital has assets in areas that have been hit very hard by the pandemic. The common shares do have a margin of safety due to underlying asset values and,2020-06-15T17:05:31Z
"Royal Bank Of Canada: Pressure Ahead, But Still A Solid Financial Institution","Royal Bank of Canada has seen a significant revenue drop for its Capital Markets segment. However, the bank continues to manage its credit risk effectively. For",2020-06-15T15:44:44Z
Bank On The Best: JPMorgan Chase,"Whether the recovery is L shaped, U shaped, or V shaped, we expect JPMorgan’s profits to rebound over the long term. Unlike the 2008 Financial Crisis, in which",2020-06-15T15:16:12Z
Top-Ranked Beaten Down ETFs to Buy Now,"Given the sharp decline in the stock market last week, investors should take advantage of the beaten-down prices.",2020-06-15T15:10:03Z
"Goldman Sachs: Trading At 13% Discount To Book Value, 20% Discount To Fair Value After Brutal Week For Financials","Book value for the brokerage giant is $228 per share. Goodwill was either reclassified (buried), or impaired but no goodwill appears on the Goldman balance shee",2020-06-15T14:23:03Z
"Contrarian Approach To The Stock Market, Analyzing Well-Known Indicators For A Bear Market Case","Reviewing well-known chart technical, buffet, Shiller P/E, momentum, market sentiment indicators to support strong long-term bearish positions. The contrarian a",2020-06-15T13:37:54Z
"Contrarian Approach To The Stock Market, Analyzing Well Known Indicators For A Bear Market Case","Reviewing well-known chart technical, buffet, Shiller P/E, momentum, market sentiment indicators to support strong long-term bearish positions. The contrarian a",2020-06-15T13:37:54Z
First US Bancshares: Investing In A Lagger Among Laggards,"First US Bancshares has low valuations versus peers, the market, and its own historic averages. The stock has lagged the banking sector, which in turn has lagge",2020-06-15T13:23:49Z
We are open to strategic partners for some of the new businesses: M&M,‘I would put the tractor business between revival and growth.’,2020-06-15T13:00:56Z
Roper Technologies Stock -- the Berkshire Hathaway of the Industrial Sector,The industrial company operates an unusual but highly successful business model that has elements in common with Warren Buffett's strategy.,2020-06-15T12:42:47Z
"""Just A Huge Bear Market Rally?"" Stocks Tumble On Fears Of Second Virus Wave","""Just A Huge Bear Market Rally?"" Stocks Tumble On Fears Of Second Virus Wave

 Tyler Durden
 
Mon, 06/15/2020 - 08:03

 In a continuation of the selloff that started overnight, US equity futures and world stocks are plunging on Monday on signs that a second w…",2020-06-15T12:03:44Z
"Jindal Stainless' CDR exit enabled business sustenance during Covid crisis: CFO, Anurag Mantri","""As per the CDR signed, any further delay would have diluted our company shares to lenders. We were able to finance almost Rs 400 crores of CDR using our internal accruals, and rest with Kotak's investment. Our debt in March FY20 stands around Rs 3,655 crores…",2020-06-15T11:00:56Z
"3 REITs That Could Cut Their Dividends, And We're Still Buying","In this article, I plan to provide a detailed analysis of these three REITs in order to determine the probability of a dividend cut. I own all three REITs and I",2020-06-15T11:00:00Z
3 Sustainable Dividend Stocks That Pay More Than 3%,These Dividend Aristocrats have incredible track records of not just paying but increasing their dividend payments.,2020-06-15T10:16:00Z
Five key factors that dragged the equity market lower on Monday,A sharp jump in coronavirus (Covid-19) cases in India weighed on investor sentiment.,2020-06-15T07:34:39Z
Fundamentals will dominate market movement: Mirae,‘Liquidity cannot always take the market higher; eventually earnings have to follow through’,2020-06-15T06:50:39Z
"Your risk appetite may have changed, so revisit goals: I.V. Subramaniam, Quantum AMC","Economic recovery is unlikely to be quick. Investors should be clear about their capacity to save and what their goals are before they jump into the market, says I.V. Subramaniam, MD & CIO, Quantum Advisors, Director, Quantum AMC, tells ET Wealth.",2020-06-15T01:00:00Z
Dynatrace: Anticipating More Volatility,Dynatrace is benefiting from the rising tide that is propelling the valuation of cloud stocks. Its large enterprise focus has the potential to trigger liquidity,2020-06-14T20:36:17Z
Wall St Week Ahead-Investors bet bounce in value stocks will stick,"As the U.S. economy begins to
emerge from the sharp slowdown during the coronavirus pandemic,
some fund managers have been drawn to value stocks, a sector
that underperformed during the recent rally.",2020-06-14T13:00:00Z
Wall St Week Ahead-Investors bet bounce in value stocks will stick,"As the U.S. economy begins to emerge from the sharp slowdown during the coronavirus pandemic, some fund managers have been drawn to value stocks, a sector that underperformed during the recent rally.",2020-06-14T13:00:00Z
"We have the resources to tide over this crisis, says Kavinder Singh of Mahindra Holidays and Resorts",Our business model ensures predictability of various annuity income streams: Mahindra Holidays CEO,2020-06-14T12:54:08Z
U.S. IPO Weekly Recap: Vroom Soars In Another 8-IPO Week,"Eight IPOs and one SPAC entered the public markets this past week led by Vroom, which popped 118% in the best first day for a tech IPO since 2018. Every IPO thi",2020-06-14T10:35:28Z
"âPharma, gold loan firms among 6 themes where there is money making opportunityâ","We see opportunities with select consumer staples, large IT players, the strongest banks, life insurance companies, and a few names in the pharma sector including the MNCâs and gold loan companies.",2020-06-14T07:21:34Z
Adopt Modified Call Butterfly strategy for Bank Nifty: Shubham Agarwal,Modified Call Butterfly is a 4-legged strategy where 1 lot of Call close to current underlying level is bought against that 2 lots of higher strike calls are sold and 1 more lot of Call is bought but closer to the call sold strike.,2020-06-14T07:08:32Z
COVID-19 may result in job losses in dealerships worse than last year's auto sector slowdown: FADA,"Automobile dealers' body FADA fears that the coronavirus pandemic could result in job losses in dealerships which could be worse than what was experienced last year when over two lakh jobs were lost due to a prolonged slowdown in the automobile industry, acco…",2020-06-14T07:03:06Z
"This construction stock with strong order book, lean balance sheet can give 25-55% returns","KNR Constructions#39; EBITDA margin was surprising positive at 21.7 percent, primarily due to stronger execution and rising share of higher-margin irrigation segment in the revenue mix.",2020-06-14T05:54:46Z
Weighing The Week(s) Ahead: Can Investors Depend On The Rebound Trend?,"The normal economic calendar has some useful reports, but it will not be the focus for analysts. Everyone with media exposure confidently explains what just hap",2020-06-14T04:48:35Z
Market Week Ahead: 10 key factors that will keep traders busy,"Investors remain concerned about the COVID-19 risk. Hence, experts feel there could be a consolidation in the coming weeks.",2020-06-14T02:45:53Z
QTS Realty Trust: Data Center Tech Dividends And High-Yield Options Trades,"QTS pays dividends on its common and on two preferred shares, yielding from 3% to 6.6%. Data center REITs have shown more resilience vs. the market in 2020. Val",2020-06-13T13:15:00Z
This week in Auto: First green shoots appear in the two-wheeler industry,Here are all the important headlines of the week from the auto space,2020-06-13T10:24:40Z
Wall Street Week Ahead: Investors bet bounce in value stocks will stick,"Value stocks, which typically sport lower price-to-earnings valuations, tended to underperform growth stocks during the bull market that ran for more than a decade and ended this year.",2020-06-13T08:22:10Z
A second wave or an extended lockdown will be disastrous for India: Umesh Mehta,"Indiaâs cases are already on a rise with no sign of peaking. But, since businesses are gradually opening up, the expectation is that earnings should normalise in two quarters at least for a few sectors.",2020-06-13T07:15:56Z
Small mid-caps shine in a volatile week; over 30 stocks rose 10-70% in a week,"We are still in a bear market rally, and investors should not be carried away with the intermediate rallies seen in D-Street as we might retest lower levels again.",2020-06-13T03:58:13Z
"#39;Pharma looks attractive, but auto sector may turn out to be the dark horse#39;","The sector to watch still remains pharma. The valuation is still way off the valuations the sector governed even around 5 years back, thus creating an upward space.",2020-06-13T02:47:50Z
Edited Transcript of SEE earnings conference call or presentation 5-May-20 2:00pm GMT,Q1 2020 Sealed Air Corp Earnings Call,2020-06-13T02:22:36Z
Bitauto Holdings Limited (BITA) Q1 2020 Earnings Call Transcript,"BITA earnings call for the period ending March 31, 2020.",2020-06-12T22:00:39Z
Stocks bounce but close the week with losses,"Stocks closed higher in a choppy session where the Dow Jones index swung nearly 900 points from gains to losses and back to gains again: Dow +1.9%, S&P 500 +",2020-06-12T20:35:12Z
5 Sickly S&P 500 Stocks to Sell or Avoid,"The stock market has been remarkably resilient this year amid the pandemic and recession. But the Dow's massive 1,800-point plunge on June 11 should serve as a reminder that equities remain risky.And some are much riskier than others.Every investor wants to b…",2020-06-12T18:38:26Z
The Top Stocks To Buy On A Crash,Growing volatility creates opportunities in the best stocks and sectors. Healthcare and technology remain top sectors to buy. Here are the best stocks to buy in,2020-06-12T18:36:19Z
Bitauto Holdings Ltd (BITA) CEO Andy Zhang on Q1 2020 Results - Earnings Call Transcript,"Bitauto Holdings Ltd (NYSE:BITA) Q1 2020 Results Earnings Conference Call June 12, 2020 8:00 AM ET Company Participants Andy Zhang - Chief Executive Officer and",2020-06-12T17:42:09Z
Wall Street Cuts Gains on Lingering Covid Concerns - Investing.com,"<ol><li>Wall Street Cuts Gains on Lingering Covid Concerns  Investing.com
</li><li>Dow drops 1,800 points — its worst day since March — as U.S. coronavirus cases rise  Globalnews.ca
</li><li>U.S. Futures Point to Rebound After Worst Slump Since March  Yahoo…",2020-06-12T17:31:00Z
Picking Through The Carnage,"The S&P 500 took its biggest hit since March. The worst performers were travel, energy and financial stocks. Stay at home stocks held the price against market m",2020-06-12T16:51:06Z
Investors hope for stability after busy months for Boohoo,"There will perhaps be little actual detail as Boohoo updates shareholders on how it did in the fist quarter, but eyes are likely to be fixed on the online retailer after weeks of turbulent news.",2020-06-12T15:16:44Z
Assessing the Resiliency of Non-DFAST Banks to a Financial Shock,The Federal Reserve Board of Governors in Washington DC.,2020-06-12T14:00:00Z
Market Looks To Regain Ground After Coronavirus Resurgence Fears Drag It Down,"Although the market is attempting to bounce from yesterday’s marked selloff, participants still seem jittery about the potential for a coronavirus resurgence.",2020-06-12T13:47:40Z
Futures Soar In Sharp Rebound From Thursday's Massacre,"Futures Soar In Sharp Rebound From Thursday's Massacre

 Tyler Durden
 
Fri, 06/12/2020 - 07:47

 After the worst market rout since the March crash, which saw the S&P plunge almost 6% on Thursday, U.S. stock index futures surged about 2% on Friday along with …",2020-06-12T11:47:10Z
"CWS Market Review – June 12, 2020",”We’re not even thinking about thinking about raising rates.” – Fed Chairman Jerome Powell Last week’s issue of CWS Market Review was unusually prophetic. I […],2020-06-12T11:08:27Z
Zimbabwe: Padenga Holdings Looks to Mining for Revenue Growth,"[Zimbabwe Independent] Crocodile skin producer Padenga Holdings Limited has seen the contribution of its mining operation coming in at US$37,92 million in full-year 2020 with total revenue expected to improve by 158,9% from US$29,12 million to US$75,41 millio…",2020-06-12T10:57:29Z
This N.J. man took his own life during the pandemic. Is coronavirus making the mental health crisis worse?,"Emil Choski was a gifted artist, musician and computer programmer. But the coronavirus pandemic resulted in devastating consequences.",2020-06-12T10:46:40Z
When Less Bad Is Good,"While the labour market is still feeling the pain from the initial shock as many workers remain underutilized, last month's improvement moved forward the expect",2020-06-12T10:26:25Z
Wall Street Week Ahead: Investors bet bounce in value stocks will stick,"As the U.S. economy begins to emerge from the sharp slowdown during the coronavirus pandemic, some fund managers have been drawn to value stocks, a sector that underperformed during the recent rally. Value stocks, which typically sport lower price-to-earnings…",2020-06-12T09:24:13Z
Wall Street Week Ahead: Investors bet bounce in value stocks will stick,"As the U.S. economy begins to emerge from the sharp slowdown during the coronavirus pandemic, some fund managers have been drawn to value stocks, a sector that underperformed during the recent rally.",2020-06-12T09:24:13Z
Wall St Week Ahead: Investors bet bounce in value stocks will stick,"As the U.S. economy begins to emerge from the sharp slowdown during the coronavirus pandemic, some fund managers have been drawn to value stocks, a sector that underperformed during the recent rally.",2020-06-12T09:05:26Z
Wall St Week Ahead: Investors bet bounce in value stocks will stick,"As the U.S. economy begins to emerge from the sharp slowdown during the coronavirus pandemic, some fund managers have been drawn to value stocks, a sector that underperformed during the recent rally.",2020-06-12T09:02:58Z
Wall St Week Ahead: Investors bet bounce in value stocks will stick,"As the U.S. economy begins to emerge from the sharp slowdown during the coronavirus pandemic, some fund managers have been drawn to value stocks, a sector that underperformed during the recent rally. Value stocks, which typically sport lower price-to-earnings…",2020-06-12T09:02:58Z
Wall St Week Ahead: Investors bet bounce in value stocks will stick,"As the U.S. economy begins to emerge from the sharp slowdown during the coronavirus pandemic, some fund managers have been drawn to value stocks, a sector that underperformed during the recent rally.",2020-06-12T09:02:58Z
"#39;Escorts, Ashok Leyland, Hero Moto top picks in auto space with 2-year horizon#39;","When the full lockdown opens, we should see some activity coming back for airlines, auto, 2-wheelers, retail, cement, metals.",2020-06-12T07:55:10Z
Not a rich deal! Woes spilled over for most PMS alpha chasers in May,"With a 3.62% return, ICICI Prudential Largecap Portfolio emerged as the top gainer in May.",2020-06-12T05:57:54Z
"This Rs 55,000 crore fund manager says hype did lot of harm to Modi stimulus","The stimulus did not have much of an impact on the government fiscal, said he.",2020-06-12T05:34:24Z
The winners and losers in Ireland's top 1000 companies,Top 1000: Ireland’s biggest companies face major challenges,2020-06-12T05:30:14Z
How are the business heavyweights faring and who has topped the table?,Top 1000: Ireland’s biggest companies face major challenges,2020-06-12T05:30:14Z
Edited Transcript of BACT.L earnings conference call or presentation 11-Jun-20 10:59am GMT,Full Year 2020 Syncona Ltd Earnings Call,2020-06-12T04:58:53Z
"Financials under pressure; RBL, IndusInd, Bandhan Bank slip over 5%","Nifty Bank, Nifty Private Bank, Nifty PSU Bank and Nifty Financial Services indexes were down in the range of 3 per cent to 4 per cent",2020-06-12T04:23:20Z
A Look At The Solar Sector And Some Top Solar Companies,"On average, solar is now one of the cheapest sources of electricity globally. Global Solar PV is set to more than double in capacity in the next five years, led",2020-06-12T02:16:09Z
Hilltop Holdings: Get Ready To Jump On The Bandwagon,The firm's diversified business model and consistent earning capabilities make it a reliable financial stock. Hilltop will most likely retain capital thanks to,2020-06-12T00:17:50Z
Wall Street Close: Second wave fears send benchmarks plummeting,We witnessed some of the worst performances from US benchmarks on Thursday as the new cases of COVID-19 in the US are seen as weighing on the camels b,2020-06-11T21:11:50Z
Deep Dive: These U.S. stocks paced the market’s brutal decline Thursday,Many of the troubled companies that had been leading the recovery got crushedMany of the troubled companies that had been leading the recovery got crushed.,2020-06-11T21:06:47Z
COVID Caution: New Surge Of Cases In Reopened States Sparks Worst Selloff Since March,"Cautious mood continues with Financials getting hit hard today mostly because of low interest rates and dovish comments from the Fed. The Energy sector led all sectors lower, falling nearly 9.5%.",2020-06-11T20:44:17Z
Perdoceo Education: Riding The Online Wave,"Online education is becoming increasingly common as individuals seek to further their education remotely. Perdoceo, a recession resistant stock, is attractive i",2020-06-11T19:49:11Z
Jiayin Group Inc. (JFIN) CEO Dinggui Yan on Q1 2020 Results - Earnings Call Transcript,"Jiayin Group Inc. (NASDAQ:JFIN) Q1 2020 Results Conference Call June 11, 2020 8:00 AM ET Company Participants Julia Qian - Managing Director-The Blueshirt Group",2020-06-11T19:06:07Z
Jiayin Group Inc. (JFIN) Q1 2020 Earnings Call Transcript,"JFIN earnings call for the period ending March 31, 2020.",2020-06-11T18:30:51Z
"Hexo (HEXO) CEO, Sebastien St-Louis on Q3 2020 Results - Earnings Call Transcript","Hexo Corporation (NYSE:HEXO) Q3 2020 Earnings Conference Call June 11, 2020 8:30 am ET Company Participants Sebastien St-Louis - Chief Executive Officer Steve B",2020-06-11T18:10:44Z
HEXO Corp. (HEXO) Q3 2020 Earnings Call Transcript,"HEXO earnings call for the period ending April 30, 2020.",2020-06-11T18:00:39Z
WeedMD Inc. (WDDMF) CEO Angelo Tsebelis on Q4 2019 Results - Earnings Call Transcript,"WeedMD Inc. (OTCPK:WDDMF) Q4 2019 Earnings Conference Call June 11, 2020, 10:00 AM ET Company Participants Marianella delaBarrera - VP, Communications and Corpo",2020-06-11T17:44:10Z
The Real Economic Crisis Will Start In Europe And It Will Be Triggered By The Global Recovery,"The EU is not only one of the hardest-hit by the COVID-19 pandemic, but also the weakest, most problematic economy due to pre-crisis problems. The pandemic is n",2020-06-11T17:36:12Z
Expect markets to fluctuate 10-20% this year: Sharma,‘Do not wait for a very deep and big correction to happen’,2020-06-11T14:38:19Z
"After Doubling On Day 1, Vroom IPO Could Rev Higher","Used car seller Vroom went public at $22/share, above the initial expected range of $18-$20. Shares more than doubled on the first day of trading, indicating th",2020-06-11T14:17:28Z
Risk-off day punishes energy and financials the hardest,"Worries about rising COVID-19 infections, the economy, or a wringing out of speculative excess? Pick your excuse, but the averages are all down 2.5% in early act",2020-06-11T13:55:03Z
Bank On The Best: JPMorgan Chase & Company,This best-in-class bank has the balance sheet to survive the COVID-driven economic crisis and is positioned to expand its market share as the economy recovers.,2020-06-11T13:33:08Z
"2020 Insights on the Worldwide Healthcare Analytical Testing Services Industry - Key Drivers, Restraints, Opportunities and Threats","DUBLIN, June 11, 2020 /PRNewswire/ -- The ""Healthcare Analytical Testing Services - Global Market Outlook (2018-2027)"" report has been added to ResearchAndMarkets.com's offering. The Global Healthcare Analytical Testing Services market accounted for $3.82 bil…",2020-06-11T13:30:00Z
"2020 Insights on the Worldwide Healthcare Analytical Testing Services Industry - Key Drivers, Restraints, Opportunities and Threats","The ""Healthcare Analytical Testing Services - Global Market Outlook (2018-2027)"" report has been added to ResearchAndMarkets.com's offering.",2020-06-11T13:30:00Z
"COVID And Caution: Markets Pull Back From Record Run Amid Fed Comments, Uptick In Cases","It’s ugly out there today, and that’s only partly due to the upswing in virus cases in some early opening states. The Fed is also getting some blame, though arguably it’s undeserved. Basically, the Fed didn’t sugarcoat yesterday, and that’s not necessarily a …",2020-06-11T13:25:17Z
"Dorian LPG: Refinancing Complete, Active Repurchase Program, 112% Upside","About a year ago, I called Dorian LPG the cash machine you've never heard about. I reviewed strong market conditions backed by US-Asia arbitrage, with rates app",2020-06-11T13:00:00Z
"S&P Futures, World Stocks Tumble On Dismal Fed Outlook, Second Virus Wave Fears","S&P Futures, World Stocks Tumble On Dismal Fed Outlook, Second Virus Wave Fears

 Tyler Durden
 
Thu, 06/11/2020 - 07:45

 According to analysts, it was one of the most dovish Fed statements in history. It was also not enough to offset the Fed's gloomy and un…",2020-06-11T11:45:30Z
"Sensex tanks 709 points on AGR ruling, Fed's economic outlook",The selloff eroded investor wealth by Rs 2.4 lakh crore on the Indian bourses.,2020-06-11T11:22:32Z
Down but not out: Crisis puts the brakes on fast fashion,"Zara may be slowly reopening their stores but the pandemic has had a devastating financial impact on the fast fashion sector.
The post Down but not out: Crisis puts the brakes on fast fashion appeared first on Inquirer Business.",2020-06-11T11:21:39Z
Short And Sharp: Reflation Rotation,A meaningful improvement in the economic and earnings outlook could take time to develop given the deep hit to the economy in recent months. Just as value outpe,2020-06-11T11:08:50Z
Short And Sharp: Reflation Rotation,A meaningful improvement in the economic and earnings outlook could take time to develop given the deep hit to the economy in recent months. Just as value outpe,2020-06-11T11:08:50Z
