MOGU Inc. (MOGU) CEO Shark Qi Chen on Q4 2020 Results - Earnings Call Transcript,"MOGU Inc. (NYSE:MOGU) Q4 2020 Results Earnings Conference Call May 29, 2020 7:30 AM ET Company Participants Christian Arnell - Investor Relations Shark Qi Chen",2020-06-01T18:36:06Z
A Low Vol ETF’s Big Reshuffle,‘SPLV’ has turned its allocation on its head in a year of firsts.,2020-06-01T18:30:00Z
StoneCo Soars on Earnings; Real Estate Is Making a Comeback,An eventful week in the financial and real estate sectors.,2020-06-01T18:01:00Z
"Spirits In COVID-19: Updates On Diageo, Pernod Ricard, Rémy Cointreau And Brown-Forman","We review recent datapoints on spirits companies, to assess the impact of COVID-19 so far, ahead of trading updates starting next week. Latest Pernod Ricard and",2020-06-01T17:37:54Z
Global stocks climb near three month highs as rebound hopes grow,Investors back belief that Covid-19 economic downturn has bottomed out,2020-06-01T17:32:48Z
An Investment-Led Economic Recovery,There are decades when nothing happens; and there are weeks when decades happen”. The political response to the coronavirus has dramatically proved Lenin to be,2020-06-01T17:31:01Z
Major Indices Still In Green Despite The Nationwide Protests,"The major indices are all trading slightly in the green at midday, despite a bearish start to the week, with the nationwide protests at the...
The post Major Indices Still In Green Despite The Nationwide Protests appeared first on ValueWalk.",2020-06-01T17:06:03Z
Should investors bet on the pent-up demand theme?,‘The reality will come into play in the next two quarters’,2020-06-01T12:22:39Z
3 Points For The Bulls,"On an absolute level, the economic situation and corporate earnings are terrible. New data suggests the rate of change is actually starting to move in a positiv",2020-06-01T11:27:01Z
CBL & Associates Properties: Anytime Mall REIT Apocalypse,"Over the last several weeks, I have walked around Westgate Mall attempting to rationalize the new reality in which the word apocalypse seems appropriate. CBL ex",2020-06-01T11:00:00Z
Discovery Islands’ businesses taking baby steps to reopen,"Restaurants, pubs, businesses, resorts and marinas in the Discovery Islands off the west coast of B.C. are tentatively taking the first steps in expanding services in their communities to locals and tourists alike.",2020-06-01T10:10:13Z
"Overweight on auto sector; Maruti, Eicher top picks: MOSL","‘Our portfolio is tilted towards telecom, IT, BFSI, consumer and pharma stocks’",2020-06-01T09:28:25Z
South-East Asia stocks rise on cautious US response to Hong Kong law,"SINGAPORE: South-East Asian markets rose on Monday (June 1) as US President Donald Trump steered clear of threatening his existing trade deal with China over Hong Kong, while signs of a gradual recovery in China's economy supported sentiment.",2020-06-01T08:23:00Z
"Neutral on Wipro, target price Rs 188: Motilal Oswal","The stock is currently trading at 14 times one-year forward P/E, almost in line with its long-term averages.",2020-06-01T05:40:38Z
These lucky 7 midcaps turned largecaps in the last one year; time to buy?,"There are as many 7 stocks which are now trading with a market capitalisation of more than Rs 20,000 crore that include names like Abbott India, Adani Green, Ipca Lab, Tata Consumer etc.",2020-06-01T04:45:06Z
"Nomura sees Nifty at 10,200 in Mar'21; financials to drag earnings","The lockdown's impact on corporate earnings will be worse than seen during the GFC, according to Nomura",2020-06-01T04:41:00Z
What changed for the market while you were sleeping? Top 10 things to know,Trends on SGX Nifty indicate a gap up opening for the index in India with a 136 points gain.,2020-06-01T02:02:00Z
3 Dividend Facts Every Income Investor Should Know,Dividend stocks provide a reliable source of income. But you still need to do a deep dive into company financials to see if the payouts are safe and sustainable. The post 3 Dividend Facts Every Income Investor Should Know appeared first on The Motley Fool Can…,2020-05-31T18:30:15Z
Market melt-down: How six KiwiSaver managers coped through the Covid-19 crisis,"Sharemarkets plunged in March as the Covid-19 coronavirus spread around the world.

They have since bounced back and are not far off record highs again despite economists predicting a local and global ...",2020-05-31T18:11:25Z
Monolithic Power Systems: A Long-Term Winner Bound To Benefit From 5G,"MPWR is a beneficiary of the 5G rollout in China. The company is overvalued based on a FCFF Model. The company will continue to reap rewards from 5G, IoT, and a",2020-05-31T17:06:49Z
Portfolio Managers Discuss Contrarian Views And Emerging Opportunities,Making headlines this week: The European Union has proposed a massive recovery plan that would include 750 billion euros of commonly issued debt to fund grants,2020-05-31T14:27:53Z
Edited Transcript of SSO.OL earnings conference call or presentation 8-May-20 6:30am GMT,Q1 2020 Scatec Solar ASA Earnings Call,2020-05-31T13:25:25Z
Tech Stocks Offer A Rare Bright Spot For 2020 Sector Returns,US stock market's volatile run in 2020 has left most corners of the equity market with deep losses or mostly flat results this year with one glaring exception:,2020-05-31T12:42:43Z
#39;Price ratio structure of Bank Nifty vs. Nifty indicates outperformance of former in near term#39;,"On P&F chart, BankNifty has reversed after Bear Trap Formation, follow through is seen after Double top pattern.",2020-05-31T09:41:42Z
Farmer Mac: A New 5.75% Preferred Stock IPO Enters The Exchange,"What are the key metrics of the Federal Agricultural Mortgage Corp.'s (Farmer Mac) new preferred stock, AGM-E. Where in the context of all preferred stocks, iss",2020-05-31T05:44:24Z
"Sustainable rally in banking looks tough, but revival can be expected in near term: Gaurav Garg","The June series has started on a positive note but ongoing US-China diplomatic issues, ending of lockdown 4.0, and the India-China border tension may keep the market volatile, CapitalVia Global Research#39;s Gaurav Garg told Moneycontrol.",2020-05-31T03:01:21Z
Market Week Ahead: 10 key factors that will keep traders busy,"On June 1, the market will first react to Q4FY20 GDP data and the lockdown extension.",2020-05-31T02:41:52Z
Creches want €60m in aid for this year,Childcare providers want an extra €60m from the Government to fund the reopening of the sector for the rest of the year while operating under public health guidelines that are likely to severely limit the number of children they can look after.,2020-05-31T01:30:00Z
Why HCL Technologies is a good long-term bet,"Decent pipeline, diversified services mix and promising products business, are key positives",2020-05-30T15:06:04Z
Informative Insider Purchasing Activity - Weekly Update (05/22/20-05/29/20),The S&P 500 keeps going up which makes it harder to find undervalued stocks which will survive the crisis easily. Following insider purchases can help with find,2020-05-30T13:00:00Z
S&P 500 Weekly Update: The 'Bull' Is Alive As Equities Break Out Of The Trading Range,"Financial and Industrials lead the way this week as the rally broadens. Economic data appears to have bottomed, the slow rebound has started. The Long Term Tech",2020-05-30T11:00:00Z
"Bank Of Nova Scotia: Not Business As Usual, But Doing Very Well",The financial sector got hit very hard with the coronavirus crisis following record low interest rates on the one hand and record high unemployment numbers on t,2020-05-30T08:11:54Z
"Bank Of Nova Scotia: Not Business As Usual, But Doing Very Well",The financial sector got hit very hard with the coronavirus crisis following record low interest rates on the one hand and record high unemployment numbers on t,2020-05-30T08:11:54Z
Edited Transcript of BLL earnings conference call or presentation 7-May-20 3:00pm GMT,Q1 2020 Ball Corp Earnings Call,2020-05-30T03:35:56Z
Edited Transcript of FIBRAMQ12.MX earnings conference call or presentation 13-May-20 12:30pm GMT,Q1 2020 Macquarie Mexico Real Estate Management SA de CV Earnings Call,2020-05-30T03:06:57Z
India unlikely to see #39;revenge shopping#39; when lockdown opens: Atul Bhole,Some of the agrochemical/ fertiliser companies may come out less impacted as they were categorised as essentials and the rural areas were also less impacted due to lock-down.,2020-05-30T02:31:56Z
MOGU Inc. American Depositary Shares (eachrepresenting 25 Class A Ordinary Shares) (MOGU) Q4 2020 Earnings Call Transcript,"MOGU earnings call for the period ending March 31, 2020.",2020-05-30T01:31:16Z
Apollo Global Management: For When Blood Runs The Street,"Apollo used the corona-downturn to its advantage. Increase in permanent capital makes the business more stable. Funds are being raised, and deals are being made",2020-05-29T23:13:31Z
"Global Defense Budget to 2028 By Department, End Allotment and Region with Profiles of Key Players Including Boeing, Lockheed Martin. Northrop Grumman and Raytheon","DUBLIN, May 29, 2020 /PRNewswire/ -- The ""Global Defense Budget Analysis - Forecast to 2028"" report has been added to ResearchAndMarkets.com's offering. The US Defense budget accounts for the majority of global defense spending. If the US Defense budget is tr…",2020-05-29T20:15:00Z
Closed-End Funds: Eaton Vance's Option Funds,"Eaton Vance offers many respectable funds. Today, I wanted to give a broad overview of the option based funds we don't discuss very often. I also wanted to touc",2020-05-29T19:43:05Z
Lumos Pharma's (LUMO) CEO Rick Hawkins on Q1 2020 Results - Earnings Call Transcript,"Lumos Pharma, Inc. (NASDAQ:LUMO) Q1 2020 Earnings Conference Call May 28, 2020 4:30 PM ET Company Participants Lisa Miller – Director-Investor Relations Rick Ha",2020-05-29T19:20:50Z
Bio-Rad: A Very Interesting Short-Term Investment Thanks To Gains On Sartorius Holding,Bio-Rad's 2 Core business divisions: Life Sciences and Clinical Diagnostics posted so-so results in Q120 delivering net profits of $74m. Although both divisions,2020-05-29T18:46:26Z
Canadian Western Bank (CBWBF) CEO Christopher Fowler on Q2 2020 Results - Earnings Call Transcript,"Canadian Western Bank (OTCPK:CBWBF) Q2 2020 Earnings Conference Call May 29, 2020, 10:30 ET Company Participants Matthew Rudd - SVP, Finance & IR Christophe",2020-05-29T17:41:07Z
Canadian Western Bank (CBWBF) CEO Christopher Fowler on Q2 2020 Results - Earnings Call Transcript,"Canadian Western Bank (OTCPK:CBWBF) Q2 2020 Earnings Conference Call May 29, 2020, 10:30 ET Company Participants Matthew Rudd - SVP, Finance & IR Christophe",2020-05-29T17:41:07Z
Wall Street retreats ahead of Trump#39;s response on Hong Kong,"President Donald Trump, who has warned of a tough response to China#39;s move, is expected to make an announcement later in the day.",2020-05-29T16:40:02Z
5 Top Canadian Oil Stocks To Buy In 2020,"Pessimism about the Canadian oil and gas sector might be at an all time high but for medium to long-term investors, these stocks might be attractive buys.",2020-05-29T16:00:09Z
3 Top Stocks to Recession-Proof Your Portfolio,Defensive stocks don't have to be stodgy consumer companies.,2020-05-29T15:00:00Z
Panic Selling Costs More Than A Dividend Cut - A Review Of America First Multifamily,"When a company cuts or suspends their dividends, the price drops, more often than not. As we look at what has happened with many examples, the price actually be",2020-05-29T12:35:00Z
Futures Drop As Markets Brace For Trump's China Response,"Futures Drop As Markets Brace For Trump's China Response

 Tyler Durden
 
Fri, 05/29/2020 - 08:06

 Emini futures dropped on Friday as investors braced for President Donald Trump’s response to China’s national security legislation for Hong Kong, threatening t…",2020-05-29T12:06:00Z
"Taking Stock: Volatile Friday! Nifty reclaims 9,500; Sensex rallies over 200 points","Sectorally, the S&P BSE Realty index gained 4.5 percent, BSE Oil & Gas index 3.4 percent and BSE FMCG index was up 2.8 percent.",2020-05-29T11:07:03Z
"How Farmers Insurance, GM Financial, And Tryg Grew Customer Loyalty During The Pandemic","As the pandemic crisis unfolded weekly in March, companies with an eye for customer experience, like GM Financial, Farmers Insurance, and Tryg, built customer loyalty by staying on top of what their customers had to say.  They used AI technologies like chatbo…",2020-05-29T11:06:17Z
BRP Inc (DOOO) Q1 2021 Earnings Call Transcript,"DOOO earnings call for the period ending April 30, 2020.",2020-05-29T10:30:40Z
Building portfolio: Experts bet on 21 scrips to create wealth in coming years,Aashish Somaiyaa of Motilal Oswal Asset Management Company advised that one should avoid panic and remain invested.,2020-05-29T07:28:33Z
"Buy Quess Corp, target price Rs 360: Motilal Oswal",The brokerage has welcomed corrective steps being taken by the new management toward addressing some of the investor concerns around governance.,2020-05-29T07:03:18Z
Salesforce.com Inc (CRM) Q1 2021 Earnings Call Transcript,"CRM earnings call for the period ending April 30, 2020.",2020-05-29T07:00:52Z
Salesforce's (CRM) CEO Marc Benioff on Q1 2021 Results - Earnings Call Transcript,"Salesforce (NYSE:CRM) Q1 2021 Earnings Conference Call May 28, 2020 5:00 PM ET Company Participants Evan Goldstein – Senior Vice President of Investor Relations",2020-05-29T04:37:06Z
DXC Technology Company (DXC) Q4 2020 Earnings Call Transcript,"DXC earnings call for the period ending March 31, 2020.",2020-05-29T00:30:33Z
Advance Micro Devices' (AMD) CEO Lisa Su on Bernstein 36th Annual Strategic Decisions Conference,"Advance Micro Devices, Inc. (NASDAQ:AMD) Bernstein 36th Annual Strategic Decisions Conference May 28, 2020 9:00 AM ET Company Participants Lisa Su – President a",2020-05-28T19:50:48Z
MiX Telematics Limited (MIXT) CEO Stefan Joselowitz on Q4 2020 Results - Earnings Call Transcript,"MiX Telematics Limited (NYSE:MIXT) Q4 2020 Earnings Conference Call May 28, 2020 08:00 ET Company Participants John Granara - Chief Financial Officer Stefan Jos",2020-05-28T18:50:44Z
MiX Telematics Limited (MIXT) CEO Stefan Joselowitz on Q4 2020 Results - Earnings Call Transcript,"MiX Telematics Limited (NYSE:MIXT) Q4 2020 Earnings Conference Call May 28, 2020 08:00 ET Company Participants John Granara - Chief Financial Officer Stefan Jos",2020-05-28T18:50:44Z
MiX Telematics Limited (MIXT) Q4 2020 Earnings Call Transcript,"MIXT earnings call for the period ending March 31, 2020.",2020-05-28T18:00:34Z
Kinross Gold: As Good As It Gets,KGC posted a profit of $122.7 million or $0.10 per share in first-quarter 2020 compared to a profit of $64.7 million or $0.05 in the same quarter a year ago. To,2020-05-28T17:47:24Z
"BRP (DOOO) CEO, José Boisjoli on Q1 2021 Results - Earnings Call Transcript","BRP Inc. (NASDAQ:DOOO) Q1 2021 Earnings Conference Call May 28, 2020 9:00 am ET Company Participants José Boisjoli - President, Chief Executive Officer Sébastie",2020-05-28T17:19:04Z
Lite Access Technologies - An Essential Business In The Booming U.K. Telecom Build,Tremendous growth opportunity with a long runway. Undervalued and overlooked player with a rapidly growing backlog. Specialized telecom construction company wit,2020-05-28T15:15:00Z
"Yes Bank exits FO segment, no new contracts to be available for trading from May 29",The NSE in its circular dated March 6 had said that no futures and options contracts shall be available for trading in Yes Bank from May 29 onwards.,2020-05-28T12:35:33Z
Bulls Vs. Bears: We Share Our Views,"There are always two sides to every story. With the markets having retraced most of their declines, we take stock of both the bull and the bear cases. We dissec",2020-05-28T12:35:00Z
"Futures Tread Water In Calm Before US-China Storm, Trump Twitter Crackdown","Futures Tread Water In Calm Before US-China Storm, Trump Twitter Crackdown

 Tyler Durden
 
Thu, 05/28/2020 - 08:11

 The S&P's remarkable stretch of posting gains in the overnight session continued for another day, with the S&P rising as high as 3,053, and l…",2020-05-28T12:11:04Z
"SHINER INTERNATIONAL, INC. (BEST) Q1 2020 Earnings Call Transcript","BEST earnings call for the period ending March 31, 2020.",2020-05-28T12:01:03Z
Hologic Is Trading Near Its All-Time High. Is It Still a Good Buy?,The company's COVID-19 testing platform is just part of the reason for the stock's jump.,2020-05-28T11:48:00Z
"Sensex rises for 2nd day, jumps 595 points; Nifty ends May F&O series at 9,490",Financials contributed the most to benchmark Sensex’s 595-point gain.,2020-05-28T11:08:49Z
"Stock-index futures edge higher after Dow retakes 25,000","Stock-index futures trade mostly higher Thursday, a day after the Dow Jones Industrial Average closed above 25,000 and the S&P 500 retook the 3,000 level in a rally fueled by optimism over the reopening of the economy in the wake of the COVID-19 lockdowns.",2020-05-28T11:07:36Z
4 Reasons Why Canopy Growth Could Bounce Back in 2020,"The pot stock's been struggling over the past year, but there are plenty of reasons to be optimistic about its future.",2020-05-28T11:04:00Z
"Telecom, pharma will be new leaders in post-Covid market: Raamdeo Agrawal",Pharma stocks are back on the radar after years of underperformance.,2020-05-28T09:36:04Z
"Accumulate L&T Infotech, target price Rs 2,038: Angel Broking",The brokerage expects the company to outperform the sector.,2020-05-28T09:02:37Z
RBI stops 7.75% savings bonds: here are the alternatives,When small savings rates were cut in April 2020—PPF for instance now gives 7.1% whereas Senior Citizens Savings Scheme (SCSS) gives 7.4%—the RBI bonds became the highest interest paying instrument.,2020-05-28T07:43:53Z
"Sensex reclaims 32K, Nifty above 9,400; 5 factors boosting sentiment",The broader markets also participated in the run with Nifty Midcap index rising 1.3 percent and Smallcap up 1.7 percent.,2020-05-28T06:25:57Z
"BEST, Inc. (BEST) CEO Johnny Chou on Q1 2020 Results - Earnings Call Transcript","BEST, Inc. (NYSE:BEST) Q1 2020 Earnings Conference Call May 27, 2020, 21:00 ET Company Participants Johnny Chou - Founder, Chairman & CEO Gloria Fan - CFO C",2020-05-28T05:58:06Z
Newmont: Time For A Pause,"Revenues were $2.58 billion, and net income was $822 million or $1.02 per share in 1Q'20 compared to $87 million or $0.16 per share the same quarter a year ago.",2020-05-28T05:55:09Z
Deutsche Bank’s Chadha Calls Time on U.S. Megacap Outperformance,"(Bloomberg) -- The blistering run in a handful of huge U.S. stocks is coming to an end and now is the time to favor financial and energy shares, according to Deutsche Bank AG.Positioning looks “stretched” in the 10 largest companies, including Microsoft Corp.…",2020-05-28T04:05:20Z
"Fin24.com | SA financial system under stress, headed for 'extraordinary shocks' - Reserve Bank","The South African Reserve Bank says SA's financial system is under growing stress, with people expected to struggle servicing their debt, or keep their insurance policies in place. Meanwhile, those who have money to save are already opting for short-term vehi…",2020-05-28T04:00:40Z
SE Asia Stocks-Most rise on hopes of economic recovery; Sino-U.S. tensions cap gains,"Most Southeast Asian stock markets rose
on Thursday as signs of economic recovery from the COVID-19
pandemic offset concerns across the region about a rise in
Sino-U.S. tensions over Hong Kong and trade.
    MSCI's broadest index of Asia-Pacific shares outsid…",2020-05-28T04:00:05Z
"MedMen Enterprises, Inc. (MMNFF) Interim CEO Tom Lynch on Q3 2020 - Earnings Call Transcript","MedMen Enterprises, Inc. (OTCQB:MMNFF) Q3 2020 Earnings Conference Call May 27, 2020 17:00 ET Company Participants Zeeshan Hyder - Chief Financial Officer Tom L",2020-05-28T03:54:03Z
"Coherent, Inc. (COHR) CEO Andy Mattes on Q2 2020 Results - Earnings Call Transcript","Coherent, Inc. (NASDAQ:COHR) Q2 2020 Results Conference Call May 27, 2020 04:30 PM ET Company Participants Bret DiMarco - EVP and General Counsel Andy Mattes -",2020-05-28T02:33:08Z
Coherent Inc (COHR) Q2 2020 Earnings Call Transcript,"COHR earnings call for the period ending April 4, 2020.",2020-05-28T02:30:35Z
ASX 200 Index: Bulls break the 50% mean-reversion mile stone,Australian shares have made a 50% mean reversion and are destined to the 61.8% golden ratio. This is a Fibonacci retracement level for which its count,2020-05-28T02:11:24Z
South Korean Bank Stocks Are the Least-Loved Equities in Asia,"(Bloomberg) -- South Korean bank stocks have gone from cheap to extremely cheap in a matter of months as concerns grow over their loan books tied to the nation’s flagging property sector.The MSCI Korea Financials Index, in which banks carry a 65% weighting, i…",2020-05-28T01:26:22Z
Fidelity High Dividend ETF's High Exposure To Cyclical Sectors Will Drag Its Performance In The Current Recessionary Environment,"FDVV focuses on large-cap, high-yield dividend stocks. The fund has a high exposure to cyclical sectors and these sectors may underperform in a post-COVID-19 wo",2020-05-28T00:03:10Z
"Companies managing troubled Ontario long-term care homes run dozens more, make millions in profits","A report military members wrote while helping in the care homes was released publicly, detailing 'deeply disturbing' conditions at the five Ontario homes",2020-05-27T23:42:32Z
Three Warren Buffett Tech Stocks to Buy,"Berkshire Hathaway’s (NYSE: BRK.A) (NYSE:BRK.B) owner Warren Buffett is the most popular investor who built his $89.9 billion net worth by investing in value companies. He was among the few who profited from the 2008 crisis. In the current Covid-19 crisis, he…",2020-05-27T23:36:29Z
"The Rally Continues, Now Thanks To Small-Caps (Technically Speaking For 5/27)","The EU and Japan have announced major stimulus programs. While existing home sales have dropped sharply, new home sales are surprisingly resilient. The markets",2020-05-27T22:29:16Z
Most actively traded companies on the TSX - Yahoo Canada Finance,"<ol><li>Most actively traded companies on the TSX  Yahoo Canada Finance
</li><li>Here's How I'd Spend $10000 on the TSX Today  The Motley Fool Canada
</li><li>North American equity markets rally into the close  BNNBloomberg.ca
</li><li>S&P/TSX composite hi…",2020-05-27T21:13:00Z
SPDR Portfolio S&P 500 Growth ETF's Exposure To Technology Stocks Is Advantageous,SPYG invests in large-cap growth stocks in the S&P 500 Index. The fund’s relatively lower exposure to cyclical sectors is advantageous as the impact of COVID-19,2020-05-27T21:12:13Z
B2W - Gain Exposure To The Brazilian Online Retail Sector,Brazilian e-commerce has been growing at 11.1% for the past two years and is projected to grow by 5.5% for the next three years without considering the effects,2020-05-27T21:05:30Z
Here's Why Wells Fargo and Other Bank Stocks Soared Wednesday,Financials have been one of the strongest parts of the stock market recently.,2020-05-27T20:36:00Z
Dow Up More Than 500 Points on Economic Confidence,"Shares of retailers like Macy's, Kohl's, and the Gap rose sharply as investors cheered evidence that the economy is recovering. | Economy",2020-05-27T20:34:51Z
Star Bulk Carriers Corp (SBLK) Q1 2020 Earnings Call Transcript,"SBLK earnings call for the period ending March 31, 2020.",2020-05-27T20:30:26Z
"Stocks rise as investors seize on virus treatments, economy's reopening",Stocks were mixed Wednesday as the economy continued its slow return to life amid hopes for more federal stimulus and a scientific advances against the coronavirus.,2020-05-27T20:17:00Z
ATS Automation Tooling Systems Inc. (ATSAF) CEO Andrew Hider on Fiscal Q4 2020 Results - Earnings Call Transcript,"ATS Automation Tooling Systems Inc. (OTCPK:ATSAF) Q4 2020 Earnings Conference Call May 27, 2020 10:00 AM ET Company Participants Stewart McCuaig - Vice Presiden",2020-05-27T18:38:03Z
Workday Shares Have Become A GARP Story - And A Good One At That,"Workday will be announcing the results of its fiscal Q1 (ended 4/30/30) this Wednesday, May 27th. At this point, expectations are muted reflecting the extent to",2020-05-27T15:19:07Z
SL Green: Buy Manhattan's Largest Office Landlord At A Steep Discount,SL Green Realty is the largest office landlord in Manhattan and managed by a crew who has worked together through several previous crises. A 9% yield looks to b,2020-05-27T13:14:41Z
"S&P Futures Storm Back Over 3,000 On ""Recovery Hopes"", Stimulus Bonanza","S&P Futures Storm Back Over 3,000 On ""Recovery Hopes"", Stimulus Bonanza

 Tyler Durden
 
Wed, 05/27/2020 - 08:28

 A few weeks ago we proposed that what ""Phase 1 trade deal hopes"" were for 2019, so ""Economic Recovery hopes"" would be for 2020, and the overnigh…",2020-05-27T12:28:40Z
The Home Depot: A Surprising Secular Growth Stock,"Many retailers have failed during the Amazon era, but Home Depot continues to thrive, whilst maintaining its lead in the home improvement retail sector. Home De",2020-05-27T11:58:09Z
The Home Depot: A Surprising Secular Growth Stock,"Many retailers have failed during the Amazon era, but Home Depot continues to thrive, whilst maintaining its lead in the home improvement retail sector. Home De",2020-05-27T11:58:09Z
The Shape Of Economic Progress In The Time Of Pandemic,"The economic downturn brought about by COVID-19 is unlike any recession in recent memory, and the nature of the nation’s recovery is anticipated to follow suit.",2020-05-27T11:00:00Z
Is now the right time to be buying ASX bank stocks?,"There are a few important takeaways that can be gleamed from the breathtaking rally in ASX bank stocks on Wednesday. Here's what every ASX investor needs to know...
The post Is now the right time to be buying ASX bank stocks? appeared first on Motley Fool Aus…",2020-05-27T07:17:14Z
